id,title,name,dialog,select_text
381,,Iron Fist,Me… me neither.,
382,,*,"Iron Fist, I've been meaning to ask, what type of letter is it?",
383,,Iron Fist,Ummm.... uh.. It's….,
384,,*,Are you okay? Your face is red.,
385,,Iron Fist,"No, it's not!",
386,,Iron Fist,It's just a letter that has a secret chocolate recipe in it!,
387,,*,Chocolate?,
388,,*,"Ah, it must be a really delicious recipe for it to be this important to you.",
389,,Iron Fist,It's... it's okay,
390,,*,"(She seems really down, I should find a way to cheer her up.)",
391,,Iron Fist,"Senpai, why are suddenly grabbing my hand...",
392,,*,"There seems to be some fun events happening there. Let's go check it out ---- Ah, why is your face so red! Are you all right?",
393,,Iron Fist,I'm... I'm fine,
394,,Iron Fist,Senpai... what is this?,
395,,*,"""30 Minutes Chocolate Making Contest"" --- Let's give it a try! Seems like it'll be lots of fun!",
396,,Iron Fist,But... but...,
397,,*,"Well, are you going to be down the whole time if you can't find your secret recipe? I can't accept that...",
398,,*,"Even if there isn't a secret ingredient in the chocolate, chocolates made with love are the best, that's what I think!",
399,,Iron Fist,"Wow, Senpai, you're really cool!",
400,,*,"Don't undermine my cooking skills! You may think that I can't cook, but even a guy like me can make instant noodles!",
401,,Iron Fist,"Even while saying silly things, Senpai is still cool!",
402,,*,What's silly!,
403,,,The contest was surrounded by crowds of people.,
404,,Iron Fist,"Eek, I'm so nervous. There are so many people watching below the stage. Luckily Senpai is here to give me courage.",
405,,Iron Fist,Senpai?? You seem more nervous than me.,
406,,*,Is... is this salt? Why does it taste like sugar?,
407,,*,"Damnit, added the wrong ingredient.",
408,,*,Ahhh! The milk spilled over! It's spilling over the edge of the table!,
409,,Iron Fist,……,
410,,Iron Fist,I... I have to focus. Senpai is always encouraging me.,
411,,Iron Fist,"This time, I have to be more reliable so that Senpai can rely on me too.",
412,,Iron Fist,"Senpai, let me take over.",
413,,Iron Fist,"Pass the mold to me, you can be in charge of stirring.","Wow, Iron Fist is really competent|I feel embarrassed"
414,,*,"Iron Fist, you really shine when you're so focused.",
415,,Iron Fist,"Senpai, if you compliment me, I'll blush.",
416,,Iron Fist,But the compliment makes me happy too.,
417,,Iron Fist,"Ah, I think it's done.",
418,,Iron Fist,"Senpai, could you please take them out of the fridge.",
419,,*,I suddenly feel quite helpless.,
420,,Iron Fist,"No way, Senpai! You've helped me so much!",
421,,Iron Fist,"When Senpai is around, I can always feel calm.",
422,,Iron Fist,Even if you might not know anything about cooking.,
423,,Iron Fist,And may be clumsy in the kitchen I still---,
424,,*,"All right, all right, I get it... Iron Fist...",
425,,*,My heart is aching already.,
426,,Iron Fist,It's done!,
427,,*,Amazing!,
428,,Iron Fist,"Ahhhh... Senpai!! Oops, sorry, am I getting too carried away?",
429,,*,"Don't worry about it. Iron Fist, you should be more confident like just now. Your confidence truly shone through.",
430,,Iron Fist,(Blushes),
431,,*,"Your chocolates are adorable, it's even peach-shaped.",
432,,Iron Fist,It's…meant to be heart-shaped.,
433,,*,"Ah, I'm sorry... But all in all, you're were really great out there.",
434,,*,"These chocolates are filled with our love, blood and sweat and is the world's most unique chocolates ever!",
435,,*,"In comparison to a chocolate recipe that is replicated, these chocolates are way more precious to me.",
436,,Iron Fist,Sen... senpai,
437,,Iron Fist,Can I give these unique chocolates to you?,
438,,Iron Fist,"Ah, I know we made this together and I'm giving it to you but...",
439,,*,I'm really happy!,
440,,*,My first chocolates received on Valentine's Day! My Valentine's has been made!,
441,,Iron Fist,Ah! It's the first chocolates Senpai received…? I'm so glad!,
442,,Iron Fist,Really... really glad.,
443,,,"Seeing her happy face, I felt extremely happy too.",
444,,,"This counts as a meaningful day too, right?",
445,,,Even if I didn't make it to the main chocolate contest.,
446,A Crown for You,*,"I didn't think a necklace would mean so much to you, Phoenix.",
447,,Phoenix,"Well, it's my very first precious treasure that I made.",
448,,*,"I'm not sure that ""treasure"" is the correct word here...",
449,,Phoenix,"Well, achievers don't worry over small matters. Senpai, let's go investigate quickly!",
450,,*,This is all quite sudden and I'm not sure what to make of it.,
451,,*,"If you're asking for help, at least let me know what's going on?",
452,,Phoenix,"It's very simple. My necklace has disappeared, if we catch the two thieves that came to disrupt the school last night then I should be able to find it.",
453,,*,Last night?,
454,,Phoenix,"There was a huge disturbance last night, Senpai, were you not aware? And I thought only a fool could've slept through it.",
455,,*,"Well, I'm sorry but not only did the fool keep on sleeping but he was even in deep sleep!",
456,,Phoenix,"Ah, I'm sorry!",
457,,Phoenix,"They are very famous thieves recently, specializing in stealing valuable items, my necklace must have been targeted.",
458,,Phoenix,They even sent out a notice saying they're going to steal something valuable from Yume Academy.,
459,,Phoenix,"At the time, nobody took it seriously... We just thought they could be easily handled.",
460,,*,That means all of us who went to bed on time should get an apology!,
461,,Phoenix,Didn't I already say sorry! Then I'll apologize again! I'm sorry!,
462,,*,....,
463,,*,"So, what kind of necklace do you have? A ruby necklace? Emerald? Black pearl? Maybe it's a diamond necklace...",
464,,Phoenix,It's roses...,
465,,*,...,
466,,Phoenix,It's a necklace made of roses.,
467,,*,Come again???,
468,,Phoenix,"Yes, it's handmade personally and the only one that exists in the whole wide world...",
469,,*,"(Without expression) Oh, sure, I get it. I don't think I'm feeling so well anymore...",
470,,Phoenix,Fist of Justice---!,
471,,*,Ka-pow!!,
472,,,10 Minutes Later,
473,,Phoenix,"Sorry, I couldn't control my strength. Once you're a bit better then let's get going, Senpai!",
474,,*,I should've just ran off to the contest instead of getting mixed in all this.,
475,,Phoenix,"Senpai, there is a saying that goes ""if you can't do anything to prevent it, you might as well sit back and enjoy it.""",
476,,*,(Speechless...),
477,,Phoenix,"Senpai, what's wrong, you look terrible.",
478,,*,……,
479,,*,"Nevermind, let's just figure out where to find it.",Maybe it wasn't stolen|It could be lost somewhere
480,Truth Hurts,*,"After all, you said they are famous thieves, maybe they're not interested in quirky things.",
481,,*,Peculiar thieves also have aesthetics. I believe they can tell between what's valuable and what's not.,
482,,Phoenix,Divine Punishment!!!,
483,,*,Ka-pow! A stronger version of the last punch...!,
484,,Phoenix,"Ah, I accidentally threw in punches again! Senpai! Senpai!",
485,,Phoenix,Senpai's not very tough is he? Passing out so quickly.,
486,,,"The moment I fainted, a thought crossed my mind",
487,,,Don't joke with sensitive people... it could cost you your life.,
488,,*,What if it was simply lost. Let's try and search for it first.,
489,,Phoenix,"Well... since you're adamant about it, I'll reluctantly believe it. Reluctantly.",
490,,*,"You don't have to force yourself, you know?",
491,,Phoenix,The field... the classroom... Mmm... the classroom was where the necklace was created.,
492,,*,Then let's head to the classroom first.,
493,,Phoenix,Then FULL SPEED AHEAD!,
494,,*,(Phoenix is really energetic),
495,,*,Well I guess that's her trait after all.,
496,,Phoenix,What?,
497,,*,"Oh, nothing. Let's continue",
498,,*,Why is that necklace so important? Are you giving it to someone?,
499,,Phoenix,"No, that necklace was personally handmade--",
500,,Phoenix,It's the first time I've made something beautiful and the result was outstanding! It's a precious memory that I want to cherish.,
501,,*,……,
502,,Phoenix,"Even an impatient person like me can make such beautiful things. It is true that if you work hard, anything is possible.",
503,,*,So you were really not joking?,
504,,Phoenix,How rude! You seem like you deserve another punch.,
505,,*,"Ah, we're at the classroom. Let's see.... Ah, guess it's not here after all.",
506,,Phoenix,Don't change the subject!,
507,,,"After that, we checked the field and the self-study room.",
508,,,With only the girl's bathroom remaining to be searched.,
509,,,Phoenix is really full of energy.,
510,,*,"And so, this lively day went by just like that.",
511,,Phoenix,And we still couldn't find it. It must've been stolen then.,
512,,*,I honestly think that even a mere thief wouldn't steal such a thing.,
513,,*,"Ah~ Even if a day was wasted, I feel strangely happy.",
514,,*,We've managed to accomplish nothing and yet it felt highly accomplishing too.,
515,,Phoenix,"What does that mean, Senpai?",
516,,*,It means that just having you beside me makes me feel naturally happy!,
517,,Phoenix,This... Is this a compliment?,
518,,*,I guess... so...,
519,,*,"Ah, Phoenix, look... Is that the necklace you were searching for?",
520,,Phoenix,Where? Where?,
521,,Phoenix,Oh my! Why is it in the trash pile！ Margaret--,
522,,*,... Margaret?,
523,,Phoenix,"Yes, it's the name I gave to my first handmade item. After all, it's something that's cherished.",
524,,*,I think whatever I say wouldn't matter.,
525,,Phoenix,"Then don't say it. Senpai, isn't Margaret great!",
526,,*,"If it's a Halloween prop, yea, it's great.",
527,,,"From the look, it looks more like a flower crown...",
528,,Phoenix,"You honestly have no imagination, Senpai",
529,,*,"Who's head can actually fit through this ""necklace"".",
530,,,Hmm?,
531,,,Phoenix gently leaned closer and held out her hand.,
532,,*,Yea...?,
533,,Phoenix,"If it's flower crown? Then so be it. Just know that Margaret is priceless! Seeing that you've helped me all day, Senpai, I'll give the crown to you.",
534,,,It may have been the setting sun or a mirage,
535,,,But Phoenix seemed to be blushing.,
536,,*,"Oh, I should say, I'm honored.",
537,,,(Although I would've preferred chocolates.),
538,,Phoenix,Here!,
539,,*,What is this?,
540,,Phoenix,"It's chocolates! I bought it along the way, but I have to say Margaret is worth much more--",
541,,*,When did you even... buy it?,
542,,Phoenix,I went to buy it when I asked you to keep watch as I searched the girl's bathroom.,
543,,Phoenix,"But since you were so focused on counting ants while waiting, I decided not to disturb you and go check out other locations.",
544,,*,If it weren't for you I wouldn't be counting ants…!,
545,,,I was on the lookout for an hour and got bored.,
546,,Phoenix,"Sorry, you looked really focused.",
547,,*,"(Wow, she's really innocent. Not being able to read the situation)",
548,,Phoenix,"Well then, Margaret and the chocolates are my Thank You gift to you, Senpai! By the way, it's a Thank You gift, not a Valentine's Day gift.",
549,,Phoenix,But when you said you were quite happy being with me.,
550,,Phoenix,I felt really happy when I heard it.,
551,,Phoenix,"Thank you for today, Senpai!",
552,,,Phoenix looked quite happy.,
553,,,"And as I wore the flower crown, I thought,",
554,,,perhaps this dusty crown,
555,,,is indeed more valuable than the chocolates.,
556,Best Partner,*,I'll punish them! Punish them!,
557,,Rogue,"Seeing you more worked up than me, then I'm relieved.",
558,,*,Of course! I am a Senpai of justice!,
559,,Rogue,Then I trust that my justice partner will catch the thieves together!,
560,,Rogue,"Well, I hope you're not bluffing.",
561,,*,"You take everything too seriously, Rogue.",
562,,Rogue,Then let's go--,
563,,,After a long and hard 10 minutes walk later...,
564,,*,(Rogue has an impeccable amount of energy.),
565,,*,(Almost too incredible),
566,,Rogue,"Senpai... please don't look so glum, we've only been investigating fot 10 minutes",
567,,*,But a 10 minute thorough investigation 3 times around campus is too much--,
568,,*,At least don't force others to do things when I don't have monstrous strength like you. I'm quite slender.,
569,,Rogue,Who's a monster!,
570,,*,"Besides, aimlessly searching serves no purpose.",
571,,,We're just heading in at full speed raid.,
572,,,"(As a highly professional detective, shouldn't you be collecting clues and making a conclusion based on them.)",
573,,Rogue,"Of course there was a purpose. On site investigation is important. I trust my instincts, there must be some clues over there--",
574,,Rogue,Please! My heavenly instincts! Bless me now and let me find my clues as you've blessed gambling!,
575,,*,This is not the situation where you pray to God…,
576,,,"(What the hell is ""blessed gambling""? What kind of life has she been living up till now.)",
577,,Rogue,"Well then, my instincts tell me that --- we should head this way next.",
578,,*,A haunted… haunted house?,
579,,,Why is there such a facility at the Valentine's Day celebration event? Does the organizer have a certain hobby?,
580,,,Is it not actually for their entertainment?,
581,,Rogue,"Senpai, what's wrong? Don't tell me, you're actually scared?",
582,,*,──,As if! Let's head in!|Why do we have to investigate in a haunted house?
583,Spooked Out,*,Who…who's scared? It's not like I've never seen a ghost.,
584,,Rogue,"Besides ghost, there might be vampires too.",
585,,*,"(So apart from Wraith, Dracula might make a guest appearance too…?)",
586,,Rogue,"Senpai, your expression really doesn't hide anything. Wraith and Dracula would definitely not be here.",
587,,Rogue,There might be ancient monsters lurking inside.,
588,,*,"Who… who're you trying to scare? I'll show you, let's head in.",
589,,*,(Opens the door vigorously) Hey! All you fake ghosts and monsters I'm not afraid of…,
590,,,Booooo----,
591,,*,Ahhhhh!,
592,,Rogue,"Ah, he flew pretty far--",
593,,Rogue,"Senpai, really? Did you not read the sign on the front door that says ""Do not enter"".",
594,,Rogue,"Getting hit by such a small monster created from subtle magic. Wow, Senpai, you're lame.",
595,,Rogue,"Ah, well. Guess I still have to head in on my own after all. Having an extra hand doesn't mean it'll be useful.",
596,,,"And just like that, Rogue left without hesitation.",
597,,,"I laid on the ground and thought,",
598,,,who would have a haunted house at a Valentine's event? It doesn't make sense.,
599,,*,Why do we have to go to a haunted house?,
600,,Rogue,"Because the most dangerous place in the world is the safest place. Stolen things should be hidden in the dark, right?",
601,,Rogue,"Senpai, let's go in together!",
602,,*,(Why do I get the feeling that Rogue only came to have fun.),
603,,*,"What is this ""Do not enter through front door""? What's that supposed to mean?",
604,,Rogue,It means what it says. The real entrance is on the side~,
605,,,This? The thing that looks like a window is an entrance?,
606,,,Speechless,
607,,Rogue,"Senpai, what are you waiting for, an open invitation? Are you coming in?",
608,,*,Please wait a minute.,
609,,,Senpai leaves for 3 minutes.,
610,,Rogue,What is all this?,
611,,*,"No, I just bought some small ornaments. I just thought… nevermind… Don't mind it!",
612,,Rogue,"Cross pendant, garlic, silver nails, salt… etc. This clearly shows you're scared.","Well, I am!|Let's think of what to do next"
613,,*,You already said I'm slender.,
614,,Rogue,"Well, you're Senpai!",
615,,Rogue,Act like a Senpai! Ya-hoo!,
616,,*,Ahh-- Don't hit me--!!,
617,,Rogue,What are you screaming for? I was just catching the garlic that was falling. Don't need to get scared!,
618,,*,Ah--- What is that in front?,
619,,*,So what's next?,
620,,Rogue,Let's enter from the side and see.,
621,,*,"Is there anyone that visits this haunted house… Ah, I'm pretty tired from all this walking.",
622,,Rogue,Senpai… you just lack exercise.,
623,,？？？,(A deep growl),
624,,*,How do they hide such a big monster in such a small house?,
625,,Rogue,"That's probably because it doesn't have a physical form and is just a virtual image created from magic. With such little magic, one punch and it'll probably shatter.",
626,,*,"Or more like, if I was to get hit by it, the one's that's shattering is me.",
627,,Rogue,"Senpai, you seriously lack training. Do you need me to train you ""Rogue-style""?",
628,,*,"No, thank you. The training style sounds dreadful already.",
629,,*,"(That means, this dark space is filled with all sorts of magic)",
630,,*,"Is that what a ""haunted house"" is like? And I thought it's something where frightening things jump out to scare you.",
631,,Rogue,"For someone that was frightened a moment ago, what are you saying?",
632,,*,"Have you always had such a toxic mouth, Rogue?",
633,,Rogue,It's called a sharp tongue!,
634,,？？,Roooarrr---,
635,,*,Ahh!,(Be brave and punch it)|(Hide behind Rogue)
636,A Disastrous Valentine,*,Hi-ya!,
637,,Rogue,Wait! That's..!,
638,,,Pow!,
639,,Rogue,"It you hit a magic virtual image, it will repulse.",
640,,,"As my body flew into the air like a deflated balloon whizzing off, I thought to myself…",
641,,,This is the worst Valentine's Day ever!!!,
642,,Rogue,"Senpai, please don't jump over so suddenly.",
643,,*,"Ah, sorry.",
644,,*,But this haunted house is quite scary… in a certain way.,
645,,*,"But you don't seemed to be scared at all, Rogue. So what's the point of this pointless haunted house?",
646,,Rogue,"Senpai, didn't you read the notice board?",
647,,*,What notice board?,
648,,Rogue,"""Win an exclusive gift by passing all monstrous levels"".",
649,,*,What the hell is this Rpg look and feel! There is no need to use the haunted house…,
650,,Rogue,"Then let's go, Senpai! The gift is ours!",
651,,*,Aren't we investigating for clues?,
652,,*,(It's really like Rogue to think and do whatever she wants. I'm a little envious sometimes.),
653,,*,(With such bravery and a swift fighting style),
654,,*,"(No no, what am I secretly admiring her here for?!)",
655,,*,It's decided! I shall pluck up my courage like Rogue! I can't lose to her!,Escape |Dash into the haunted house
656,Confined,*,You have to be brave even when running for your life too!,
657,,Rogue,This idiot!,
658,,Rogue,That's the wrong way!,
659,,*,"Damn, what's happening?",
660,,*,(Steps onto thin air),
661,,*,Ahhhhh----,
662,,Rogue,"It was written on the notice board, Senpai. ""Those who do not follow the rules shall be punished""",
663,,* (from below),Why is there such a large confinement room underneath a seemingly small house?,
664,,Rogue,"You better do some reflecting down there. You'll probably only be able to get out in half a day. Well, I'll be off to catch the thieves.",
665,,*,Rogue...?,
666,,,"Seeing Rogue leave without a moment's hesitation, I fell into deep thought…",
667,,,"No matter how you look at it, a haunted house on a Valentine's Day probably an omen.",
668,,,Clang--,
669,,*,Aren't there too many traps set up here,
670,,Rogue,"Senpai..? Ah, he passed out from the flying spatula. But where did this spatula come from?",
671,,,A short while later…,
672,,*,Where am I?,
673,,Rogue,Outside the haunted house!,
674,,*,Then…,
675,,Rogue,"Yep! I won first place! You slept for quite a while too, Senpai. I started wondering what I should do.",
676,,*,You could've woken me up!,
677,,,This weird haunted house has already wasted plenty of time.,
678,,Rogue,"Well, just as I was about to splash water on you, luckily you woke up. Guess you probably had a feeling it was coming?",
679,,*,…,
680,,*,"Say, Rogue. Why are you so hell bent on catching these thieves? You don't seem like a person that likes to trouble yourself.",
681,,Rogue,"Ah, that's because KongMing is furious about the theft and is adamant on catching them. Besides, you can get a full year's allowance for catching them.",
682,,*,So that's why..,
683,,Rogue,"And she said furiously that whoever catches the thieves and brings them to her, will receive all the chocolates exhibited at the chocolate contest.",
684,,*,"(Firmly) Well then, let's bring the thieves to justice together, Rogue!",
685,,Rogue,Good. Although you must've been motivated by some particular reason. But keep up the enthusiasm!,
686,,KongMing (from afar),Rogue--- is that you?,
687,,Rogue,"Ah, KongMing is coming over.",
688,,KongMing,"Rogue, can I ask you to deliver the next batch of chocolates to the venue?",
689,,Rogue,Hm?,
690,,KongMing,"The stolen ones are the first batch since the previous venue was not large enough, we separated the batches… but who would've thought…",
691,,KongMing,(Grrr) Who would've thought the first batch would disappear without a trace.,
692,,KongMing,So help me deliver this batch to the venue and I shall grant you a reward.,
693,,Rogue,"Really? Then, sure!",
694,,*,(Will the chocolate reward be given as well?),
695,,KongMing,"Senpai, why're you here too?",I want to help KongMing|Happened to cross by
696,,KongMing,Thank you for your help.,
697,,KongMing,"As long as it is safely delivered, rewards of equal value will be given.",
698,,*,"Don't worry, we won't fail you!",
699,,,Rewards of equal value…,
700,,,Maybe it's the limited version chocolates! I'm so excited!,
701,,*,Rogue! Wait up!,
702,,KongMing,It is said that only the culprit will return to the scene of the crime after the crime…,
703,,KongMing,"Appearing here at this time makes you seem suspicious, Senpai.",
704,,*,……,
705,,,If Rogue would just think when analyzing the situation.,
706,,,Then we wouldn't be wasting this much time.,
707,,KongMing,What are you muttering under your breath about?,
708,,*,I'm just expressing my feelings of being Rogue's assistant.,
709,,*,"Ah, please don't suspect me, even if I may be drooling over the chocolates, but I wouldn't steal them.",
710,,*,Safely delivering the chocolates is also my duty.,
711,,KongMing,"Well, indeed, the more people, the safer it may be. Thanks for the trouble then.",
712,,*,"Let's deliver the chocolates together then, Rogue.",
713,,Rogue,"Sure, although I don't think that delivering chocolates takes two people.",
714,,,The delivery process of the chocolates were unexpectedly peaceful.,
715,,*,"But you're really good, Rogue",
716,,Rogue,"Of course, I was always favored by the Gods of gambling.",
717,,*,Not that.,
718,,*,In comparison to you… I think I'm still far behind.,
719,,,She's always so energetic,
720,,Rogue,"Don't worry, Senpai. There are certain things that you can't do but there are certain things that only you can do.",
721,,Rogue,"Although you can be lame at times, but Yume Academy wouldn't be the same without you. That's what I think.",
722,,*,Are you trying to comfort me?,
723,,,Guess she still knows how to comfort others at least.,
724,,*,"Only things that I can do, like what?",
725,,Rogue,Well… you will have to figure it out yourself. I'm not good at thinking about complicated things.,
726,,*,Must be nice to be worry-free.,
727,,,"And just like that, the chocolates were safely delivered to the venue.",
728,,*,Ah… it went surprisingly well.,
729,,Rogue,"Yea, the peculiar thieves didn't appear again either.",
730,,*,But why do you get all the reward and I didn't even get a single chocolate.,
731,,Rogue,Probably due to the exhibition. Didn't KongMing give you a scroll?,Do you want it instead? |But I don't want it
732,,Rogue,This is an honorary medal awarded by KongMing! How can you not want it?,
733,,Rogue,"Even if a useless, it can be hung in the house to ward off evil spirits",
734,,*,That sounds worse.,
735,,Rogue,"If you want to give away what others have given you, that's more outrageous!",
736,,Rogue,"Senpai, when you're like that",
737,,Rogue,I don't even know whether I should give this to you,
738,,*,So where should I hang it then? I don't need a useless reward.,
739,,Rogue,"Then what reward do you want, Senpai?",
740,,Rogue,Like... this one?,
741,,Rogue,"Then… this is for you, Senpai.",
742,,*,Huh? Chocolates? But why is it in a skeleton shape?,
743,,Rogue,"It was the first prize that I won from the haunted house! You looked down, so I decided to give it to you instead.",
744,,Rogue,"Even though it wasn't made by me, I still hope that you can accept it as if I did.",
745,,*,?,
746,,Rogue,Thanks to Senpai today that I'm really happy. I've always spent this day alone and having someone to spend it with was really fun!,
747,,Rogue,Also your sleeping face was funny too.,
748,,*,Please forget about the part where I was knocked out.,
749,,Rogue,So… please accept it.,
750,,Rogue,I had a great time with Senpai. I just wanted to convey that.,
751,,*,"Wow, Rogue is quite thoughtful.",
752,,*,I thought she was more annoying at first.,
753,,,"As the day came to an end, she wore a big smile as I turned and showed her a happy ""peace"" sign.",
754,,,And indeed it was one Happy Valentine's Day delivery success!,
755,Valentine's Again,*,A new day… begins… again…,
756,,*,A new… day…,
757,,*,A… new…,
758,,*,Gahhh! Why is it still February 14th!!,
759,,*,"Oh my, I think my headache is getting worse…",
760,,*,(What is going on?),
761,,*,Speaking of which…,
762,,*,Who are you??,
763,,,"In that instant, my hand swiftly picked up my dollar store cup and threw it across…",
764,,？？？,How does someone just throw something over without a second thought…,
765,,？？？,At least ask who it is!,
766,,*,Ah… This voice…,
767,,*,Krystal??,
768,,Krystal,"Yes, it's me, Senpai.",
769,,*,You surprised me…!,
