id,title,name,dialog,select_text
770,,*,What are you doing on my rooftop?,
771,,Krystal,That's not the point,
772,,Krystal,(Lightly hops off),
773,,Krystal,"Senpai, I have something to ask you, but I need you to answer truthfully.",
774,,*,"(For some reason, my heart started to pound from her serious gaze towards me).",
775,,*,Krystal… Aren't we a bit too close…,
776,,Krystal,Senpai --,
777,,*,Wait -- I'm not ready for your confession yet--,
778,,Krystal,Senpai… Can you please focus! I have something to ask you.,
779,,Krystal,How many February 14th have you experienced?,
780,,,What is she saying…?,
781,,*,Krystal… Don't tell me… You too?,
782,,Krystal,"Judging by your reaction, I guess I'm right.",
783,,Krystal,"Actually, I've been observing you these couple of days.",You're stuck too?|Observing?
784,,*,Have you been experiencing a repetition too?,
785,,Krystal,Yep!,
786,,,Then… why didn't she say anything from the start?,
787,,,As if she had noticed my confusion…,
788,,,Krystal replies---,
789,,Krystal,I wasn't sure whether you noticed it.,
790,,Krystal,It took me awhile to confirm too.,
791,,Krystal,After all… You are a bit strange at times…,
792,,,"Hey, that's mean.",
793,,,Wait! Observing?,
794,,Krystal,"Yep, I saw you getting blasted off into the sky and when you were knocked out by a spatula…",
795,,*,"Okay, stop----",
796,,,"What ""observation"", this is more like being surveilled!",
797,,,"Also, why did she have to witness all the embarrassing things!",
798,,Krystal,"Senpai, please listen to me carefully.",
799,,Krystal,I think we're stuck in a time loop.,
800,,,What...?,
801,,Krystal,Do you still remember the strange phenomenon that occurred?,
802,,*,The astrological event that occurred the night before Valentine's Day when the stars aligned?,
803,,,"Sorry, seems like I really fell into deep sleep.",
804,,Krystal,I think that was the beginning of it all.,
805,,Krystal,My power is the ability to grant the wishes of others…,
806,,Krystal,And the energy shift from that strange phenomenon fused into my magic…,
807,,Krystal,Not only that but it also collectedly accepted multiple wishes.,
808,,Krystal,"The only way to escape this time loop is to fulfill all the wishes. Otherwise, February 14th will repeat forever.",
809,,*,What?!,
810,,,How did this happen…,
811,,*,Speaking of... That's when my inexplicable headache started as well.,
812,,Krystal,"Senpai, I think that's partially due to my powers as well.",
813,,Krystal,But not entirely for that reason.,
814,,Krystal,"In addition to the magnetic field from the sky, my magic range seems to be disturbed by other external forces.",
815,,Krystal,"In order to solve this mystery,",
816,,Krystal,we'll just have to try and fulfill the rest of the wishes to see.,I think my headache's gotten worse.|The rest...?
817,,Krystal,How did this happen…,
818,,Krystal,"Senpai, can you still hold on?",
819,,Krystal,"If you can hold on for awhile longer, I can take you to the infirmary to see Raphael.",
820,,*,It won't help.,
821,,,I've been there already.,
822,,,Although I didn't end up getting a check up…,
823,,,I guess the only way now is to find out how to escape the time loop.,
824,,*,"Krystal, what do we need to do to find the rest of the wishes?",
825,,,How many are left exactly?,
826,,Krystal,One.,
827,,Krystal,That' s right. From what I'm aware of… there is one left.,
828,,Krystal,"A wish like ""I want a well-spent Valentine's Day"" or ""I want to send out chocolates on Valentine's Day""…",
829,,Krystal,Something of the sort.,
830,,*,！！,
831,,Krystal,All that's left now is to fulfill that last wish for the time loop to be broken.,
832,,Krystal,And we can finally escape from this endless cycle of February 14th.,
833,,,I see… So that's how it is.,
834,,Krystal,"Senpai, will you find the last wish with me?",
835,,Krystal,"It seems that because of this confined energy field, my perception and memory are a bit muddled…",
836,,,Do I even have the choice to refuse?,
837,,*,"Sure, of course.",
838,,,Looking across the school that's filled with laughter and joy.,
839,,,It suddenly felt unbelievable,
840,,,that all these people relived the past four days without realizing it.,
841,,*,Remarkable,
842,,Krystal,"Yep, there is no one else that is conscious of the four days that occurred, only you hold the memories of these four days.",
843,,*,A memory of reliving the same days…,
844,,,But each day was different.,
845,,*,"Krystal, shouldn't we enjoy the day too?",
846,,Krystal,What do you mean?,
847,,*,As the saying goes... to live in the present.,
848,,Krystal,Ah…,
849,,*,There's some balloons…,Take one and pass it to Krystal.|Quietly admires them.
850,,Krystal,Hm?,
851,,*,Thought you'd might like one.,
852,,Krystal,"Ye.. yea, I do.",
853,,*,The color of this balloon goes well on you.,
854,,Krystal,Really?,
855,,Krystal,Hm? What's this?,
856,,Krystal,"Senpai, do you like balloons too?",
857,,*,Yea,
858,,,The colorful balloons look like soft cotton candy.,
859,,*,"Krystal, are you hungry?",
860,,Krystal,Why are you asking this suddenly,
861,,*,Look over there!,
862,,Krystal,Hm? What's that?,
863,,,It's the stall that makes cotton candy.,
864,,,The colorful cotton candy are all gathered together.,
865,,*,"""Make your own cotton candy""",
866,,*,Looks fun! Do you wanna try?,
867,,*,I was getting hungry anyway.,
868,,Krystal,Sure!,
869,,*,Let's see… First select the sugar….,
870,,*,The sugar is…,
871,,Krystal,"This one, right?",
872,,Krystal,(Adds),
873,,*,"Thanks Krystal, were you blushing?",
874,,Krystal,Ah… No…,
875,,*,Then gather it in a circle like this…,
876,,*,"Ah, Krystal! Yours is ready!",
877,,Krystal,What?,
878,,Krystal,"Ah… sorry, I was lost in thought.",
879,,Krystal,"(Just now, Senpai… Looked quite handsome when he was focused).",
880,,Krystal,Uh…,
881,,*,You unexpectedly dyed your cotton candy all sorts of colors while lost in thought.,
882,,Krystal,Ah…,
883,,*,But I think it's great!,
884,,*,Just like the colors of a rainbow.,
885,,Krystal,Yea,
886,,*,White balloons and rainbow cotton candy…,
887,,Krystal,Hmm?,
888,,*,It unexpectedly all suits you.,
889,,Krystal,Re.. really?,
890,,,"Pure, yet richly sentimental.",
891,,,A little reckless and presumptuous.,
892,,,"This is surely Krystal, after all.",
893,,Krystal,"Senpai, over there…",
894,,*,Let's see…,
895,,*,A ring tossing stall?,
896,,,Is this really a Valentine's Day school festival? Seems more like a mixed carnival.,
897,,*,Are you interested in it?,
898,,Krystal,(Nods),I'll show you how it's done.|Let's go try it together.
899,,Krystal,Senpai…,
900,,Krystal,You don't have to force yourself.,
901,,*,Damn it…,
902,,,What's the difference between shooting hoops and ring tossing.,
903,,,"Then again, I'm not the type that is good at shooting hoops either.",
904,,,But this success rate--,
905,,Krystal,"Here, let me try.",
906,,Krystal,"Senpai, which one do you want?",
907,,Krystal,Really?,
908,,*,"Of course, even though we need to find clues.",
909,,*,But this day also only happens once a year.,
910,,*,We should enjoy it.,
911,,Krystal,Senpai…,
912,,Krystal,It's great that I chose to find clues with you.,
913,,*,That's… amazing!,
914,,Krystal,What?,
915,,,The pile of effortless prizes won is undoubtedly Krystal's triumph.,
916,,,Amazing….,
917,,,In a way…,
918,,,…it's also amazing,
919,,,…that I was unable to win anything.,
920,,Krystal,"Senpai, please don't be down… This…is for you.",
921,,*,This is…?,
922,,,A beautifully wrapped box.,
923,,Krystal,Please only open it when you get home.,
924,,*,Sure…,
925,,,"After that, we went to several other places.",
926,,,"Goldfish fishing, flower arrangement contest…",
927,,,Although we probably shouldn't be wasting time here.,
928,,,But… Krystal seemed to be enjoying herself.,
929,,*,The evening came quickly.,
930,,Krystal,Yea,
931,,,"I don't know why, but seeing Krystal holding all her prizes that she won made me feel happy too.",
932,,*,"Hm, what's that?",
933,,,"At that moment, the darkened sky suddenly illuminated with fireworks.",
934,,,Whoosh-- bang bang --- hiss,
935,,,The fireworks exploded into the shape of a flower.,
936,,,It's bright beautiful colors,
937,,,clustered together.,
938,,*,A firework show?,
939,,Krystal,There wasn't this show the previous night,
940,,Krystal,Maybe time has started to flow.,
941,,*,(In thought),
942,,Krystal,"I really enjoyed myself today, Senpai. Thank you!",
943,,,"Beneath the fireworks, her cheeks reflected with the colors of happiness.",
944,,*,I'm really happy too.,
945,,,Night. Clock strikes 23:00.,
946,,*,"Now then, time for bed.",
947,,*,(Switches off lights),
948,,,"February 15th, 06: 00 am",
949,,*,Haaaa----,
950,,,Unwraps box,
951,,,It's a box of chocolate…,
952,,*,The ribbon is even tied into a bow.,
953,,*,I see... the final wish was Krystal's wish.,
954,,,"Speaking of which, it was indeed a remarkable five days.",
955,,,The five days of February 14th.,
956,,,Although I couldn't experience a traditional Valentine's Day.,
957,,,But what does a guy like me need tradition for anyway?,
958,,,The only regret is that I couldn't make it to the chocolate contest…,
959,,*,"(Wait, chocolate contest?)",
960,,,Speaking of which.,
961,,,Who were the two peculiar thieves that snuck into school?,
962,,,Ordinary people… can't get in…,
963,,,What's the point of stealing chocolates…,
964,,*,Speaking of chocolates,
965,,*,Krystal...,
966,,,The chocolate seems to have been carefully wrapped.,
967,,*,I had a great Valentine's Day too.,
968,,*,"I think my mind was playing tricks... Well then, Phoenix, let's just say our farewells and be on our way. Take care!",
969,,Phoenix,Wh.. What? Please wait---,
970,,*,"Phew, I finally got away.",
971,,*,Hmm hmm hmm~,
972,,*,Uh oh… I've already wasted a lot of time… Guess I should dash straight to the destination then!!,
973,,*,"Ah, I don't mean you, Raphael! You're the highlight of my day.",
