id,name,desc,skill_desc1,skill_desc2,skill_desc3,skill_desc4
853007,Turin,"1. A Warrior who can counterattack all her enemies at a time in House Monster, usually placed in Front-line;\n2. Turin can counterattack all her enemies at a time once she got attacked, this skill ensures her high damage potential, she also has rate to immune control skills to ensure her counterattacks can be triggered successfully;\n3. Her skill set ensures Turin qualified in both PVP and PVE situations.",Turin's Active skill deals damage against enemies in Back-line and increases the Damage Reduction of Turin;\n The skill mainly aims to buff Turin herself.,"Buff skill, changes Turin's Basic attack to target 4 random targets, also allows the Basic attack to have a chance to Stun its targets.","Buff skill, increases Turin's Hp, Attack, Control immunity, and damage against Stunned targets.","Core skill, allows Turin to counterattack all her enemies at a time, greatly boosts her offensive ability."
853008,Toyo,1. A damage dealer in House Monster;\n2. Toyo can Burn her enemies in many methods;\n3. Toyo has a high Hp enough for her to complete all what she needs to do.,"Toyo's Active skill deals damage against enemies in Front-line and apply DoT damage on them;\nAfter Toyo Graduates to 6-star, the skill will pick 3 random enemies;\nAfter Toyo reaches 10-star, the DoT damage of the skill will be replaced with Burning damage.","Buff skill, increases Toyo's Attack and Hp.","Buff skill, allows Toyo to Burn her enemies by chance with each of her attack.","Counter skill, allows Toyo to Burn the attackers by chance after taking hits."
853009,Masamune,"1. A Warrior in House Monster, usually placed in Front-line;\n2. Masamune's active skill has a chance to Stun its target, which might help her team to win a battle;\n3. She can also counterattack after taking Crit damage.","Masamune's Active skill deals damage to all the enemies in Back-line, it also has a chance to Stun the targets;\nAfter Masamune reaches 10-star, the skill will also have a chance to deal extra damage to its targets.","Buff skill, increases Masamune's Armor and Hp.","Counter skill, enables Masamune to counterattack the enemy who triggered Crit Attack on her; It's not a very useful skill.","Buff skill, increases Masamune's Damage Reduction (once each battle) when her HP is below a certain amount."
853010,Hexa,"1. A damage dealer with burst damage skill in House Monster;\n2.After Hexa is graduated to 6-star, her Active skill will target the enemies in Back-line and her Basic attack will target the enemy with the lowest HP. These two skills make her a great threat to the damage dealers of her enemies;\n3. After 9-Star, Hexa can also heal herself by attacking her enemies, which also increases her own survivability.","Hexa's Active skill deals damage against the enemy with the lowest Hp;\nAfter Hexa Graduates to 6-star, the skill will target 2 random enemies in Back-line;\nAfter Hexa reaches 10-star, the skill will also provide Hexa extra Crit.","Buff skill, increases Hexa's Attack, Crit, and Hp.","Buff skill, allows Hexa to gain extra Attack from every defeated enemy;\nThis enables Hexa able to deal more damage as she survives longer.","Buff skill, changes Hexa's Basic attack target to the enemy with the lowest Hp, and grants her life-steal;\nThe skill enhances Hexa's survivability."
853011,Psychic,"1. A widely used support in House Monster;\n2. Psychic can weaken her enemies while granting her allies extra energy to boost their potential in dealing damage in PVE situations;\n3. She can also provide an AoE control to the entire enemy team when her Hp is lowered to 50% (once each battle), this greatly boosts her team in PVP situations.","Psychic's Active skill deals damage against 4 random enemies and weakens them, it will also provide extra energy to a random ally;\nThe skill can greatly boost the potential of the team in dealing damage.","Buff skill, changes Psychic's Basic attack target to all the enemies in the Back-line and reduces the Armor of her targets, making them more fragile to the damage dealers in Psychic's team;\n The skill also enables Psychich to heal 2 random allies.","Buff skill, increases Psychic's Hp, Speed, and Damage Reduction;\nAfter Psychic reaches 10-star, the skill will provide 60 Speed, which ensures Psychic can move earlier than most of the other girls.","Counter skill, allows Psychic to have a great chance to Stun all of her enemies (once each battle) when her HP is below a certain amount;\nAfter Psychic reaches 9-star, the rate of the Stun will be increased to 75%."
854001,Amazon,"
1. A damage dealer with some control ability in House Fairy;
2. Her Basic Attack targets 3 random enemies.
3. Amazon has a high basic Speed, this ensures she can move earlier than others in a round;
4. Her skill has a chance to Silence all her targets and can increase her Damage Reduction and Control immunity, this ensures her to deal damage without getting close to any threat.","Amazon's Active skill deals damage to all the enemies and has a chance to Silence them;\nAfter Amazon reaches 10-star, the skill will also provide her extra Damage Reduction and Control Immunity.","Buff skill, increases Amazon's Attack, Crit, and Crit Damage.","Buff skill, allows Amazon to gain extra Attack and Crit Damage from each defeated enemy.","Buff skill, allows Amazon to Poison and Silence the targets of her Basic attack by chance."
854002,Bud Elf,"1. A Warrior with good survivability in House Fairy, usually placed in Front-line;\n2. Bud Elf has enough Hp to take tons of damage, she can also heal herself from the Crit attack of her allies, this makes her a reliable tank for the team;\n3. Bud Elf Burn her enemies by triggering her Active skill or taking hits, this could also increase her potential in dealing damage.","Bud Elf's Active skill deals damage against all her enemies and Burns them;\nAfter Bud Elf reaches 10-star, it will also increase her Attack and Crit.","Buff skill, increases Bud Elf's Armor and Hp.","Healing skill, allows Bud Elf to heal herself when her allies trigger a Crit attack;\nTo increase her survivability, you can choose to team her up with the girls with high Crit.","Counter skill, allows Bud Elf to Burn and reduce the Armor of the attacker when she takes hits;\nThis skill makes Bud Elf more than a tank."
854003,Himoto,"1. A damage dealer who can deal burst damage in House Fairy;\n2. Himoto can get extra Crit and Crit Damage from her passive skills, and her Basic attacks target the enemy with the lowest Hp, makes her a great threat to the enemies who have poor survivability;\n3. Himoto's Active skill will also Bleed Mage targets.","Himoto's Active skill deals damage to a random enemy in Back-line, it will also bleed Mage targets;\nAfter Himoto Graduates to 6-star, the target of the skill will be increased to 2 random enemies in Back-line.","Buff skill, increases Himoto's Crit and Crit Damage.","Buff skill, changes the target of Himoto's Basic attacks to the enemy with the lowest Hp and lowers the target's Attack.","Buff skill, enables Himoto to Poison her targets by chance;\nThis gives her a chance to fit herself into a team mainly made up of the girls who have skills related to Poison."
854004,Nani,"1. A supporter who can fit herself in many different lineups in House Fairy;\n2. Nani can both provide Attack and Armor for her allies and reduce the Attack and Armor of her enemies, which makes her a perfect supporter for almost all kinds of teams;\n3. She is still a supporter so she will still need to rely on some strong allies.","Nani's Active skill deals damage against all her enemies and reduces their Attack, the skill will also increase the Attack of her allies;\nAfter Nani reaches 10-star, the skill will also have a chance to add Critical Marks on the targets, which will support her team in dealing damage.","Buff skill, increases Nani's Hp.","Buff skill, allows Nani's attacks to reduce the Armor of all her enemies.","Buff skill, allows Nani to increase the Armor of her team (once each battle) when her HP is below a certain amount."
854005,Lavia,"1. A damage dealer who can deal burst damage in House Fairy;\n2. Lavia has a decent basic Attack attribute, her skills also provide her some survival and control ability.","Lavia's Active skill deals damage against all the enemies in Back-line and has a chance to Stun Warrior-class targets;\nAfter Lavia reaches10-star, the skill will have a chance to control Ranger-class targets instead of Warriors, it will also have a chance to Silence Mage-class enemies, which helped her better control the damage dealers of her enemies.","Buff skill, enables Lavia's attacks to reduce the Armor Break of her targets.","Buff skill, increases Lavia's Attack and Crit.","Healing skill, allows Lavia to heal herself when each of her enemies is defeated, increases her survivability."
854006,Susan,"1. A Warrior who can take a lot of damage in House Fairy, usually appears in Front-line;\n2. Susan has high Damage Reduction and Hp attributes, which promises her a decent survivability.\n3. Susan is able to counterattack and reduce the Crit of her enemies after taking hits from them, her Active skill can even steal Armor from her enemies and heal herself, which means her survival ability is way better than others.","Susan's Active skill deals damage against her enemies in Front-line and steals Armor from them, it increases Susan's own survival ability while weakening her enemies;\nAfter Susan reaches 10-star, the skill will also heal her, which greatly increases Susan's survivability.","Counter skill, allows Susan to lower the Crit of the attackers after taking hits, which will lower the offensive ability of the enemy team.","Buff skill, increases Susan's Hp and Damage Reduction.","Counter skill, allows Susan to counterattack the attackers after getting hits from them by chance."
854007,Aquaris,"1. A flexible girl in House Fairy;\n2. Aquaris could get boosts in different attributes according to the position she was placed, generally speaking, she can get boosts in offensive ability when placed in Back-line and get survival ability when placed in Front-line, she can even increase her own Attack and Crit when her HP is below a certain amount.","Aquaris's Active skill deals damage to 2 random enemies and heals herself;\nAfter Aquaris Graduates to 6-star, the skill will target 3 enemies;\nAfter Aquaris reaches 10-star, the skill will also provide her extra Crit and Crit Damage.","Buff skill, allows Aquaris to receive extra Crit and healing from each of her own attacks (Basic attack included);\nAfter Aquaris Graduates to 6-star, the skill will also provide her extra Speed.","Buff skill, increases Aquaris's Attack and Crit when placing her in Back-line, increases Aquaris's Hp and Precision when placing her in Front-line.","Buff skill, increases Aquaris's Attack and Crit (once each battle) when her HP is below a certain amount."
854008,KongMing,"
1. An outstanding healer who can also be treated as a damage dealer in House Fairy;
2. KongMing can heal all her allies and increase her own Attack, Crit, and Hp. When equipping her with gears that provide boosts in Attack, it will increase her potential in both healing and dealing damage;
3. After KongMing reaches 9-star, she will have a 100% chance to Silence all her enemy (once each battle) once her Hp is lower than 50%;
4. She can fit in many kinds of lineups in almost all kinds of situations.",KongMing's Active skill deals damage against 4 random enemies and heals all her allies;\nThe healing amount of this skill is higher than most of the other healers.,"Buff skill, increases KongMing's Attack, Hp and Crit.","Buff skill, improves KongMing's Basic Attack and provides it life-steal.","Buff skill, allows KongMing to Silence all her enemies (once each battle) when her HP is below a certain amount;\nAfter KongMing reaches 9-star, the chance of the Silence will be increased to 100%."
854009,Pandaria,"
1. A damage dealer in House Fairy;
2. Her Basic Attack targets 3 random enemies.
3. Pandaria can Poison her enemies in different ways;
4. Pandaria can deal extra damage against Poisoned enemies, this makes her a suitable member of the lineups with girls who have skills related to Poison.","Pandaria's Active skill deals damage against 3 random enemies and Poisons them;\nAfter Pandaria Graduates to 6-star, the skill will target 4 random enemies;\nAfter Pandaria reaches 10-star, the skill will also reduce the Speed of the targets.","Buff skill, increases Pandaria's Crit and Attack.","Buff skill, allows Pandaria to Poison her target after she triggers a Critical attack on the target;\nTo ensure the skill can be triggered more, you will need to increase Pandaria's Crit.","Buff skill, increases Pandaria's damage against Poisoned enemies;\nThis skill makes her a suitable member of the lineups with girls who have skills related to Poison."
854010,Linky,"1. A supporter who can increase her teammates' damage by tagging marks on her enemies in House Fairy;\n2. Her support method is unique from other supporters, the enemies with her marks will take more damage from each attack, and the marks could benefit all Linky's allies;\n3. Linky can heal herself after she triggers a Critical strike.","Linky's Active skill deals damage against 2 random enemies and tags her mark to them;\nThe enemies with marks will receive extra damage from each attack;\nLinky's mark can benefit all her allies, so if she survives longer in a battle, she will help her allies more.","Buff skill, increases Linky's Attack, Crit and Hp.","Buff skill, allows Linky to receive healing from each Critical strike of her;\nThe healing rate is high enough to increase her survivability.","Buff skill, changes Linky's Basic attack to target 2 random enemies and tag her marks on them;\nWith this skill, Linky will be able to tag her marks on her enemies quicker."
855001,瓦拉斯基,此處為填充文本,此處為填充文本,此處為填充文本,此處為填充文本,此處為填充文本
855002,Amelia,"1. A damage dealer who has control abilities in House Demon;\n2. After awakened to 10-Star, Amelia's active skill targets all enemies, and has a chance to steal Energy from them. The chance of her basic attack petrifying her enemies is increased, and her passive skill grants her extra Speed, Hp, and Skill Damage, making her useful in all sorts of situations; \n3. As girls from House Demon are relatively harder to upgrade, it may be wise to plan your resources carefully if you plan on awakening her to a higher star rank.","Amelia's Active skill deals damage to all enemies, and has a chance to petrify them and steal their Energy, stopping them from using their skills.","Buff skill, enabling her basic attacks to decrease Energy of her enemies and granting a chance to petrify them.","Buff skill, increasing her Skill Damage, HP, and Speed; \nAfter Amelia reaches 10-star, this skill will grant her 60 Speed.","Buff skill, increases Amelia's Attack and reduces her Armor (once each battle) when her HP is below a certain amount."
855003,Wraith,"
1. A Damage-dealer that can deal strong bursts of damage in House Demon; 
2. Whenever an ally girl uses their active skill, Wraith will gain Energy through her passive skill, enabling her to use her active skill more frequently; 
3. If the enemy has more HP than her, she can deal extra damage that is equivalent to a certain percentage of the enemies\' total HP (the damage will max out at 1500% of her Attack), making her incredibly useful when battling Bosses (Friend Boss, Guild Boss...); 
4. Her passive skill grants her both Energy and HP, increasing her survivability; 
5. As girls from House Demon are relatively harder to upgrade, it may be wise to plan your resources carefully if you plan on awakening her to a higher star rank.","Wraith's Active skill deals damage to 1 random enemy. If the target has more HP than her, her skill will deal extra damage that is equivalent to a certain percentage of the enemies' total HP. Furthermore, using this skill will increase her Crit; \nThis skill makes her powerful against enemies with high HP, and the increased Crit is just icing on the cake; \nAt 10-Star, her skill targets two enemies, and hits harder on priests.","Buff skill, allows Wraith to gain extra energy and HP when allies use their skills; \nIf there are multiple Wraiths in the team, they will be able to regain their Energy and HP continuously.","Buff skill, increases Wraith's HP, Speed and Armor Break, makes her immunity to Silence; \nWith this skill, you won't have to worry for Wraith when facing against enemies that can silence your girls.","Buff skill, Wraith's basic attack changed to attack a random backline enemy. This will also decrease the target's Energy. \nThis skill targets girls that are usually set in the backline, and can make sure they won't be able to use their Active skills as frequently as they would like to."
855004,Scythe,"
1. A Warrior with resurrection abilities in House Demon; 
2. Deals remarkable damage with her Round Marks, and can petrify her enemies. Furthermore, her self-healing and resurrection abilities ensure her survival, making her suitable to be set in the Frontline to soak up incoming damage; 
3. Her resurrection skill, when paired with girls like Esau & Jacob(extra damage to all enemies) or Saint(extra Attack and Skill Damage for self), will greatly enhance their abilities and deal a great amount of damage to enemies; 
4. As girls from House Demon are relatively harder to upgrade, it may be wise to plan your resources carefully if you plan on awakening her to a higher star rank.","Scythe's Active skill deals damage to back-line enemies and marks them with a Round Mark that explodes one round later, causing extra damage. The skill also provides some survivability (Damage Reduction) for Scythe; \nAfter awakened to 10-Star, this skill has a chance to tag the targets with an extra Round Mark; \nThis skill enables Scythe to deal a great amount of damage and helps her survive with the extra Damage Reduction.","Buff skill, tags the target with a Round Mark when she deals a basic attack, dealing extra damage in the next round. Furthermore, it has a chance to petrify the target.","Counter skill, tags the attacker with a Round Mark, and has a chance to regenerate self HP, increasing her survivability.","Resurrection skill, after Scythe reaches 9-star, she will resurrect with all her HP after being defeated once."
855005,Lucifer,"
1. Damage dealer specializing in DoTs in House Demon; 
2. Whenever an ally uses her active skill, Lucifer gains extra energy and Skill Damage, enabling her to use her active skill more frequently. As the battle drags on, her Skill Damage will gradually increase. Paired with the Bleeding Damage from her active skill, she can dish out incredible damage; 
3. Lucifer, when paired with other girls that can use their active skills frequently, will also be able to use her active skill for many times during the battle, ending it swiftly; 
4. Her active skill counters Rangers, which makes her a good choice when facing against teams mainly consisting of Rangers (such as in Tests); 
5. As girls from House Demon are relatively harder to upgrade, it may be wise to plan your resources carefully if you plan on awakening her to a higher star rank.",Lucifer's Active skill targets all enemies and Bleeds them. Her Bleeding damage against Rangers will be boosted;\nThis skill makes Lucifer strong against teams that mainly consists of Rangers.,"Buff skill, increases Lucifer's Attack, Skill Damage, and HP.","Buff skill, each basic attack grants Lucifer extra Speed and Attack; \nThis makes it possible for her to deal more damage not only with her active skill, but with her basic attack as well.","Buff skill, allows Lucifer to gain extra Skill Damage and Energy whenever an ally uses her active skill, enabling her to use her active skill more frequently."
855006,Esau & Jacob,"
1. A Damage Dealer in House Demon; 
2. Esau & Jacob has remarkable Speed. Paired with their Damage Reduction, Control Immunity and Energy reduction, the twins perform well in all types of situations, both dealing damage and helping the team; 
3. Paired with girls like Giana and Diva, when they are defeated, the enemies will suffer great damage; 
4. As girls from House Demon are relatively harder to upgrade, it may be wise to plan your resources carefully if you plan on awakening her to a higher star rank.","Esau & Jacob's Active skill deals great damage to one enemy. If the target is in the Frontline, this will lower the target's Armor and petrify them; if the target is in the backline, this will lower their Attack and Speed; \nAs Esau & Jacob has (or should it be have?) a high Speed stat, they would be able to weaken the enemies, enabling their allies to deal more damage.","Buff skill, increases Esau & Jacob's HP, Damage Reduction, Speed, and Control Immunity, enabling them to survive longer in the battle; \nAfter Esau and Jacob reaches (or should it be reach?) 7-Star, they will gain 100% Control Immunity, and enemies that can control them are no longer a threat.","Buff skill, basic attack targets the enemy with lowest HP, and lowers their Energy; \nThis will ensure that the enemy won't be able to use their active skill as they would like to.","Core skill, whenever a girl is defeated (both ally and enemy), the twins will deal remarkable damage against all enemies; \nWith this skill, Esau & Jacob secured a position in teams that focus on dealing damage through the girls' defeat. When all other girls on the team are defeated, Esau & Jacob would be able to deal a great amount of damage to the enemies, defeating them in turn."
856001,Angel,"
1. An all-rounder in House Angel; 
2. When attacked, Angel can heal herself, ensuring her survival; 
3. Every basic attack will grant her extra Holy Damage, enabling her to deal more damage as the battle drags on; 
4. As girls from House Angel are relatively harder to upgrade, it may be wise to plan your resources carefully if you plan on awakening her to a higher star rank.","Angel's Active skill deals damage against 4 enemies, heals 3 allies and increases their Holy Damage; \nAs Angel can deal damage, heal, and enhance her allies' abilities, she can be useful in all sorts of situations.","Buff skill, basic attack heals herself and grants extra Holy Damage, increasing her survivability and her ability to deal damage.","Buff skill, increases Holy Damage, Attack, Crit, and HP.","Counter skill, allows Angel to heal herself and get extra Holy Damage when attacked."
856002,Gabriel,"
1. A damage dealer that can deal burst damage to crowds in House Angel;
2. Her Basic Attack targets the enemies in front-line;
3. Gabriel has great survivability; once fully-trained, she would be able to absorb a remarkable amount of damage; 
4. Gabriel\'s skill set is focused on Critical Strikes: she can tag enemies with Critical Strike Marks that are triggered by Critical Strikes, and she gains Crit for every basic attack; 
5. As girls from House Angel are relatively harder to upgrade, it may be wise to plan your resources carefully if you plan on awakening her to a higher star rank.","Gabriel's Active skill deals damage to all enemies and tags them with a Critical Strike Mark. Whenever a target is attacked by a Critical Strike, the mark will explode, causing great damage; \nAt 10-Star, the skill has a chance to tag the targets with an additional mark.","Buff skill, increases Gabriel's HP, Holy Damage, Crit, and Damage Reduction.","Buff skill, every Basic attack of Gabriel tags the target with a Critical Strike Mark and grants her extra Crit; \nPaired with her active skill, Gabriel will be able to deal a lot of damage to her enemies.","Counter skill, whenever Gabriel is attacked, she can tag the attacker with a Critical Strike Mark, and gains extra Crit Damage."
856003,Michael,"1. A Support girl with resurrection abilities in House Angel; \n2. Michael shines in all situations: at 10-Star, she is immune to all types of control effects; her active skill both deals damage and heals her allies; after she is defeated, she can come back to life with a full bar of HP; \n3. As girls from House Angel are relatively harder to upgrade, it may be wise to plan your resources carefully if you plan on awakening her to a higher star rank.","Michael's Active skill deals damage to 3 random enemies, and has a chance to stun them. Furthermore, it can heal the ally with lowest HP; \nAt 10-Star, the amount healed reaches 400% of her Attack, and grants the ally extra Crit; \nThis skill ensures that the girls that need healing will receive it, saving them from imminent defeat.","Buff skill, increases Michael's Holy Damage, Attack, and Speed.","Resurrection skill, after Michael reaches 8-star, she will resurrect with all her HP after being defeated once.","Buff skill, increases Michael's Control Immunity. After Michael reaches 9-star, she will be completely immune to any type of control effects."
