id,name,desc,skill_desc1,skill_desc2,skill_desc3,skill_desc4
851001,Sapphire,"1. A Priest-class damage dealer in House Ghost;\n2. Her Active skill has a chance to Petrify the enemies in Back-line while providing Precision for her teammates. Her Basic attacks will reduce the Block rate of her targets, increasing the gradual damage of her entire team;\n3. Her basic Speed is low, so if her Speed is increased she will take advantage of move order in a round and perform better in Tests or PVP situations.","Sapphire's Active skill deals damage to the enemies in Back-line and has a chance to Petrify them;\nSapphire has a high basic Attack attribute, so the skill will perform better if it can be triggered earlier.","Buff skill, enables Sapphire's Basic Attack to hit all the enemies in the Front-line, it will greatly weaken the girls with high Block rate (such as Guan Yin, Javelin and Nobunaga).","Buff skill, increases Sapphire's Precision and Attack.",Buff Skill: greatly increases Sapphire's Attack for 3 rounds (once each battle) when her HP is below a certain amount.
851002,Gambler,"1. A deadly Assassin in House Ghost with the ability to heal herself, and you won't like her hitting you when under a Bleeding debuff;\n2. She can help you greatly in PVE situations;\n3. Her poor ability in survival makes her in dire need of buffs that can increase her survive ability.","Gambler's Active skill deals damage to 2 random enemies and Bleed them, and the Bleed damage will be boosted if the target happened to be a Ranger;\nAfter Gambler Graduates to 6-star, the skill will target 3 random enemies;\nAfter Gambler reaches 10-star, she can gain Hp from the skill.","Buff skill, each attack from Gambler will increase her Armor Break and bleed her targets.","Buff skill, ensures Gambler's attacks will miss less frequently and increases her offensive ability.","Healing skill, enables Gambler to gain Hp once an enemy is defeated, the healing amount is based on her Attack."
851003,Succuba,"1. A Warrior-class girl in House Ghost, usually appears in the Front-line;\n2. The girl's attribute is lower than others at the beginning, but after being awakened to 10-star, she will be greatly boosted and get the ability to control her enemies","Succuba's Active skill will deal damage against enemies in Back-line and heal Succuba;\nAfter Succuba reaches 10-star, the skill will also have a chance to Freeze the targets;\nThe healing amount of the skill is based on Succuba's Attack, and the rate of the healing will be greatly boosted after Succuba reaches 10-star.","Buff skill, increases Succuba's Precision and Hp.","Healing skill, allows Succuba to heal herself if an enemy blocks an attack.","Healing skill, allows Succuba to heal herself from each of her attacks, the healing rate will be boosted after Succuba reaches 9-star."
851004,Dracula,"1. A damage dealer in House Ghost;\n2. Dracula's Active Skill counters Mage Class enemies, so she could be considered a counter-measure against teams with many Mages;\n3. Dracula targets the enemy with the lowest Hp, so a team with her could easily gain strength in number.","Dracula's Active skill deals damage against 3 random enemies, will have a chance to stun if the target is a Mage;\nAfter Dracula Graduates to 6-star, the skill will target 4 random enemies;\nAfter Dracula reaches 10-star, the Mage-class targets will take extra damage.","Buff skill, increases Dracula's Armor Break, Attack, and Hp.","Buff skill, improves the Basic attack of Dracula and enables her to target the enemy with the lowest Hp.","Buff skill, greatly increases Dracula's Armor Break and heals herself for 5 rounds (once each battle) when her HP is below a certain amount."
851005,Wu Kong,"1. A damage dealer in House Ghost;\n2. Wu Kong's active skill counters Assassin-class enemies, so she could be considered a counter-measure against teams with many Assassin's;\n3. Her basic Speed is low, so if her Speed is increased she will take advantage of move order in a round and perform better in Tests or PVP situations.","
Wu Kong\'s Active skill deals damage to 3 random enemies, if the target happens to be an Assassin, it will also have a chance to stun the target;
After Wu Kong Graduates to 6-star, the target for the skill will be increased to 4;
After Wu Kong reaches 10-star, the skill will also poison Assassin enemies;
The skill has a high damage rate and greatly counters Assassin enemies.","Control Skill, allows Wu Kong's skills/attacks to occasionally stun targets.","Buff skill, enables Wu Kong to deal extra damage against stunned targets.","Buff skill, Increases Wu Kong's Armor Break and Attack."
851006,Fencer,"
1. A Warrior with Freeze control ability in House Ghost;
2. Fencer\'s active skill can deal damage against the enemies in Front-line and has a high chance to Freeze them;
3. Fencer has a chance to Freeze the attacker after being attacked, she also has skills that can boost her Hp and Armor to increase her survivability;
4. She doesn\'t have a weak period, so she\'s suitable for the game at any star rank.","Fencer's active skill deals damage against enemies in Front-line and has a chance to Freeze them, the skill will also heal Fencer herself.","Control skill, Fencer will have a chance to freeze her enemy when she takes damage from them, and the chance will be boosted if the enemy happened to be a Warrior.","Buff skill, increases Fencer's Attack and Hp and Armor, makes her immune to Freeze.","Healing skill, enables Fencer to heal herself at a great amount (once each battle) when her HP is below a certain amount."
851007,Wildtress,"1. A damage dealer in House Ghost;\n2. Wildtress has a decent offensive ability, her active skill can also lower the Attack of its target, which can help her team survive longer.","Wildtress's active skill targets the enemy with the lowest Hp and reduces her Attack;\nAfter Wildtress reaches 10-star, it also has a chance to deal extra damage.","Buff skill, increases Wildtress's Hp and Armor Break.","Buff skill, allows Wildtress to gain extra Armor Break and Crit from each of her attack.","Buff skill, greatly increases Wildtress's Attack once her Hp is lowered to a certain level."
851008,Sakura,"1. A controller in House Ghost, she can Petrify her enemies and deal more damages against them;\n2. Her skills provide her a high chance to petrify her enemies while lowering their Armor, making her a good choice in PVP situations;\n3. Sakura has a high Damage Reduction and is immune from Petrify, which means she has a great survivability.","Sakura's active skill deals damage against the enemies in Back-line and have a chance to Petrify them, it will also lower the Armor of the targets.","Buff skill, increases Sakura's Attack, Hp and Armor, makes her immune to Petrification.","Buff skill, changes Sakura‘s basic Attack against the enemies in Back-line and increases her damage against Petrified enemies.","Buff skill, increases Damage Reduction of Sakura for several rounds after her Hp got lowered to a certain amount."
851009,Giana,"1. A damage dealer in House Ghost;\n2. Giana's offensive ability is not very outstanding, but her death-trigger skill could deal tons of damage;\n3. She could be of great help for other girls which could benefit from her death (such as Saint, Esau & Jacob)","Giana's active skill deals AoE damage to all the enemies and have a chance to Silence the Warrior-class enemies;\nAfter Giana reaches 10-star, the skill will also increase her Attack.","Buff skill, allows Giana to gain extra Crit and Attack after anyone of her teammates is defeated.","Buff skill, increases Giana's Damage Reduction, Hp and Attack.","The core skill of Giana, deals great AoE damage against all the enemies once Giana is defeated."
851010,Ennmaya,"
1. An Assassin in House Ghost;
2. Ennmaya\'s Basic Attack will stun a random backline enemy.
3. With a rather high value in offensive attributes, Ennmaya becomes a deadly damage dealer;
4. After Ennmaya reaches 8-star, her Basic attack will have a 100% chance to stun its target, makes her almost invincible in 1 on 1 situation, the extra Damage Reduction provided by her Active skill ensures her own survivability.","
Ennmaya\'s active skill will deal damage to a random enemy in Back-line and poison her, it also has a chance to stun the target;
After Ennmaya Graduates to 6-star, the target for the skill will be increased to 2;
After Ennmaya reaches 10-star, it will also provide Ennmaya Damage Reduction;
It could also help Ennmaya form a better cooperation with other girls who have skills related to Poison.","Buff skill, Increases Ennmaya's Armor Break, Attack, Hp and her damage against poisoned enemies.","Buff skill, allows Ennmaya to Stun her targets by chance.","Buff skill, poisons 2 random enemies in Back-line (once each battle) when Ennmaya's HP is below a certain amount;\nAfter she reaches 10-star, the poison will be applied to all the enemies in Back-line."
851011,Valeera,"
1. An all-rounder in House Ghost;
2. Valeera has a decent Attack attribute, her skill has a chance to Freeze or Petrify its targets;
3. Valeera has a chance to heal herself for a huge amount after taking damage from an Active skill, which greatly increases her survivability;
4. She could also reduce the Attack of her targets, which makes her available for many teams.","Valeera's active skill will deal damage to 4 random enemies and poison them, it also has a chance to Freeze or Petrify them.","Buff skill, changes Valeera's Basic Attack to target 2 random enemies and steal their Attack, which will also indirectly increase the survivability of her team.","Buff skill, increases Valeera's Attack, Crit, and HP.","Healing skill, enables Valeera to heal herself and recover Energy once an enemy got Petrified or Frozen;\nThe skill greatly increases Valeera's survival ability and attack potential."
852001,Hottie,"1. A supporter in House Human;\n2. Hottie can greatly increase the Speed of her teammates, greatly optimize the movement order of her team in a round;\n3. Hottie provides Attack and Speed for her teammates, she will also provide Attack while reducing the Armor of all her enemies (once each battle) when her HP is below a certain amount.","Hottie's Active skill deals damage against all Hottie's enemies and increase the Speed of her allies;\nAfter Hottie reaches 10-star, it will also increase the Attack of her allies while lowering the Precision of her enemies.","Buff skill, increases Hottie's Hp and Speed.","Buff skill, changes Hottie's Basic attack target to 2 random enemies;\nAfter Hottie Graduates to 6-star, her Basic Attack will target 3 random enemies.","Buff skill, increases the Attack of Hottie's allies and lower the Armor of Hottie's enemies (once each battle) when her HP is below a certain amount."
852002,Blowie,"1. A supporter of House Human;\n2. Blowie is a healer with great healing ability;\n3. Her speed is lower than others, so you will need to boost her Speed to let her move earlier in a round.","Blowie's active skill will heal Blowie's whole team, and healing amount is related to her Attack, and it has a 30% chance to increase the healing rate;\nHer healing is usually helpful, especially when the healing rate is increased;\nThe additional healing rate will be greatly boosted after Blowie reaches 10-star.","Buff skill, increases Blowie's Basic attack damage and allows her to heal a random teammate.","Buff skill, increases Blowie's Hp and Attack.","Buff skill, enables Blowie to heal her teammates for once after her Hp is lowered to a certain rate."
852003,Chevalir,"1. A Warrior in House Human, she's usually placed in Front-line;\n2. She could increase Armor for the whole team when her HP is below a certain amount, which might also make a great combo with girls like Sonya.","Chevalir's Active skill deals damage to the enemies in Back-line and have a chance to stun them; After Chevalir reaches 10-star, it will also provide her Damage Reduction.","Buff skill, increases Chevalir's Armor and Hp.","Counter skill, enables Chevalir to counterattack the attacker after taking a Crit hit.","Buff skill, increases the Armor for the entire team (once each battle) when her HP is below a certain amount;\nIt does great help when fighting against Guild Bosses with high Attack."
852004,Saint,"1. One of the main damage dealers in House Human;\n2. Each skill of Saint could greatly increase her offensive ability, and also promises her to deal greater damage if she survives longer;\n3. Saint could gain buff from defeated characters, so she could team up with the girls with skills that need their death to trigger.","Saint's Active skill will deal damage to all the enemies and burn them;\nAfter Saint reaches 10-star, it will also increase her Crit and Attack.","Buff skill, allows Saint to gain extra Attack and Skill Damage from her defeated allies;\nThis makes her more lethal if she becomes the sole survivor of her team.","Buff skill, allows Saint to gain extra Crit & Crit Damage from her defeated enemies;\nIt will provide Saint great boost in dealing damage if she could survive longer in a battle.","Buff skill, increases Saint's survival & offensive ability."
852005,Javelin,"1. A damage dealer in House human;\n2. Javelin is good at dealing damage and controlling her enemies, she can deal AoE damage against all her enemies and have a chance to Freeze them. She can even deal extra damage when her target is Frozen, she can perform better when teamed up with other girls with Freeze-type control skills;\n3. After equipping Javelin with gears that could improve her survivability, she could also be placed in Frontline and reduce the Attack of her enemies by taking hits.","Javelin's Active skill deals damage to all the enemies and have a chance to Freeze them;\nAfter Javelin reaches 10-star, she will gain extra Energy by triggering the skill.","Buff skill, increases Javelin's Armor Break and Attack.","Counter skill, Javelin will reduce the Attack of the attackers and increase her own Attack when getting hit.","Buff skill, increases Javelin's damage against Frozen targets;\nMake good use of this skill by adding her to a team with girls with Freeze-type control skills."
852006,Geisha,"1. A controller in House Human;\n2. Geisha can deal damage against all the enemies in Back-line after being defeated, makes her a considerable choice in Tests;\n3. After Geisha reaches 10-star, her Basic attack has a high rate to Stun its target.","Geisha's Active skill deals damage against several random enemies and have a chance to stun them;\nAfter Geisha reaches 10-star, the skill will target all her enemies.","Buff skill, increases Geisha's Attack and Hp.","Control skill, offers Geisha a chance to Stun her enemies in Back-line after being defeated;\nAfter she reaches 10-star, the rate for the Stun will increase.","Buff skill, Geisha's attack has a chance to Stun its targets;\nAfter she reaches 10-star, the rate for the Stun will increase."
852007,Sonya,"
1. One of the main damage dealers in House Human;
2. Sonya has a high basic Armor, and will counterattack the attacker whose Armor is lower than her after getting hit, which provides her a great advantage in PVP situations;
3. In PVE situations, Sonya could also help her team by lowering the Armor of her enemies.
4. She can fit herself into many kinds of lineups.","Sonya's Active skill will deal damage to 3 random enemies and reduce their Armor, it will also Burn the targets, the Burning damage will be increased when the target happens to be a Warrior.","Buff skill,  Sonya's attacks could reduce the Armor of the targets and burn them, it will also increase Sonya's damage against Burning enemies.","Buff skill, increases Sonya's Armor, Attack and Hp.","Counter skill, enables Sonya to counterattack the attackers whose Armor is lower than her, as the basic Armor for Sonya is high, the skill could be triggered frequently, but Sonya could still team up with Nani to increase the rate for the skill to trigger;\nHint: the counterattack won't trigger Sonya's other passive skills."
852008,Caitlyn,"1. A damage dealer in House Human;\n2. She can target the enemy with the lowest Hp, so a team with her could easily gain strength in number.\n3. She could also deal a large amount of DoT damage against her enemies.","Caitlyn's Active skill deals damage to 2 random enemies in Back-line and applies a DoT damage to them;\nAfter Caitlyn reaches 10-star, the damage rate of the skill will be greatly improved.","Buff skill, each attack (Basic attack included) has a chance to apply DoT damage to the target;\nAfter Caitlyn reaches 10-star, the chance will be increased to 100%.","Buff skill, increases Caitlyn's Block rate and Attack.","Buff skill, changes Caitlyn's Basic attack target to the enemy with the lowest Hp and allows Caitlyn to steal Attack from the target;\nThe skill partly increases the survivability of the teams with Caitlyn."
852009,Guan Yin,"1. A unique girl with a high Block rate in House Human;\n2. Guan Yin's can increase her own Block rate by attacking to increase her own survivability;\n3. After Guan Yin Graduates to 6-star, her Basic attack will target all her enemies in Front-line, this increases her threat to enemy Front-line.","
Guan Yin\'s Active skill deals damage against enemies in Front-line and increase Guan Yin\'s attack;
After Guan Yin Graduates to 6-star, the skill will also Bleed Mage class enemies
After Guan Yin reaches 10-star, the skill will target 4 random enemies and Poison & Bleed them.
The usage of this skill will be greatly expanded after Guan Yin reaches 10-star.","Buff skill, increases Guan Yin's Block rate, Speed and Hp.","Buff skill, each attack (Basic attack included) of Guan Yin will increase her Block rate and Attack.","Buff skill, changes Guan Yin's Basic attack target to all the enemies in Front-line."
852010,Librarian,"
1. A damage dealer in House Human;
2. Her Attack will deal damage to 3 random enemies;
3. Strong against Priests, can be used to counter teams with many Priests;
4. Librarian can lower the Attack of her enemies and ensures her team to survive longer.","Librarian's Active skill deals damage against all enemies, it also has a chance to Silence Priests;\nAfter Librarian reaches 10-star, the skill will have a chance to Stun Priests instead of Silence them, it will also apply DoT damage on the Priest targets.","Buff skill, each attack (Basic attack included) of Librarian will lower her targets' Attack.","Buff skill, increases Librarian's Skill Damage, Hp and Precision.","Buff skill, each attack (Basic attack included) of Librarian has a chance to lower the targets' Crit and increase Librarian's Attack;\nAfter Librarian Graduates to 6-star, the rate for Librarian to trigger this skill will be higher."
852011,CapsuGirl,"
1. A controller in House Human;
2. CapsuGirl has a great ability to control her enemies while dealing damage, her active skill could deal damage against 4 random enemies, and 3 of her targets will have a chance to be Stunned;
3. After an ally triggers her active skill, CapsuGirl can also provide Stun support by chance;
4. Her high Damage Reduction and Immunity against Stun grants her a high survivability;
5. She could perform better in PVP situations in game.","CapsuGirl's Active skill deals damage against 4 random enemies, has a chance of 100% to Stun one of them;\nCapsuGirl is a girl of high Speed Attribute, which guarantees the skill to have a great result.","Buff skill, CapsuGirl deals damage and has a chance to stun a random target when her teammates trigger Active skills;\nIt can greatly support her team in Control and Damage.","Buff skill, increases CapsuGirl's Speed, Hp, and Crit, also provides her immunity to Stun.","Buff skill, CapsuGirl gains extra Damage Reduction for 5 rounds once her Hp is lowered to a certain rate."
853001,Priestess,"
1. One of the main damage dealers in House Monster;
2. Her Basic Attack targets all the enemies.
3. Strong in PVE situations as the marks she adds on her targets to increase the damage from her can be stacked;
4. The best idea to stack her marks faster is to team up with another Priestess;
5. Priestess is still not immune to any Controls, so she will need supporters to ensure her skills being triggered successfully.","Priestess's Active skill will deal damage to all the enemies and tag them with a mark which could increase Priestess's damage against them;\nAfter Priestess reaches 10-star, the skill will have a chance to tag an additional mark;\nThe marks can stack, so Priestess will deal more damage as she stays longer in the battlefield.","Buff skill, increases Priestess's Damage Reduction, Hp and Crit.","Buff skill, allows Priestess to tag her enemies with her Marks with her Basic attacks;\nAfter Priestess reaches 10-star, the skill will also allow Priestess to steal Attack from her targets.","Counter skill, allows Priestess to tag the attacker with a Mark of her after taking hits, it will also increase her Crit Damage;\nThe skill can greatly boost Priestess's offensive ability."
853002,Alice,"1. A Warrior in House Monster, usually appears in Front-line;\n2. Alice's Active skill greatly counters Warrior-class enemies, can be used to counter teams with many Warriors;\n3. She can heal herself after taking hits and this skill can benefit from her other skills.","Alice's Active skill deals damage against enemies in Front-line and will deal extra damage if the targets happened to be Warriors;\nAfter Alice Graduates to 6-star, the skill will target all her enemies;\nAfter Alice reaches to 10-star, the skill will also provide her Damage Reduction.","Buff skill, increases Alice's Armor, Hp, Attack, and damage against Warriors;\nAfter Alice reaches 7-star, the skill will make her more dangerous against Warriors.","Buff skill, allows Alice to gain extra attack from her attacks (Basic attack included);\nShe will become stronger if she survives longer.","Healing skill, allows Alice to heal herself after taking an attack;\nThe healing amount is based on Alice's Attack, so you can increase her survivability by increasing her Attack."
853003,Nia,1. A damage dealer in House Monster;\n2. Nia can Poison her enemies with many methods;\n3. She can team up with other girls whose skills are related to Poison to do a greater job.,"Nia's Active skill will deal damage against 4 random enemies and Poison them;\nAfter Nia Graduates to 6-star, the skill will target all her enemies;\nAfter Nia reaches 10-star, the Poison damage of the skill will be greatly boosted.","Buff skill,  Nia's attacks have a great chance to Poison the targets.","Buff skill, allows Nia to Poison all her enemies once a girl in battle is defeated.","Counter skill, allows Nia Poison the attackers by chance after taking hits."
853004,Muppet,"1. A damage dealer with high basic Armor in House Monster;\n2. Muppet's Active skill can deal damage according to the targets' Maximum Hp and increases her own Attack and Armor Break, her Basic attacks can even steal the targets' Armor, which makes her extremely suitable in PVE situations;\n3. Muppet will gain extra Crit and Crit Damage after several rounds, so she will need to survive longer to wield her full strength.",Muppet's Active skill deals damage against enemies in Front-line and increase Muppet's Attack and Armor Break;\nIt will deal additional damage to the enemies whose Hp is lower than Muppet.\nThe skill will need player to keep Muppet's Hp at a rather high rate to deal more damage.,"Core skill, allows Muppet to steal Armor from her targets by attacking them with her Basic attack;\nMuppet will become harder and harder to defeat as the fight goes further.","Buff skill, increases Muppet's Attack, Hp, and Armor.","Buff skill, allows Muppet to get extra Crit and Crit Damage after surviving for several rounds;\nAnother reason to ensure Muppet's survival."
853005,Nobunaga,"1. A damage dealer with high Crit rate in House Monster;\n2. Nobunaga can lower her enemies' Crit and Crit Damage while increasing her own Crit Damage, which makes her perform quite well in all kinds of situations;\n3. She is defenseless against Control skills so she will need other help to avoid that.","Nobunaga's Active skill deals damage against all the enemies and lowers their Crit;\nAfter Nobunaga reaches 10-star, the skill will also bleed the enemies and lower their Crit Damage.","Buff skill, allows Nobunaga to gain extra Crit and lower her targets' Crit by each of her attacks (Basic attack included), it also has a chance to increase Nobunaga's Crit Damage;\nThis skill makes Nobunaga stronger as a battle goes further.","Buff skill, increases Nobunaga's Attack, Hp and Crit Damage.","Counter skill, allows Nobunaga to counterattack her enemies after she gets hits from them."
853006,Silvia,"1. A Warrior with a very high Hp Attribute in House Monster, usually placed in Front-line;\n2. Silvia is a girl hard to be defeated in a round, and her active skill could also aid her allies;\n3. You can rely on her when you need a girl to take damage.","Silvia's Active skill deals damage against an enemy and heal an ally with the lowest Hp;\nAs the skill damage and healing amount is based on Silvia's Attack attribute, so the effect on the skill doesn't come better until Silvia reaches 10-star.","Counter skill, allows Silvia to lower the Crit of the attackers after taking hits, which will lower the offensive ability of the enemy team.","Buff skill, increases Silvia's Armor and Hp.","Buff skill, greatly increases Silvia's Armor (once each battle) when her HP is below a certain amount;\nThe skill greatly increases Silvia's survivability."
