id,desc
1,"Senpai, this is the Dorm for the Girls, let me show you around~"
2,Click here to purchase furniture pieces with Furniture Coins
3,Tap here to edit the layout of the Dorm freely. Yuki hopes Senpai can make the Dorm a beautiful and cozy place for the Girls~
4,"This is the Comfort level of your dorm. Tap here to claim the rewards from the Dorm. The more comfortable furniture you own, the more rewards you can get~"
5,You can adjust the name of your Dorm any time by tapping here~
6,Tap here to see the rules. You can find the answers to your questions here!
7,Tap here to choose the Girls to stay in the Dorm. Senpai will be able to interact with the Girls here~
