id,name,dialog,click_dialog1,click_dialog2,click_dialog3,click_dialog4,click_dialog5,battle_dialog,skill_dialog,cv_name,love_gift_dialog1,love_gift_dialog2,love_gift_dialog3,vow_dialog,login_dialog,lvlup_dialog,gradeup_dialog,shengxue_dialog,awake_dialog,equip_dialog1,equip_dialog2,hangteam_dialog,house_set_dialog,house_dialog,idle_dialog,dagong_dialog,daily_mission_dialog,new_stage_dialog,victory_dialog,failed_dialog,love_point_dialog1,love_point_dialog2,love_point_dialog3,love_point_dialog4
752006,Librarian,Do you have a dream? I want to be a writer. I hope the stories I write can make so many people happy.,I truly love reading books. I can see the hidden side of human nature from the authors who wrote them.,No books should be thrown away. Books can't be wrong.,"Once you finish reading a book, does the story end? No! We could continue them in our hearts.","Everyone can feel that same happiness from reading a book, no matter who you are! That is the charm of books.","Whenever you're feeling lonely, open a book. Books can take readers to a wonderful world at any time.",Want to read with me?,Cannot leave without permission~,Saori Hayami,"Sorry, this gift doesn't suit me.",Much obliged~,I really like this gift and I won’t fail you~,"I will write down everything that happened today, so we will be remembered. No matter how much time has passed, as long as we are remembered, we will live on in people's memories.",Good day! Did you read the book I gave you last time we met?,"I told you not to interrupt me when I'm reading, Senpai… A drink? Thanks~",Knowledge is power!,"Don't skip class in the new semester anymore, Senpai~",I can always get some inspirations from you~,Armor… I'd rather exchange this for a book.,Maybe you can design a pocket for this armor to hold books…,Can I read my books during work time?,"A quiet room, that's all I need~",Are you here to visit my reading room?,"You don't have to work so hard for the test tomorrow, Senpai… I'd better fetch you a coat.","I'm glad that you're here to join me in reading, but it's almost time for your internship!","You still got rewards unclaimed, Senpai!","Something happened on campus. Senpai, how about a reading-break?","Senpai, this is easier than solving the problem I found in the textbook yesterday.",Failure is the mother of success. That's the reason we cannot give up this early.,填充,填充,填充,填充
752007,Blowie,"Seriously? My hair isn't dried yet and I have to go out~ If you don't treat me right, I won't forgive you.","Since you're my master, remember to dress up! Don't be lazy. Your hair needs to be constantly taken care of ~",This hair dryer will blow all your troubles away~,Welcome~ I'll help wipe your back~,"Should I take a rose bath, or a lily bath~? Which is better?","Hehe~ I've been through a hundred battles, don't you believe me? Let's go.",Okay! I'll help you dry your hair~,Whooaaa~,Haruka Tomatsu,It's nasty... I really don't want this~,I barely accept~ Don't let me down next time~,You didn't let me down~ Let me think about how to reward you~,"Starting from today, I'll allow you to rub my back~I sure will look forward to that~","Hey, wanna go to the bathing spot with me?",The drink after shower tastes the best in the world~,"Bathing is also a method to become stronger! Bubble bath, current bath, hot spring bath… Each one of them can make you a better person~","All work and no play will make you a dull boy. Come, live a little and have a shower with me~","This is a new hair-dryer, do you want to see what it can do?",I totally don't understand why they invented tights.,This is a nice bathrobe~,I will be there right after a shower.,Can I take my bathtub into the room?,"Are you here for a shower, Senpai?",Take your time. It must be a tough day...,Isn't it already the time for work?,The rewards are still waiting for you to collect~,You're going to solve the problem again? I know it's your duty but... Don't put all the stress on yourself~,That's what we call an absolute win!,I should take a shower before battle next time...,填充,填充,填充,填充
752008,Hottie,"Greetings, master. You won't be lonely in the nights with me by your side.","Coffee, tea or me?",I can do anything for you.,There's no need to be serious in front of me~ I know all about you.,Do you want to play with me? Surely you'll be satisfied!,"As long as you can be happy, I can do anything~",Love me~,Hmm~ That burning sensation~,Mitsuki Nakae,What's wrong? This isn't like you~,Some presents are never too small after all. Thanks for that~,Maybe I shall consider myself as a present in return? Haha~,"I thought we've already passed this stage by now...here, come closer...mwah~","Waited a long time, Master. How do you want to have fun today?","[Kisses] ~ I'll trade you a kiss for a drink, I believe this is an even deal~",Why are you staring at me? Even I would somehow feel embarrassed~,You don't study enough~ Do you want me to give you private lessons?,"You've taken another step closer to mature, congratulations~",It's a rare opportunity ~ Maybe you should let me try one something more special? Ahaha ~,These are really nice clothes~ Maybe you prefer when I'm not wearing anything?,It's a rare chance for us to be in this place~ Don't you want us to have some fun?,"Wow, this place is nice~","Don't leave me alone here, stay with me~","You look so tempting when you close your eyes and let your guards down… Ah, I cannot think anymore before I actually do something to you~","Senpai, maybe you can skip today's work and stay with me? No, I'm kidding, go ahead!",Don't forget to collect your rewards~,Let's go together and see if something's happening on campus~,I was expecting more resistance.,Stop! That's going to hurt tomorrow~,填充,填充,填充,填充
752009,Saint,"Hello, I heard you're nice. In my academy, people like you are needed. How about regulating this academy together?",Law and order are made by the strong. So I'll be the law.,"Whatever skill you're using, you have the right to speak freely if you win.",History is written by the winners. The weak have no right to intervene.,I just want to make the college more orderly. To be the strongest in this college is my goal.,"I don't like things I can't control. In order to control this, I need to get stronger.",I'm no longer pulled by any strings.,Get out of the way,Rie Tanaka,This... Is useless to me.,"Ah, I have to admit, it is a friendly exchange within the law.","I have to admit, I like this present very much. Maybe you should join me on this adventure?","Oath? I already said yes. You just haven't realized it... How can I do it with you? Well, that is just a part of rules, Huh~",Wanna conquer the world with me? Great! Welcome back!,I want some more!,I can feel the power! Now all that I need is an excuse to use it!,I'll need others' help to achieve my ambition. Let's start with you!,"Without power, all ideals are just nothing!",Give me all what you got!,Nice gear! Thank--- I mean I accept your tribute~,I'll do that as long as I'm the team leader.,I can use this room as my HQ.,"Please, join my military counsel in the remaining part of my meeting.",Uh… Was my lecture this boring?,Don't forget to work!,Get me my rewards back!,Go and check what happened and report back to me.,"Let the weaklings back off, this is not somewhere for them to have fun!",This defeat won't stop my campaign…,填充,填充,填充,填充
752010,Sonya,"Hello! Master came. Let me do it! Otherwise, my two sisters will not be able to see it!",Knock them! Knock them! The enemy will all be knocked back!,I'm tired of speaking in theory and reasoning! Who cares about such verbal garbage.,Why talk when you can just fight? Fight first! Talk later!,Eat! Eat! It tastes like heaven! This one is good too! And that! Food is the best!,I'm Sonya the Great! I own of this street! Remember that!,Finish them off!,I'm angry!,Yū Kobayashi,I don't need this!,"Oh, thanks!","Aha, it's been a long time since I last tasted this! It really takes me back~ Nice~","I-I'm bad at words, you don't have to say anything more to woo me...just holding my hand will be enough...","Hey, isn't this Master? Good morning!",Oh! Is this for me?,"My fist is more powerful! I want to try it right now! ...Master, why are you running away from me?",How much longer should I continue studying? It's boring to be in the classroom all day long!,There is nothing be solved by force! You want me to demonstrate?,"Thank you, Senpai! I can give you free food next time when you come to my cafeteria!","After having this on, I won't be losing any battles!","I'm going for a walk. Do you want to come with me, Senpai?",This room is really nice! I want to have a rest inside~,"You came right on time, I was just going to cook!",Ah? Why aren't you responding? Are you hungry?,Go go go! It's time to go to work!,Don't waste your rewards!,Is there another fight on campus? Count me in!,Who's next?,I have to admit the enemy is stronger than I predicted...,填充,填充,填充,填充
753001,Nia,"This is not a doll. Those who want to tear us apart will be killed by Darling. You guys don't want that, right?",Darling~ Can you hear me? You know I've been thinking about you.,That way we can always be together~ We can never be apart~,I'll make you pay the price.,"Darling, you are always so beautiful no matter how long time has passed.","Even if we are at separate ends of the world, I'll find you.",Darling~ Want to get up?,Turn into my doll~,Yū Kobayashi,Do you want to bribe me with this?,"Yeah, you're the best, darling~","What an excellent gift~ Don't you think so too, Darling~?","I need to ask Darling first...it seems like she likes you a lot, so don't forget to keep her company in the future, okay?","Oh, my Darling is getting more and more beautiful every day!",My darling's power has increased!,This is not enough!,"Darling, I will soon have enough power to find you!","The puppet? I haven't spoken to her for a long time, but I would like to take the time to go see her this time.",Are these new clothes for my darling?,I need this equipment to assist me in mastering puppetry.,"Wait, I'll bring my darling with me!","Darling, it is our new home~",It's about time for you to show up. My darling has been waiting long enough!,Stop pretending yourself as a puppet!,Go to work right now!,My darling is still waiting for you to get your reward!,"Wait, I'm coming with you, maybe I can find some important information that my darling needs.","Darling, we're the best!",Don't think this is over with the battle!,填充,填充,填充,填充
753002,Nobunaga,"I am the demon king! I cannot be weak. Right? Want me to protect you? Hahaha, let's leave it to me. I'll cut down all your enemies!",Honnoji Temple? Buddha can't save you.,I am the Demon King of the Sixth Heaven. Scared? I won't even forgive you even if you kneel down and beg for mercy.,Hideyoshi! Ugh! Where did that monkey run off to?,Ooh! Women's clothes... They are kind of fascinating... Let's steal some...,"Get out of here, traitor! I was so sincere to you with all my heart. I didn't expect... Ah...",Dust to dust.,Draw the sword. Kill!,Romi Park,What is this... Never seen it before. Not even gonna try it either...,"Oh, is this you begging for my protection?","Emm, this is very interesting, I shall thank you for the gift.","This dress feels like home, where the cherry blossoms are in full bloom~ Believe me. You could spend your life looking for that... And it will not be a wasted life.","If you ask me, I am a little hesitant to say hello.","I never thought a drink could give so much power, it's quite fun~",The power flows inside my vein.,"Hahaha, let's see what you're hiding from me!",I shall rule by force!,My pipe is not decoration!,"This design is quite unique, can I disassemble it to see how it works?",Advance! Follow my lead~,It's time to rest.,Is it the correct room number this time?,"Unusual, he's not here…","Pay attention to your job, even if it's part-time!",The rewards are already yours since you've completed the mission.,"As usual, the Academy is busy.",Don't let me see you preying on innocent people again!,Stop right there! I can still fight!,填充,填充,填充,填充
753003,Silvia,"Eliminate the darkness of this world. That is my destiny. I won't talk about your work, so I hope you do not bother mine.",I will annihilate all the darkness of this world.,Light and shadow are inherently linked. Is it really meaningful to put out the darkness?,I have heard the cries of my enemies. Even they haven't lost their goodness. But... I can't do anything.,"I'm not sure if it's possible to get rid of all the darkness from this world,","You must have your own faith, right? It's a shame but I don't. But if I do, I could have lived a normal life.",Eliminate the darkness!,Disappear.,Chiwa Saitou,I have nothing to say...,"In that case, I'll accept it.","This gift suits me, thanks for meticulously choosing the wonderful gift.","I have doubts on many things, but I've decided to trust you.",Don't greet me. Your presence makes me tremble.,It's not natural.,"The food is for energy supply, I can understand that.",I can figure out this new system myself.,"I have chosen the pass, now I only need to follow it.",Support system engaged.,Weapon OS functional.,Who am I supposed to meet here?,"Fine, let's have a rest.",Hello.,No one is inexhaustible.,Have you completed the internship today?,"Please remember, you get paid for the missions you've completed. And you haven't collected the rewards.","I smell darkness, the Chaos is invading us again?",Chaos or darkness are both overestimated powers!,We just failed because of they cheated. But we won't fail for the same scheme next time!,填充,填充,填充,填充
753004,Toyo,"Betrayal is unforgivable! But those who can't trust others can't be kings. Master, I got your back!","It's important to stay positive. Otherwise, neither the genius nor the mighty can laugh from the bottom of their hearts.","Appearing like dew, vanishing like dew - Such is my life. Even Osaka’s splendor is a dream within a dream.”","Since I already started late, I will run faster. No one will catch up with me.",How can we accomplish great things if we hesitate to work on the small ones?,We have to decide to strive to the end! Whatever it might be!,Ready for battle!,Combo Strike!,Ai Kayano,Are you turning against me?,Thank you.,I like it very much~ Thank you~,"Aside from training, there are many places I want to go with you, and many other things I'd like to do with you by my side.","If you want to succeed, don't just idle away. Let's work together!",Nothing is better than a drink after exercise!,Don't under estimate me!,Practice makes perfect!,This is just the beginning. Stopping right now is like giving up halfway!,Don't get hurt in the training!,Are you here to practice with me?,Time to take what I've learned to practice!,"Nice, a room big enough to place all my training equipment.","Are you here to set the day's training schedule, Senpai?",It's not the time to rest yet! Get up and start training!,"You took the offer, now it's time for you to finish the job!",Collecting rewards is also an important part of the mission~,Here comes a new challenge. Hold nothing back!,"You underestimated your opponent, and that's the reason you lose.","Sorry, but I won't lose next time!",填充,填充,填充,填充
753005,Masamune,"There's a blade that could cut through everything, and you are the first one can make that blade stop of its own accord… Isn't that pretty interesting?","If you trust others too much, you'll only hurt yourself.",What do we get for caring about morality? To feel at ease with ourselves?,"Entangled in formalities, bound by the secular life... Ah, what a bore.","Talk is cheap. Actions speak louder than words. First, let me see what you can do.","Born in this world, I wish I have no regrets.",Try me if you dare!,The battle begins!,Junko Takeuchi,This does not suit me~,"Thank you~ I'm a murderer. Yet, there is a day when I receive a gift? HAHA~",Thank you for tolerating my unruliness. Now I can feel your love~,"Do you mean you want to form an alliance with me? Of course, I'll agree: I feel like I am unstoppable when I'm with you.",Ha! Sneak attack successful! You look unprepared again.,I feel like I can cut through anything!,It's a true challenge to go beyond my limits!,"On this bigger stage, I'm ready to face bigger challenges~","Lay a solid foundation, and the time will come for you to shine.","Haha, so this is my new blade?",This can allow me to rely less on tactics!,It's time to engage.,"Ok, this room will become my base from now on!","Do you have anything urgent to report, Senpai?",Senpai must be planning something important...,Provisions should be arranged before an army is mobilized!,Time to fill the rewards into your storage~,It's not safe outside. Please take care if you have to go out~,This is the step-one of my conquest!,"We‘re losing, I suggest we retreat right now.",填充,填充,填充,填充
753006,Hexa,"The weapons in both of my hands represents the past and future. Whether it is in the past or future, I'll guard it to the very end.",I believe in justice... What's wrong with that? So what should I do?,"I'll reward you well, but what should I do if you go against justice?",Only I can drive myself. That's what I believe in.,From what we learn in defeat is only once in a lifetime.,My Right-handed weapon is the records of the past. My Left-handed weapon is the revolution of the future.,Should I use my blade or gun?,Sweep the enemy away!,Yuumi Hirota,"Are you with me, or are you against me?","By my own will, thank you.",You... Treat me very nicely... Thanks~ I'll always by your side... It is my own choice!,"I have never felt like this before; the happiness is so soft and intoxicating, it feels almost surreal. Thank you for introducing this emotion to me.",We meet again~,"The taste is not that bad, even the product is mass-produced.","I feel different, but I don't know what's it all about. All I can tell is that my power is actually increasing.",I will not change my path.,I feel my power has been increased. Would you like to practice a little?,A viewfinder? It's perfect!,New pieces of equipment again? Do I look like a professional tester?,I will wipe out all the threats!,"It's almost time to rest, are you here to stay?","I have a big room, you want to come take a look?",Only Senpai would fall asleep during the day... It's a gift.,It's time to work.,"Senpai, if you don't hurry, you will lose your reward.",Chaos Figure detected? We must go and check it out!,"This is a granted victory, and I won't let it slip away!","This is a tactical retreat, we'll return later!",填充,填充,填充,填充
753007,Alice,"In the past, my actions were limited by emotions. From now on, I will obey you and bring justice.","Despite the order, I will execute it immediately.",The law? Can you judge what is good and evil by relying on such a simple system?,I am just obeying orders.,Merits and demerits are commented by our descendents.,I'll let you fade away in your dreams. This will be the last time I show mercy.,In the name of the moonlight.,One choice decides the outcome!,Riho Sugiyama,"Not like you, your mind is broken,too?",Thank you for your gift!,You recognize my thought... and my feeling...,I can focus on fighting because you took care of everything else...I hope we can continue like this in the future.,Hello! What can I do for you?,Anyone can become obsolete without upgrades!,I haven't reached my limit yet!,I won't leave gear development behind because of study.,"With more knowledge in my brain, maybe there can be some further optimizations done to my drones~",Only suitable gears can better support me in combat.,Do you have any more advanced chips to help control my drones?,Order received!,"If my time sense isn't failing me, this shouldn't be the time for rest.",Never imagined my drones can do this much for me in a dorm!,How can you fall asleep this quick? You even have forgotten to give me an order to rest before that~,It must be exhausting to complete the internship. Maybe I can do your job for you this time?,"If you're leaving the rewards behind, may I take the resource and upgrade my own drones?","The Chaos is invading. I'm waiting for your orders, Senpai!",Did they even try to hit back?,"Threat beyond the prediction, mission abort.",填充,填充,填充,填充
753008,Muppet,New Master? Anything would be fine for me. I'm just a doll...,Dolls... Don't need aspirations... Nor emotions...,Despair... Sadness... These love dolls don't feel it. But I'll remember what I've been doing...,Happiness? What is that? Does smiling and laughing mean happiness?,Your justice won't save everybody.,Hearts beating... Still moving... I'm still alive.,Show you the pain of being a doll.,Become a doll!,Aki Toyosaki,"Muppet, I don't need this...",Is it for me... Really...?,I have... My own will... My own hobby? This is the... The beginning? Thanks... A lot.,"I will break free from the strings controlling my actions, but the lines of fate binding us will never break.",You again... What are you going to do today?,Am I supposed to drink it up?,Eat them up? As you wish.,"New classroom, new friends? Honestly… I don't need that…",This must be a procedure to make me a better tool…,"As you ordered, I've swapped my equipment.",A present?... For me???!!!,I will do what you want me to do…,I will not mind the room design.,"Master, please tell me what you want.",If you're waiting for me to move. You might be here a while.,"Master, you still have other internships that have to be done yourself.",Please cherish your chance to collect the rewards.,"Please care more about the Academy, Senpai.",The happiness… Does this feeling come from the victory?,"Failure, I don't like it…",填充,填充,填充,填充
753009,Priestess,"I don't usually accept disciples, but I sense something shining in you. Would you like to be my disciple and stay away from this mundane world?",I never accept disciples. An easy and carefree life is the best~,Life is short~ Enjoy the moment~ What's the use of being bothered~,The Tao that can be told is not the eternal Tao. The name that can be named is not the eternal name.,Wiping out demons isn't that troublesome~ No need to thank me~,The world is a cycle of death and rebirth. Those who live must die. That is the principle of all living creatures.,This is a bit difficult.,Turn it around.,Emiri Suyama,Even you don't know my heart?,Thank you very much~,This gift... Thanks... Finally you know my heart...,"I've decided to settle down, there is no true freedom without you by my side. Please take good care of me, eh?","After seeing you, I guess my day will be ruined.",Get rid of the stale and take in the fresh.,Let weakness become strength!,I just let nature takes its course.,Balance is to be preserved.,I'll try how this works out.,I'll be extremely cautious when using this.,No evil shall prevail!,This is enough for me.,"It's been a long time, Senpai~",It's not easy to find inner peace~,"It's time for the internship, so I won't bother you during this period of time.",You should take the rewards you deserve.,"As one of the students, I have no reason to stand aside from the crisis happening.",I would destroy these evils even if that wasn't your order.,This is my fault to fail the order I followed.,填充,填充,填充,填充
753010,Psychic,Oh Wow! So you're the one who is going to take care of us! I'm Psychic and this is Bruno. Nice to meet you!,"Haha, do you want to pet Bruno too? He doesn't bite. But he is a bit picky with his food~",Did you see Bruno? He's the servant that follows me everywhere. Listen up. He is not a dog!! He is a servant!,"Don't underestimate Bruno, he's not your average dog. He's a servant that has taken on much of life's challenges!","The servants that came out of nowhere? They're all lovely, I hope you get along with them~","Come come come! It's dinner time! Uh... Senpai. Those aren't human cookies, they are servant cookies…","Bruno, let's go~","Bruno, bite them!",Mai Kanno,"Hey! If you do that again, I'm going to have Bruno make something out of you!",Oh~ Bruno can't use this. But thanks anyway~,Did you pick this for us? Thank you. I knew you are a good person!,"Bruno is the second most important being in my life...from now on, you'll be the third important one~",Come Bruno! Say hello to Senpai! (Woof! Woof!),Bruno said thanks~,"I've become more powerful, so has Bruno!",I will do better next semester!,"When Servants evolve, their appearances will also change, pretty amazing, right?","Bruno, you want that armor too?","Research cost has exceeded the limit this month, luckily you're here to pay, Senpai~","Bruno, concentrate, the enemies are approaching!","Bruno, stop messing the place up! Your niche is there!","Senpai, the blue cookies taste real good right?",Ah? You've already asleep? Since you've played with Bruno for so long~ I'm totally not surprised~,"Bruno, I've got a mission for you: watch Senpai during his work!","Go get your reward on your own, Bruno hasn't been trained for it yet~","Senpai! Bruno rushed into the crowd, I'm afraid something bad is happening!",Bruno is the best Servant!,"Bruno, we should retreat now and save strength!",填充,填充,填充,填充
