id,name,dialog,click_dialog1,click_dialog2,click_dialog3,click_dialog4,click_dialog5,battle_dialog,skill_dialog,cv_name,love_gift_dialog1,love_gift_dialog2,love_gift_dialog3,vow_dialog,login_dialog,lvlup_dialog,gradeup_dialog,shengxue_dialog,awake_dialog,equip_dialog1,equip_dialog2,hangteam_dialog,house_set_dialog,house_dialog,idle_dialog,dagong_dialog,daily_mission_dialog,new_stage_dialog,victory_dialog,failed_dialog,love_point_dialog1,love_point_dialog2,love_point_dialog3,love_point_dialog4
651005,Wildtress,"Hey hey, give me some meat! It's not for me, it's for the elephants!... Eh? Elephants are herbivores?",Let me stomp them flat!,Vegetables? You don't need that! You can't grow stronger without meat!,Break the bones to make soup.♪,"You should eat meat, too. The most delicious thing in the world is meat. Meat is justice!",I'm not sure if you have something more valuable than meat~,Fight for meat!,Go home!,Junko Takeuchi,Neither delicious! Nor amusing!,What's this? Can I eat it?,"Meat stands for justice! Finally, you're starting to understand~","Having someone to eat with is great, but someone who can cook for me? I'll spend my whole life with him!",Master! You're back. I want some meat!,It will taste better with meat!,I shall be faster. I don't want Quinie to take all the food I deserve next time!,What? Graduate? Does that mean more meat in Cafeteria?,No dieter ever becomes stronger!,I'll need another gear set for my pet~,Surrounded by food~ That's what I call paradise!,I hope to see you preparing a barbecue when I return~,"This is not bad, as long as I'm not living with Sonya.",Senpai! Do you bring anything to eat today?,"You don't look well, Senpai. I told you that you should eat more.",Senpai! Time to go and earn meat~,Remember to collect your daily rewards. I don't want to see you have not enough money to buy me enough meat.,"What happened… Not my business, as long as it's not happened in Cafeteria~",The biggest mistake you've made is to stand between me and meat!,I need more food before I can actually fight…,填充,填充,填充,填充
651006,Giana,"Master, I'll be your personal dancer.",This dance will bring you God's blessing.,"Someday, I'll stand at the top. Praised by all!",Dance! Let everyone know the beauty of harmony.,"Wherever there is a stage to dance at, I'll be there.",Meaning of life..? To show others the beauty of harmony through dance.,Dance to a Battle Song.,Dance with me,Minori Chihara,Don't ever give me that gift again! It will mess up my dancing!,"Are you here to enjoy my dance? Oooh, a gift? Thank you~","Thanks for your gift, master. And in return, let me teach you how to dance.","It's not important whom I dance for, but I'd like it a lot if you will be there whenever I dance in the future~",Master. You came. Wanna see me dance?,Thank you~,Do I look more charming than before?,Maybe I shall celebrate this?,"I will keep dancing, with or without audience.",This dress can be used in my performance.,It's really nice! Can I try it on right now?,I'm happy to obey your orders~,Is this the room for me? Hope it has soundproof walls~,"I've developed a new dance, it's your lucky day~","You look tired. If you need a rest, please use my tails as the pillow.","It's time for you to work, I need a rest too~",Don't forget your rewards~,Anything new on campus?,It's already enough for me to know that I've actually helped.,"Don't worry, they won't win next time.",填充,填充,填充,填充
651007,Chevalir,"If you can beat me, I will see you as my Master. Want to try?","Even if I have one eye, I won't lose to you. Come!",It's a good way to play with your mouth. The men in our grassland are all hands-on and never say anything.,Are you provoking me? Ha~Ha~ It’s been awhile since someone is so eager to seek their own death~,"Oh~straightforward, I like people of your kind! Ha ha~",See that wolf? I can take it down in three seconds. Wanna see me try?,Do you want to get cut?,Cut!,Seiko Yoshida,Are you kidding me?,"Oh, thanks~",Looks like you truly know about me~,"I want to ride with you in the sunset...it sounds weird when I'm not in my usual attire, isn't it?","Senpai, don't run! My fist is a little itchy. Practice with me!","That's the drink they've been talking about, right?","I found myself become stronger after all this, Senpai!",Guess I'm going to bother you more on study in the future...,I don't care if I can become stronger or not as long as I'm free to do anything I want.,People rely on clothes horse saddle~,"As a gift, I can think of few better~",Do you want a ride with me?,Hope you've also prepared some fine hay for my horse…,It's about time for you to be here~,Senpai is so cute… Ahhhhh! Better find a distraction before I commit a crime…,In case you late for the internship. I'll ride you to the working place!,Just claim the rewards quickly!,Something's happening? Hope the fun part is not over when I get there!,It always feels so good to win a battle!,"Ouch, maybe we shouldn't fight this one.",填充,填充,填充,填充
651008,Javelin,Javelin here. I will cut down the wicked!,Slash-the-evil!,Cut down all obstacles!,"Where morality and justice is, I'll be there even if I had to cut billions of them!","Even if they have billions, don't think they will stop me!",I don't need a horse if I have this javelin!,I am Javelin,Strike!,Romi Park,Don't bother me with this!,I will follow my own path to the future with this.,Your gift truly brings peace to my heart~ Thanks~,I pledge to you my loyalty; I will become your sword and your shield.,"Master, seeing you makes me feel at peace.",Thank you very much~,"Thank you, I will try not to disappoint you!",There is no end to the path to becoming stronger. Power and wisdom are both essential. There's still a long way to go.,"Thank you, Senpai. I can always learn something as long as I stand by your side.",It's important to be elegant in any kinds of situations~,It's really great to be able to get gears like this ~,Where are we heading today? I'll follow your lead~,Your room is really nice~,It's been a long day~,"You can't sleep here... Take my hand, I'll take you to the bed…","It's time to go to work, let me come with you.",You have uncollected rewards!,"Something is happening on campus, stay behind me, I will protect you!","Winning is a good thing, but it's still not worthy enough to brag about.",I need more training to win this…,填充,填充,填充,填充
651009,Geisha,Ah? Is it my turn? Don't be in such a hurry... I'm ready now.,"People remember not what they got, but rather what they didn't get.","Prince Charming's charm is not because of him being the prince nor because of the white horse, but because of his identity.",What really matters is what you can't see with your naked eye. How many people can accurately evaluate a person's inner self?,Men are creatures who choose their subjects base on their looks.,"Love from the heart, cannot be controlled.","Everyone, please be careful.",Rebirth of Life...,Kana Hanazawa,Are you trying to mock me by giving me this?,"Thank you, master~","You're so crafty, master... I can’t resist this temptation... You should be more responsible~",You must feel extremely lucky right now to have won my affections...,Will Senpai be a good or a bad person today? Hahaha!,"Hehe, I'll only take the part I need, don't worry.",I must have become more beautiful! What? No?… Tch! You surely don't know how to make proper conversations!,I don't like to study at all~ Maybe you can finish the homework for me.,Just admit you have been attracted by my beauty! Hahaha~,Help me with the zipper~ Finally~ It was harder than I thought… There's no way for me to become fatter. It must be you picked a wrong-sized dress!,Only this kind of gorgeous clothing can suit my beauty!,You should appear to be honored to stand by my side~,Why everyone is leaving this room once I opened the door?,You've finally returned! No one tried to talk with me during your absence!,"Wake up, I want to share my experience during the lute race 2 days ago.",Internship is important! Don't forget about that!,Maybe you can claim your rewards later and spend more of your time on me~,Why is it so noisy on campus?,Just give up the resistance and kneel for my beauty!,Why you would dare to harm such a beautiful lady…,填充,填充,填充,填充
651010,Caitlyn,"Master, it's easy to feed me. As long as there's a place to sleep, a place to eat, and an internet connection. That's all. Ah, remember to buy me the latest game!",Ah... Do not... I don't want to get up... I'm sick and dying when I get out of bed.,It's so sunny outside that I still have to play games at home. Games are the best!,"Whether it's work or sports, there is nothing more interesting than games.","Which one do you want to buy? Compared to bs vita, I prefer 3cs.",Up up down down left right left right BABA~ YEEEE I'm ferocious.,This game is trash...,MVP! Right here!,Rie Tanaka,I don't want this!,"Wow~ Thank you, Master!","This... I wanted this for such a long time... You're the best, master~","I-I-I have a lot of experience with Dating Sims, but I'm still so nervous...","Oh, it's Master. Move aside, you're blocking the screen.",Don't you know it will taste better after being iced?,Level up!!! Now I've become stronger than ever before!,Afterall… What's the point of studying? Games are absolutely more interesting!,Need to find a new game to play now…,Get me a new version of the game console… Don't know what it is? Then Google it…,OHHHHH!!! This is a limited edition! Where did you get that?,"Okay, okay. I'll do what you said, don't kill my game!!!",A new room for me? Hooray... Just tell me the wifi code.,"Don't just stand there, I cannot pass this stage alone!",Play oneself to sleep… I thought I am the only one who would ever do that…,Do what you have to do! And bring the new game when you finish the internship~,Game rule 101: Collect your rewards.,School news? Maybe we can check it out after this stage is passed.,Is there any option to make the game harder?,This is the reason I don't want to fight this in the first place…,填充,填充,填充,填充
651011,Ennmaya,"Oh? You have some secrets. Not going to tell me? If I put on an act and play along, maybe I'll enjoy it!",Sun? It's best if the sun doesn't rise. Let's shroud the world in complete darkness.,How dizzying... This is the kind of person I hate the most.,Who will I savor today? This kid? But that one looks delicious too...,Sad. Angry. Melancholy. I am so full today. Can't eat anymore.,Little sister. Will you come play with me? I love you so very much.,Tell me why are you afraid. Huh?,Let darkness... Consume everything!,Takako Tanaka,Do you want me to eat you up?,"Considering you gave me this gift, I won't eat you today~",Smells like darkness~ I like that~,"I have to say I am happy when I am with you... Do you want to go a little further? Hey, if it is you... Then it's no problem.","We meet again, Human. Aren't you going to run? Hahahaha...",Hmmm? This tastes good~,The power of darkness increases! It’s really nice.,"Now I've moved into the upper class, people look much more appetizing here~","The more powerful the emotions humans can express, the more powerful I will become~","No matter the power is from light or darkness, it's the power's owner to decide if it is evil.",Huh? You happened to pick the gears I like.,Who am I going to eat today?,Can you offer a darker place? The light bothers me.,"Welcome back, Senpai~","I detect no emotional readings... Ah, he's asleep ...","Human, it's time to go to work~","If you don't claim your rewards in time, I'll take it~","I'm not interested in campus news ~ However, I'm sure you should take a look.","Get back, I believe you can take more torture from me!",Ugh… That's too shiny for me…,填充,填充,填充,填充
651012,Cynthia,Ah~ It's you're the one recruiting butterflies? Hmm~ OK~ So let's do happy things together!,Oh no` Can't help but raise my children~,Uh ~no ~OK ~This kind of thing has to be done at a place where nobody is there.~,Relax~ I'm here. Love you~,Butterflies can take me to any place I want~,"Shush! Quiet down~ Look, someone will notice us~","Butterflies, take me to victory.",Be my bait!,Rie Tanaka,What's this? You don't like me anymore?,"Oh? What a nice surprise. A gift for me, thank you~",I like it very much~ Let me think about gift for you...,A butterfly fluttering around in the air eventually landed in the arms of someone she could trust...,Welcome~,I want more~,Hehe~ Can you hold on to me?,"Please take good care of me in the next year, Senpai~",Don't you want to feel my change up close? Hehe,Clothes are meant to be taken off.,Is that all that you want?,Let's find a place no one else can reach~,I hope the bed could be bigger~,You've kept me waiting long enough~,I was prospecting something else besides sleeping~,Return once you've completed your job. I'll be waiting for you in bed~,Don't forget your rewards~,"I hope you're thinking of me, not the news.",Useless punks~,Hey~ Chill out! You're being too rude~,填充,填充,填充,填充
651013,Werewolf,"Human, I come to help you in the name of nature. If you want to be stronger, you must be one with it.",Go with the clan and become stronger. That's what my instincts tells me.,We can't grow stronger without facing danger and terror.,No one can resist the forces of nature. Nature is the strongest thing in the world.,It is man who destroys themselves.,"If we can't coexist with nature, we will destroy ourselves.",Concentrate.,*Howl*,Junko Takeuchi,I just cannot understand why something like this would exist.,Wow is that for me? Thank you~,"The true force of nature! Glad to work with you, human~","All of us are born from nature, and will eventually return to it when our lives come to an end. However, the time we have before that belongs to ourselves and not to nature.","Welcome back, Senpai!",It's not something I can find on a grassland… It tastes good though.,Weak meat and Strong food.,"In my homeland, all the knowledges are told from the elders, so I'm actually not very used to learn them from books… But I'll try my best.",Try your best to survive.,Strange costumes… Maybe I shall try something new.,I feel power from these gears~,Return to nature~ It's good for you.,I smell Senpai in this room…,"Ah, you've returned. Welcome~",It's quiet out there.,"In order to survive, you need to go and earn your daily bread!","Senpai, the rewards~",It's the sound of chaos… Don't you understand? Something must be happening!,Nature will rise against you!,I concede to you…,填充,填充,填充,填充
651014,Nona,What's the strongest piece in chess? Queen. She does whatever she wants. I want to be the queen. And those troublesome chores are yours to deal with.,It's all under control!,"From a mental standpoint, nobody can surpass me.","I don't have time for these trivial matters. Otherwise, it will affect my IQ!",The way chess pieces move is too fixed! I don't move like that! I can do whatever I want! I don't follow the rules!,Let's say the gap between my IQ and yours... Wait. Bad example. The gap is too huge.,Hmph! Let's see the difference in IQ~,Checkmate!,Rie Kugimiya,Hey~ Are you teasing me?,You should be grateful that I even accept it~,"Oh, this is a gift from the King to the Queen? It's not bad, thank you~","Do I have what it takes to accept your vows? Do you think I will fall for your tricks that easily? ...Don't worry, I was just playing with you. I will accept your vows~","Welcome back, mortal~",That's not enough. Don't you understand how important I am?,I've become more superior than the mortals~ He he~,That's just a piece of pie~,"All in my prediction, very well~",Are you trying to make me look bad?,The best gear for the best ME!,I won't hang out with those idiots~,"Get out, I'm going to take a nap~","Right on time, I'm getting bored!","You should be more energetic... Sorry, I asked too much for a mortal~",You're still not powerful enough to live without intern.,"If you're not taking the reward, I'm gonna keep it.",It's so boring--- Wait. Something interesting is happening!,I've lost interest in you~,Only barbarians would get what they want only by force…,填充,填充,填充,填充
651015,Gambler,"Ah~ Congratulations, this isn't a spade K~ This is the strongest card. You seem to have a lot of good things. Are you going to trust me with your life?",Draw cards. The chance is one-half. But I'll definitely win.,Wealth or health~ It doesn't matter which one you choose. You'll lose for sure~,"Don't pull my rabbit ears! Go away, gosh I hate you!",Whoo~ How scary~ How scary~ Did I get the guess right about your aspirations?,"Luck is my greatest strength~ Ah, do you want me to prove that?",It's showtime～,My turn~,Yōko Hikasa,Forget it... I thought you weren't doing it on purpose. I'll forgive you this time.,Is this for me? Thank you~,"No playing cards? Then let's settle for the next best thing~ Your gift looks pretty fun, so let's make use of it!","You've won the game...fine, as per the terms of our agreement, I'm yours~",Yo ho~ Senpai is back!,Ah~ It's not bad~,What has to happen will happen~,Do you think my opponent will be stronger than before?,"Why don't you give me some more materials? If you agree so, I will let you win when we play trump card next time~","If you give me one piece of equipment, I would win you five. How about that?","This clothes suits me, I'll keep it!",What do you want to play today? Just say whatever comes into your mind.,Do you want to bet this room against what you lost the last time?,Welcome~ Hope you can win your room back today~,"You can't sleep if you're not well covered or you'll get sick. And after that, who will be playing cards with me?",It's time to go to work~,"Before we start the next round, why don't you claim your rewards first?","Don't worry, nothing will happen to you as long as you stay with me!","Sorry, but I'm on the lucky side today.",Huh? How? This is impossible…,填充,填充,填充,填充
651016,Fencer,Fencing is an art. It's not hard to swing a blade. But becoming a master is a different story. You must be strong and beautiful.,"Talent, effort, and faith. These are what is required to be a swordswoman.",Delicate and elegant. Swordsmanship is an art!,I accept your challenge! I like what is beautiful and powerful.,"More than 50,000 swordsmen are stronger than me in the world. That's why I aim high.",Don't retreat! Face death head-on! Retreating is worse than death!,"In the name of knight, attack!",Draw your sword.,Yōko Hikasa,Seriously??? Do you think my taste is just as bad as yours?,Haha~ You're not so lame after all~,"Hmm~ I admit you've done well... On the field of sending gifts, you've proven yourself... Hmph, t-thank you!","I am still not strong enough, and yet you still trust me. I am so happy~ I will work harder and keep practicing.... Besides fencing, I could also work harder on other things.","Hello! Senpai, did you practice fencing today?",An Exp drink after training is the best~,More people will be saved if I can thrust faster. I must become stronger!,"Well, besides having proper training, you should also show some effort on study!","I'm still not a qualified knight right now, but I do not cease advancing on my way there!",No one shall be blamed for well-equipped.,It really is a very nice piece of equipment. I'm sure you must have paid a lot to forge it~ Thank you! I will not disappoint you!,"For the ones who train hard every day, this is nothing.",It's a nice place for me~,Are you here to practice fencing techniques with me?,"I discovered new techniques, maybe I can share my discoveries with you later~","It's almost the time for your internship, the contract says that you can not be late~ I suggest you obey that.","You still have rewards unclaimed, and they're what you deserve.","There's something interesting going on on campus, maybe you would want to check it out?","If you also train hard as I do, you can also win like this!",It's a pity to lose this time. But we shall train harder and win back later!,填充,填充,填充,填充
651017,Sakura,"With the cherry blossoms, I shall stand by your side, as well as... My undying fealty.",Cherry blossoms will fall sooner or later. Good things won't last forever.,Please don't be sad. At least the flower has proved its existence value at the instant of its bloom.,My sword is light... Like cherry blossoms in the wind... Gentle yet powerful... There's nothing I can't cut.,Did you see that? The even the moment it withers is so beautiful... Cherry blossoms.,Seeing the wonderful life of cherry blossom... Shouldn't we do our best to live like it?,Let the flowers blossom on the battlefield!,"Flowers, seal them!",Natsumi Haruse,"My apologies, but I have no idea how to handle this… They are too high tech for me to understand.",You have my gratitude.,"I never imagined there to be something this wonderful… Thank you, this means a lot to me! I really appreciate it~","No matter how long it will take, the cherry blossoms here will await your arrival, and bloom only for you.","Cherry blossoms will bloom in a blink of an eye, Senpai. Please cherish all the time we spent together.","This happens every day, don't get too surprised.",I will continue to protect everything.,"It's almost time to go to class... Wait, it's also about time for the cherry blossoms to bloom, right?",People will wait for the day when the cherry blossoms bloom because they fall quickly.,"Don't bother, I've brought my own gears.","The metal feels cold, but I can understand that's something necessary.","Understood, thank you.",What a peaceful place~,"I'm going out to train, do you want to come with me?","This is the first time I have seen you so calm, maybe I should use this metallic device to record this moment?","Senpai, don't forget your arrangement, you have to go to work.","Senpai, you haven't forgotten to claim your rewards, right?","Senpai, something is happening near the cherry trees, let's go check it out!","It takes a lot to take lives, but I won't hesitate to do this to my enemies.","Retreat now, there's no winning here.",填充,填充,填充,填充
652001,Guan Yin,"Yes, I understand your firm heart. But physically, it's a long way off. Let's get to know each other.",Both men and women should keep training!,You are the only one who can protect yourself. Abandon the naive idea that you want to depend on others for the rest of your life!,Raise your head up high! Bowing is for the weak!,"Don't be afraid, the only thing that can intimidate you is your stronger self.","Hey, don't be afraid of failure. Fear is the true failure.",Guan Yin here! Those standing in my way shall be slayed!,Slay everything!,Yū Kobayashi,I have no interest in dishes like this one.,Thanks for choosing a special gift for me.,"Wow, this can be compared with Sonya's dishes! Thank you for that~",Is this what it feels like to finally have someone that can understand me and match me in strength...I'm honored to be here with you~,Hey! You've got a little bit stronger than before. Not bad.,"Well, recovery is also a part of training!","You need to exceed your limits, so that you can become stronger!",The one who is invincible in battlefields should also exceed others in studying!,"""Goddess of War"" is but a title, you will need to prove that you deserve it!","For me, there is no difference between fighting with my bare hands and fighting with that!","With this equipment, I will be able to use my power even more efficiently. Thank you!","Are we going for the Pork set meal… Sorry, I'm a little hungry…",Can you bring Sonya to me? I'm a little hungry~,Ah? Do you want to try this? This is the meal that Sonya just brought me!,"Senpai's asleep... You'd possibly catch a cold here, better take you back... Lighter than I thought.","It's time to go to work, do you need any help?","It seems you have some rewards remain unclaimed, please keep that in mind.",Is it an incident at the school? I'll check it out for you~,I'm just doing my job.,Fight me again! I was not ready when you attacked!,填充,填充,填充,填充
