id,name,dialog,click_dialog1,click_dialog2,click_dialog3,click_dialog4,click_dialog5,battle_dialog,skill_dialog,cv_name,love_gift_dialog1,love_gift_dialog2,love_gift_dialog3,vow_dialog,login_dialog,lvlup_dialog,gradeup_dialog,shengxue_dialog,awake_dialog,equip_dialog1,equip_dialog2,hangteam_dialog,house_set_dialog,house_dialog,idle_dialog,dagong_dialog,daily_mission_dialog,new_stage_dialog,victory_dialog,failed_dialog,love_point_dialog1,love_point_dialog2,love_point_dialog3,love_point_dialog4
51007,Wildtress,"Hey hey, give me some meat! It's not for me, it's for the elephants!... Eh? Elephants are herbivores?",Let me stomp them flat!,Vegetables? You don't need that! You can't grow stronger without meat!,Break the bones to make soup.♪,"You should eat meat, too. The most delicious thing in the world is meat. Meat is justice!",I'm not sure if you have something more valuable than meat~,Fight for meat!,Go home!,Junko Takeuchi,Neither delicious! Nor amusing!,What's this? Can I eat it?,"Meat stands for justice! Finally, you're starting to understand~","Having someone to eat with is great, but someone who can cook for me? I'll spend my whole life with him!",Master! You're back. I want some meat!,It will taste better with meat!,I shall be faster. I don't want Quinie to take all the food I deserve next time!,What? Graduate? Does that mean more meat in Cafeteria?,No dieter ever becomes stronger!,I'll need another gear set for my pet~,Surrounded by food~ That's what I call paradise!,I hope to see you preparing a barbecue when I return~,"This is not bad, as long as I'm not living with Sonya.",Senpai! Do you bring anything to eat today?,"You don't look well, Senpai. I told you that you should eat more.",Senpai! Time to go and earn meat~,Remember to collect your daily rewards. I don't want to see you have not enough money to buy me enough meat.,"What happened… Not my business, as long as it's not happened in Cafeteria~",The biggest mistake you've made is to stand between me and meat!,I need more food before I can actually fight…,填充,填充,填充,填充
51008,Sakura,"With the cherry blossoms, I shall stand by your side, as well as... My undying fealty.",Cherry blossoms will fall sooner or later. Good things won't last forever.,"Please don't be sad. The instant the flower blooms, it is the most dazzling moment.",My sword is light... Like cherry blossoms in the wind... Gentle yet powerful... There's nothing I can't cut.,Did you see that? The even the moment it withers is so beautiful... Cherry blossoms.,Seeing the wonderful life of cherry blossom... Shouldn't we do our best to live like it?,Let the flowers blossom on the battlefield!,"Flowers, seal them!",Natsumi Haruse,"My apologies, but I have no idea how to handle this… They are too high tech for me to understand.",You have my gratitude.,"I never imagined there to be something this wonderful… Thank you, this means a lot to me! I really appreciate it~","No matter how long it will take, the cherry blossoms here will await your arrival, and bloom only for you.","Cherry blossoms will bloom in a blink of an eye, Senpai. Please cherish all the times we spent.","This happens every day, don't get too surprised.",I will continue to protect everything.,"It's almost time to go to class... Wait, it's also about time for the cherry blossoms to bloom, right?",People will wait for the day when the cherry blossoms bloom because they fall quickly.,"Don't bother, I've brought my own gears.","The metal feels cold, but I can understand that's something necessary.","Understood, thank you.",What a peaceful place~,"I'm going out to train, do you want to come with me?","This is the first time I have seen you so calm, maybe I should use this metallic device to record this moment?","Senpai, don't forget your arrangement, you have to go to work.","Senpai, you haven't forgotten to claim your rewards, right?","Senpai, something is happening near the cherry trees, let's go check it out!","It takes a lot to take lives, but I won't hesitate to do this to my enemies.","Retreat now, there's no winning here.",填充,填充,填充,填充
51009,Giana,"Master, I'll be your personal dancer.",This dance will bring you God's blessing.,"Someday, I'll stand at the top. Praised by all!",Dance! Let everyone know the beauty of harmony.,"Wherever there is a stage to dance at, I'll be there.",Meaning of life..? To show others the beauty of harmony through dance.,Dance to a Battle Song.,Dance with me,Minori Chihara,Don't ever give me that gift again! It will mess up my dancing!,"Are you here to enjoy my dance? Oooh, a gift? Thank you~","Thanks for your gift, master. And in return, let me teach you how to dance~","It's not important whom I dance for, but I'd like it a lot if you will be there whenever I dance in the future~",Master. You came. Wanna see me dance?,Thank you~,Do I look more charming than before?,Maybe I shall celebrate this?,"I will keep dancing, with or without audience.",This dress can be used in my performance.,It's really nice! Can I try it on right now?,I'm happy to obey your orders~,Is this the room for me? Hope it has soundproof walls~,"I've developed a new dance, it's your lucky day~","You look tired. If you need a rest, please use my tails as the pillow.","It's time for you to work, I need a rest too~",Don't forget your rewards~,Anything new on campus?,It's already enough for me to know that I've actually helped.,"Don't worry, they won't win next time.",填充,填充,填充,填充
51010,Ennmaya,"Oh? You have some secrets. Not going to tell me? If I put on an act and play along, maybe I'll enjoy it!",Sun? It's best if the sun doesn't rise. Let's shroud the world in complete darkness.,How dazzling... This is the kind of person I hate the most.,Who will I savor today? This child? But that one looks delicious too...,Sad. Angry. Melancholy. I am so full today. Can't eat anymore.,Little sister. Will you come play with me? I love you so very much.,Tell me why are you afraid. Huh?,Let darkness... Consume everything!,Takako Tanaka,Do you want me to eat you up?,"Considering you gave me this gift, I won't eat you today~",Smells like darkness~ I like that~,"I have to say I am happy when I am with you... Do you want to go a little further? Hey, if it is you... Then it's no problem.","We meet again, Human. Aren't you going to run? Hahahaha...",Hmmm? This tastes good~,The power of darkness increases! It’s really nice.,"Now I've moved into the upper class, people look much more appetizing here~","The more powerful the emotions humans can express, the more powerful I will become~","No matter the power is from light or darkness, it's the power's owner to decide if it is evil.",Huh? You happened to pick the gears I like.,Who am I going to eat today?,Can you offer a darker place? The light bothers me.,"Welcome back, Senpai~","I detect no emotional readings... Ah, he's asleep ...","Human, it's time to go to work~","If you don't claim your rewards in time, I'll take it~","I'm not interested in campus news ~ However, I'm sure you should take a look.","Get back, I believe you can take more torture from me!",Ugh… That's too shiny for me…,填充,填充,填充,填充
52001,Hottie,"Greetings, Master. You won't be lonely in the nights with me by your side.","Coffee, tea or me?",I can do anything for you.,There's no need to be serious in front of me~ I know all about you.,Do you want to play with me? Surely you'll be satisfied!,"As long as you can be happy, I can do anything~",Love me~,Hmm~ That burning sensation~,Mitsuki Nakae,What's wrong? This isn't like you~,Some presents are never too small after all. Thanks for that~,Maybe I shall consider myself as a present in return? Haha~,"I thought we've already passed this stage by now...here, come closer...mwah~","Waited a long time, Master. How do you want to have fun today?","[Kisses] ~ I'll trade you a kiss for a drink, I believe this is an even deal~",Why are you staring at me? Even I would somehow feel embarrassed~,You don't study enough~ Do you want me to give you private lessons?,"You've taken another step closer to mature, congratulations~",It's a rare opportunity ~ Maybe you should let me try one something more special? Ahaha ~,These are really nice clothes~ Maybe you prefer when I'm not wearing anything?,It's a rare chance for us to be in this place~ Don't you want us to have some fun?,"Wow, this place is nice~","Don't leave me alone here, stay with me~","You look so tempting when you close your eyes and let your guards down… Ah, I cannot think anymore before I actually do something to you~","Senpai, maybe you can skip today's work and stay with me? No, I'm kidding, go ahead!",Don't forget to collect your rewards~,Let's go together and see if something's happening on campus~,I was expecting more resistance.,Stop! That's going to hurt tomorrow~,填充,填充,填充,填充
52002,Blowie,"Seriously? My hair isn't dried yet and I have to go out~ If you don't treat me right, I won't forgive you.","Since you're my master, remember to dress up! Don't be lazy. Your hair needs to be constantly taken care of ~",This hair dryer will blow all your troubles away~,Welcome to visit~ Let me help wipe your back~,Should I take a rose bath or a lily bath~? Which is better?,Hehe~ I've been through a hundred battles. Don't believe me? Let's go.,Okay! I'll help you dry your hair~,Whooaaa~,Haruka Tomatsu,I hate this thing... I really don't want this~,I barely accept~ Don't let me down next time~,You didn't let me down~ Let me think about how to reward you~,"Starting from today, I'll allow you to rub my back~I sure will look forward to that~","Hey, wanna go to the bathing spot with me?",The drink after shower tastes the best in the world~,"Bathing is also a method to become stronger! Bubble bath, current bath, hot spring bath… Each one of them can make you a better person~","All work and no play will make you a dull boy. Come, live a little and have a shower with me~","This is a new hair-dryer, do you want to see what it can do?",I totally don't understand why they invented tights.,This is a nice bathrobe~,I will be there right after a shower.,Can I take my bathtub into the room?,"Are you here for a shower, Senpai?",Take your time. It must be a tough day...,Isn't it already the time for work?,The rewards are still waiting for you to collect~,You're going to solve the problem again? I know it's your duty but... Don't put all the stress on yourself~,That's what we call an absolute win!,I should take a shower before battle next time...,填充,填充,填充,填充
52003,Chevalir,"If you can beat me, I'll see you as my, Master. Want to try me?","Even if I have one eye, I won't lose to you~ Come!",That's a good way to talk. The men in our grassland are all hands-on and never say anything~,Are you provoking me? Ha~Ha~ It’s been awhile since someone is so eager to seek their own death~,"Oh~ Straightforward, I like people of like you! Ha ha~",See that wolf? I can take it down in three seconds. Wanna see me try?,Do you want to get cut?,Cut!,Seiko Yoshida,Are you kidding me?,"Oh, thanks~",Looks like you truly know me~,"I want to ride with you in the sunset...it sounds weird when I'm not in my usual attire, isn't it?","Senpai, don't run! My fist is a little itchy. Practice with me!","That's the drink they've been talking about, right?","I found myself become stronger after all this, Senpai!",Guess I'm going to bother you more on study in the future...,I don't care if I can become stronger or not as long as I'm free to do anything I want.,People rely on clothes horse saddle~,"As a gift, I can think of few better~",Do you want a ride with me?,Hope you've also prepared some fine hay for my horse…,It's about time for you to be here~,Senpai is so cute… Ahhhhh! Better find a distraction before I commit a crime…,In case you late for the internship. I'll ride you to the working place!,Just claim the rewards quickly!,Something's happening? Hope the fun part is not over when I get there!,It always feels so good to win a battle!,"Ouch, maybe we shouldn't fight this one.",填充,填充,填充,填充
52004,Saint,"Hello, I heard you're nice. In my academy, people like you are needed. How about rule this academy together?",Law and order are made by the strong. So I'll be the law.,"No matter how dirty you play, no one will be knowing that if you win.",History is written by the winners. The weak have no right to intervene.,I just want to make the college more orderly. To be the strongest in this college is my goal.,"I don't like things I can't control. In order to control this, I need to get stronger.",I'm no longer pulled by any strings.,Get out of the way,Rie Tanaka,This... Is useless to me.,"Ah, I have to admit, it is a friendly exchange within the law.","I have to admit, I like this present very much. Maybe you should join me on this adventure?","Oath? I already said yes. You just haven't realized it... How can I do it with you? Well, that is just a part of rules, Huh~",Wanna conquer the world with me? Great! Welcome back!,I want some more!,I can feel the power! Now all that I need is an excuse to use it!,I'll need others' help to achieve my ambition. Let's start with you!,"Without power, all ideals are just nothing!",Give me all what you got!,Nice gear! Thank--- I mean I accept your tribute~,I'll do that as long as I'm the team leader.,I can use this room as my HQ.,"Please, join my military counsel in the remaining part of my meeting.",Uh… Was my lecture this boring?,Don't forget to work!,Get me my rewards back!,Go and check what happened and report back to me.,"Let the weaklings back off, this is not somewhere for them to have fun!",This defeat won't stop my campaign…,填充,填充,填充,填充
52005,Javelin,Javelin here. I will cut down the wicked!,Slash-the-evil!,Cut down all obstacles!,"Where morality and justice is, I'll be there even if I had to cut billions of them!","Even if they have billions, don't think they will stop me!",I don't need a horse if I have this javelin!,I am Javelin,Strike!,Romi Park,Don't bother me with this!,I will follow my own path to the future with this.,Your gift truly brings peace to my heart~ Thanks~,I pledge to you my loyalty; I will become your sword and your shield.,"Master, seeing you makes me feel at peace.",Thank you very much~,"Thank you, I will try not to disappoint you!",There is no end to the path to becoming stronger. Power and wisdom are both essential. There's still a long way to go.,"Thank you, Senpai. I can always learn something as long as I stand by your side.",It's important to be elegant in any kinds of situations~,It's really great to be able to get gears like this ~,Where are we heading today? I'll follow your lead~,Your room is really nice~,It's been a long day~,"You can't sleep here... Take my hand, I'll take you to the bed…","It's time to go to work, let me come with you.",You have uncollected rewards!,"Something is happening on campus, stay behind me, I will protect you!","Winning is a good thing, but it's still not worthy enough to brag about.",I need more training to win this…,填充,填充,填充,填充
52006,Geisha,Ah? Is it my turn? Don't be in such a hurry... I'm ready now.,"People remember not what they got, but rather what they didn't get.","Prince Charming's charm is not because of him being the prince nor because of the white horse, but because of his identity.",What really matters is what you can't see with your naked eye. How many people can accurately evaluate a person's inner self?,Men are creatures who choose their subjects based on their looks.,"Love from the heart, cannot be controlled.","Everyone, please be careful.",Rebirth of Life...,Kana Hanazawa,Are you trying to mock me by giving me this?,"Thank you, master~","You're so crafty, master... I can’t resist this temptation... You should be more responsible~",You must feel extremely lucky right now to have won my affections...,Will Senpai be a good or a bad person today? Hahaha!,"Hehe, I'll only take the part I need, don't worry.",I must have become more beautiful! What? No?… Tch! You surely don't know how to make proper conversations!,I don't like to study at all~ Maybe you can finish the homework for me.,Just admit you have been attracted by my beauty! Hahaha~,Help me with the zipper~ Finally~ It was harder than I thought… There's no way for me to become fatter. It must be you picked a wrong-sized dress!,Only this kind of gorgeous clothing can suit my beauty!,You should appear to be honored to stand by my side~,Why everyone is leaving this room once I opened the door?,You've finally returned! No one tried to talk with me during your absence!,"Wake up, I want to share my experience during the lute race 2 days ago.",Internship is important! Don't forget about that!,Maybe you can claim your rewards later and spend more of your time on me~,Why is it so noisy on campus?,Just give up the resistance and kneel for my beauty!,Why you would dare to harm such a beautiful lady…,填充,填充,填充,填充
52007,Sonya,"Hello! Master came. Let me do it! Otherwise, my two sisters will not be able to see it!",Knock them! Knock them! The enemy will all be knocked back!,I'm tired of speaking in theory and reasoning! Who cares about such verbal garbage.,Why talk when you can just fight? Fight first! Talk later!,Eat! Eat! It tastes like heaven! This one is good too! And that! Food is the best!,I'm Sonya the Great! I own of this street! Remember that!,Finish them off!,I'm angry!,Yū Kobayashi,I don't need this!,"Oh, thanks!","Aha, it's been a long time since I last tasted this! It really takes me back~ Nice~","I-I'm bad at words, you don't have to say anything more to woo me...just holding my hand will be enough...","Hey, isn't this Master? Good morning!",Oh! Is this for me?,"My fist is more powerful! I want to try it right now! ...Master, why are you running away from me?",How much longer should I continue studying? It's boring to be in the classroom all day long!,There is nothing be solved by force! You want me to demonstrate?,"Thank you, Senpai! I can give you free food next time when you come to my cafeteria!","After having this on, I won't be losing any battles!","I'm going for a walk. Do you want to come with me, Senpai?",This room is really nice! I want to have a rest inside~,"You came right on time, I was just going to cook!",Ah? Why aren't you responding? Are you hungry?,Go go go! It's time to go to work!,Don't waste your rewards!,Is there another fight on campus? Count me in!,Who's next?,I have to admit the enemy is stronger than I predicted...,填充,填充,填充,填充
52008,Caitlyn,"Master, it's easy to feed me. As long as there's a place to sleep, a place to eat, and an internet connection. That's all. Ah, remember to buy me the latest game!",Ah... Do not... I don't want to get up... I'm sick and dying when I get out of bed.,It's so sunny outside that I still have to play games at home. Games are the best!,"Whether it's work or sports, there is nothing more interesting than games.","Which one do you want to buy? Compared to bs vita, I prefer 3cs.",Up up down down left right left right BABA~ YEEEE I'm ferocious.,This game is trash...,MVP! Right here!,Rie Tanaka,I don't want this!,"Wow~ Thank you, Master!","This... I wanted this for such a long time... You're the best, master~","I-I-I have a lot of experience with Dating Sims, but I'm still so nervous...","Oh, it's Master. Move aside, you're blocking the screen.",Don't you know it will taste better after being iced?,Level up!!! Now I've become stronger than ever before!,Afterall… What's the point of studying? Games are absolutely more interesting!,Need to find a new game to play now…,Get me a new version of the game console… Don't know what it is? Then Google it…,OHHHHH!!! This is a limited edition! Where did you get that?,"Okay, okay. I'll do what you said, don't kill my game!!!",A new room for me? Hooray... Just tell me the wifi code.,"Don't just stand there, I cannot pass this stage alone!",Play oneself to sleep… I thought I am the only one who would ever do that…,Do what you have to do! And bring the new game when you finish the internship~,Game rule 101: Collect your rewards.,School news? Maybe we can check it out after this stage is passed.,Is there any option to make the game harder?,This is the reason I don't want to fight this in the first place…,填充,填充,填充,填充
52009,Guan Yin,"Yes, I understand your firm heart. But physically, it's a long way off. Let's get to know each other.",Both men and women should keep training!,You are the only one who can protect yourself. Abandon the naive idea that you want to depend on others for the rest of your life!,Raise your head up high! Bowing is for the weak!,"Don't be afraid, the only thing that can intimidate you is your stronger self.","Hey, don't be afraid of failure. Fear is the true failure.",Guan Yin here! Those standing in my way shall be slayed!,Slay everything!,Yū Kobayashi,I have no interest in dishes like this one.,Thanks for choosing a special gift for me.,"Wow, this can be compared with Sonya's dishes! Thank you for that~",Is this what it feels like to finally have someone that can understand me and match me in strength...I'm honored to be here with you~,Hey! You've got a little bit stronger than before. Not bad.,"Well, recovery is also a part of training!","You need to exceed your limits, so that you can become stronger!",The one who is invincible in battlefields should also exceed others in studying!,"""Goddess of War"" is but a title, you will need to prove that you deserve it!","For me, there is no difference between fighting with my bare hands and fighting with that!","With this equipment, I will be able to use my power even more efficiently. Thank you!","Are we going for the Pork set meal… Sorry, I'm a little hungry…",Can you bring Sonya to me? I'm a little hungry~,Ah? Do you want to try this? This is the meal that Sonya just brought me!,"Senpai's asleep... You'd possibly catch a cold here, better take you back... Lighter than I thought.","It's time to go to work, do you need any help?","It seems you have some rewards remain unclaimed, please keep that in mind.",Is it an incident at the school? I'll check it out for you~,I'm just doing my job.,Fight me again! I was not ready when you attacked!,填充,填充,填充,填充
52010,Librarian,Do you have a dream? I want to be a writer. I hope the stories I write can make so many people happy.,I truly love reading books. I can see the hidden side of human nature from the authors who wrote them.,No books should be thrown away. Books can't be wrong.,"Once you finish reading a book, does the story end? No! We could continue them in our hearts.","Everyone can feel that same happiness from reading a book, no matter who you are! That is the charm of books.","Whenever you're feeling lonely, open a book. Books can take readers to a wonderful world at any time.",Want to read with me?,Cannot leave without permission~,Saori Hayami,"Sorry, this gift doesn't suit me.",Much obliged~,I really like this gift and I won’t fail you~,"I will write down everything that happened today, so we will be remembered. No matter how much time has passed, as long as we are remembered, we will live on in people's memories.",Good day! Did you read the book I gave you last time we met?,"I told you not to interrupt me when I'm reading, Senpai… A drink? Thanks~",Knowledge is power!,"Don't skip class in the new semester anymore, Senpai~",I can always get some inspirations from you~,Armor… I'd rather exchange this for a book.,Maybe you can design a pocket for this armor to hold books…,Can I read my books during work time?,"A quiet room, that's all I need~",Are you here to visit my reading room?,"You don't have to work so hard for the test tomorrow, Senpai… I'd better fetch you a coat.","I'm glad that you're here to join me in reading, but it's almost time for your internship!","You still got rewards unclaimed, Senpai!","Something happened on campus. Senpai, how about a reading-break?","Senpai, this is easier than solving the problem I found in the textbook yesterday.",Failure is the mother of success. That's the reason we cannot give up this early.,填充,填充,填充,填充
53001,Priestess,"I don't usually accept disciples, but I sense something shining in you. Would you like to be my disciple and stay away from this mundane world?",I never accept disciples. An easy and carefree life is the best~,Life is short~ Enjoy the moment~ What's the use of being bothered~,The Tao that can be told is not the eternal Tao. The name that can be named is not the eternal name.,Wiping out demons isn't that troublesome~ No need to thank me~,The world is a cycle of death and rebirth. Those who live must die. That is the principle of all living creatures.,A bit troublesome.,The cycle of rebirth.,Emiri Suyama,Ah~ Even you don't know what's in my mind?,Thank you very much~,"This gift... Thanks... Finally, you know my inner Dao...",I've decided to settle down~ There is no true freedom without you by my side. You have the responsibility to take care of me!,"After seeing you, I guess my day won't be purified from illusion.",Get rid of the stale and take in the fresh.,Let weakness become strength!,I just let nature takes its course.,Balance is to be preserved.,I'll try how this works out.,I'll be extremely cautious when using this.,No evil shall prevail!,This is enough for me.,"It's been a long time, Senpai~",It's not easy to find inner peace~,"It's time for the internship, so I won't bother you during this period of time.",You should take the rewards you deserve.,"As one of the students, I have no reason to stand aside from the crisis happening.",I would destroy these evils even if that wasn't your order.,This is my fault to fail the order I followed.,填充,填充,填充,填充
