id,title,name,dialog,select_text
205314,,鄧艾,黏糊糊的觸角，滴落在臉上的血滴，還有牆角突然冒出的肢節……這裡簡直比地獄還恐怖……,
205315,,*,（糟糕，好像過頭了）,
205316,,鄧艾,還好……一直有學長在陪著我，謝謝你……學長！,
206101,服裝店-1,鄧艾,學長，來這種地方做什麼？我根本不需要什麼新衣服……,
206102,,*,那小艾今天的裝扮是怎麼回事？況且沒有女生會拒絕款式新穎又符合潮流的新衣服吧，既然已經來到這裡了，不如一起進去看看吧？,
206103,,鄧艾,我今天的裝扮？……很難看嗎？,
206104,,鄧艾,其實，其實也沒有花多久……學長喜歡就好……,
206105,,鄧艾,太好了，原來你喜歡啊……（小聲）,
206106,,*,小艾剛剛在說什麼？,
206107,,鄧艾,沒什麼，是學長聽錯了……,
206108,,鄧艾,只是清新動人而已嗎？唉，如果能更多地……誇讚……（小聲）,
206201,服裝店-2,服裝店店員,歡迎光臨，兩位客人請隨意挑選~,
206202,,*,小艾快看，掛在櫥窗上的衣服好像很適合你，要試試看嗎？,
206203,,服裝店店員,這位客人眼光很好哦，這可是本季新品。,
206204,,鄧艾,這……這種衣服，根本穿不出去的吧……,
206205,,服裝店店員,是覺得太保守了嗎？如果要說暴露的話，還是這件更勝一籌，小姐有興趣試穿嗎？,
206206,,鄧艾,誒？不……我果然還是試試這件吧……,
206207,,*,小艾如果不想試穿的話也沒有關係，那邊一件我覺得也很適合你哦，要試試看嗎？,
206208,,鄧艾,學長挑選的衣服……實在是太……果然學長根本不是什麼紳士吧。比起那件的話，我寧願試穿這件……,
206209,,*,唉，真是可惜，如果小艾不穿的話，恐怕沒有人可以完美演繹這件衣服了呢~,
206210,,鄧艾,學長的稱讚，我……真的可以接受嗎？,
206211,,服裝店店員,當然！這種事情請小姐好好相信專業人員和伴侶的眼光吧。,
206212,,鄧艾,是……是嘛，那我就勉強去試衣間試穿吧……,
206301,服裝店-3,服裝店店員,小姐穿上這件衣服後果然光彩照人，所謂人靠衣裝，說的就是這個道理呢。,
206302,,鄧艾,我還是覺得穿這件衣服有點不自在……果然還是原來那件日常款更適合我吧……,
206303,,服裝店店員,不如讓這位客人來點評一下吧~,
206304,,鄧艾,學長還是覺得這件比較適合我嗎？唔……雖然有些不太自在，但是果然還是相信學長的眼光比較好吧。,
206305,,鄧艾,誒？學長也覺得這件衣服比較適合我吧。好開心，果然學長的眼光和我很相似呢。,
206306,,鄧艾,誒？兩件都不太適合嗎……總感覺有些遺憾呢，難得學長想為我挑選衣服，但是卻因為不太相配的原因放棄了……,
207101,貓咪咖啡廳-1,鄧艾,貓咪咖啡館？和普通的咖啡館有什麼區別嗎？,
207102,,*,顧名思義就是有貓咪陪伴的咖啡館哦，唔，好奇怪，打聽到的地點明明是在這裡呀……,
207103,,鄧艾,誒？很多貓咪……是指這邊嗎？,
207104,,路邊的小貓咪,喵~,
207105,,*,啊呀，這是路邊的野貓吧~,
207106,,鄧艾,竟然一點都不怕人，是餓了吧？,
207107,,鄧艾,貓糧……學長竟然會隨身攜帶這種東西……難道平時一直有喂貓咪的習慣嗎？,
207108,,*,只是以防萬一，像這樣能夠親手餵養貓咪的機會可是很難得的，一定要好好珍惜。,
207109,,鄧艾,是這樣啊……原來學長很喜歡貓咪啊，真是湊巧，我也……很喜歡……,
207110,,鄧艾,這是什麼啊？,
207111,,*,水煮蛋，原本是當作今天的早餐的……想必小貓咪不會嫌棄的吧……,
207112,,鄧艾,稍微等一下，要像這樣，一點點把雞蛋剝給它……乖，乖，慢慢吃哦~,
207113,,*,原來小艾這麼喜歡貓咪啊，和平常的樣子完全不同~,
207114,,*,今天出門沒有攜帶食物呢，小貓咪真是抱歉……,
207115,,鄧艾,看起來沒有辦法了啊，乖~乖~下次一定會好好款待你哦~,
207201,貓咪咖啡廳-2,*,誒，這只小貓咪好像想要帶我們去哪裡，啊呀，原來貓咪咖啡館在這裡啊。,
207202,,鄧艾,原來小咪就是貓咪咖啡館的員工嗎？為了給我們這樣的顧客帶路才守在那裡？真是辛苦小咪了呢……,
207203,,店員,歡迎光臨，本店特有的貓咪陪伴服務想要體驗一下嗎？可以指定貓咪哦~,
207204,,鄧艾,灰灰身上是有英國血統的吧，唔好開心，和我來自同一個地方呢~灰灰雖然不怎麼黏人，但卻是非常好的傾聽者呢~,
207205,,*,這樣嗎？那灰灰我要告訴你一個秘密哦，不要告訴旁邊的這位小姐哦~,
207206,,鄧艾,什麼嘛？有什麼秘密是我不能知道的嗎？,
207207,,*,不行，所謂秘密更不應該告訴當事人啦~,
207208,,鄧艾,小斯擁有一雙藍寶石般的眼睛呢，非常美麗哦~,
207209,,*,總感覺它好像不太願意搭理我們呢……,
207210,,鄧艾,傲慢是波斯貓的特徵哦，但是我看得出來小斯其實不討厭我們呢，只是有些害羞。,
207211,,*,嗯？高貴又有些傲慢，總覺得跟小艾很相像……,
207212,,鄧艾,乖乖，被摸額頭一定很舒服吧~,
207213,,*,小咪真的很愛撒嬌，啊呀，已經打起呼嚕來了。,
207214,,鄧艾,很幸福呢，原來我這樣的性格也會被小貓咪喜歡呢~,
207215,,*,小艾是對自己有什麼誤解嗎？除了小貓咪還有很多人喜歡你的啊~,
207301,貓咪咖啡廳-3,店員,兩位客人對於我們的服務還滿意嗎？,
207302,,鄧艾,非常滿意，貓咪們都太可愛了。,
207303,,店員,太好了，兩位客人喜歡的話可以購買我們的套餐哦，憑套餐消費的話會有特殊服務哦。,
207304,,*,特殊服務？是指什麼呢？,
207305,,店員,客人不如來看看我們的宣傳冊吧。,
207306,,店員,購買豪華套餐後，每次到店都能自選3只貓咪陪伴哦，而且陪伴時長自動延長一倍~,
207307,,鄧艾,啊！光是想像就覺得很幸福了呢，各種各樣的貓咪陪伴在身旁~,
207308,,*,小艾看起來很開心啊。,
207309,,鄧艾,嗯！學長，謝謝你！,
207310,,店員,購買普通套餐後，每次到店都能自選1只貓咪陪伴哦，而且陪伴時長可以延長一倍~,
207311,,*,所以說這個套餐的主要作用就是延長陪伴時間嗎？嗯……感覺有些失望……,
207312,,鄧艾,沒關係，能夠時常來這裡的話，我已經很滿足了~嗯，下一次選哪只貓咪呢？,
207313,,鄧艾,誒？不購買套餐嗎……學長不喜歡小咪嗎？真是遺憾，看來以後要自己一個人來了。,
208101,英式茶餐廳-1,鄧艾,這裡是……,
208102,,*,自作主張地帶你來這裡了，小艾是在英國修習的劍術，一定很熟悉下午茶餐吧。,
208103,,鄧艾,等……其實也沒有非常瞭解……,
208104,,*,抱歉，那我們要前往別處嗎？,
208105,,鄧艾,不……剛好現在有點累了呢，坐下來稍微休息一下也是可以的。,
208106,,店員,歡迎光臨，是兩位客人嗎？挑選一下想要坐的位置吧。,
208107,,鄧艾,唔，這樣坐在窗邊看著熙熙攘攘的人群別有一番感受呢……,
208108,,*,這樣放鬆的時刻，很難得呢。,
208109,,鄧艾,說來慚愧，除了劍術以外的事情……其實都不是很瞭解。儘管一直待在英國，也從來沒有像現在一般悠閒地度過一個下午的時光，謝謝你……,
208110,,*,小艾也放鬆一點吧，不用這麼頻繁地說謝謝哦。,
208111,,鄧艾,四周……沒有人呢……,
208112,,*,很少有人會坐到這邊的位置吧，一不小心就變成我們的二人世界了呢。,
208113,,鄧艾,只是巧合而已，請不要這麼說，趕緊看看菜單吧。,
208114,,鄧艾,坐這裡嗎？周圍看起來人很多呢……,
208115,,店員,因為沒有特殊要求，就先按序號為兩位客人安排了，是哪裡不滿意嗎？,
208116,,鄧艾,不……不用麻煩了，這裡很好。,
208201,英式茶餐廳-2,店員,兩位是第一次光顧本店嗎？請一定要嘗嘗我們新推出的水果塔，口感豐富，相信客人不會失望的。,
208202,,鄧艾,喝下午茶的話，果然還是經典司康比較好吧……,
208203,,店員,啊呀，看來這位小姐並不是很瞭解本店呢，雖然司康是傳統下午茶的標配，但是口感較為普通，不如大膽嘗試我們的新品吧。,
208204,,鄧艾,儘管你說的有道理，但是……沒有司康的下午茶總覺得很奇怪，學長你覺得呢？,
208205,,店員,這位客人好眼光哦，選擇三層套餐的話，除了司康與水果塔還有鹹口的三明治哦。,
208206,,鄧艾,所以學長的選擇就是根本不做選擇嗎……總感覺這是一種逃避的方式……,
208207,,*,誒？我只是，想要多嘗試嘗試不同的……,
208208,,鄧艾,學長不用解釋了，這樣的選擇沒有壞處，是我奇怪的執拗在作怪。,
208209,,鄧艾,吃司康餅的話要像這樣用手小心掰開，然後再抹上果醬與奶油，學長嘗嘗看吧。,
208210,,*,小艾明明很瞭解下午茶的禮儀……唔……,
208211,,鄧艾,嗯？學長覺得如何？我也來試試看，好久沒有吃過司康了呢，期待~唔……,
208212,,*,果然……小艾也覺得……,
208213,,鄧艾,好像有點……太過幹了呢……學長，抱歉……,
208214,,鄧艾,學長……最後還是選擇了水果塔嗎？是不相信我嗎……,
208215,,*,小艾誤會我了，我只是覺得鮮豔的水果更能引起食欲~快嘗嘗看，我覺得看起來還不錯哦~,
208216,,鄧艾,既然學長這麼說的話，那……勉為其難地吃上一口吧，唔……,
208217,,*,怎麼樣？,
208218,,鄧艾,出乎意料的很好吃呢，抱歉，差點因為我的偏見錯過這款美食。,
208301,英式茶餐廳-3,鄧艾,學長，喝英倫下午茶其實是需要講究一定禮儀的。,
208302,,*,明明第一次來這裡的時候，小艾還聲稱並不是很瞭解呢~,
208303,,*,但是現在~就請鄧艾老師好好教導我喝英倫下午茶的禮儀吧。,
208304,,鄧艾,第一次只是因為……不想在學長面前出醜……不過既然學長已經向我請教了，那麼喝下午茶是先放牛奶還是先倒茶？學長有興趣猜猜看嗎？,
208305,,鄧艾,先倒牛奶的話可以避免滾燙的熱茶損壞茶杯，但是這樣的話就品嘗不到紅茶原先的風味了，稍微有些遺憾呢。,
208306,,鄧艾,先注入紅茶的話可以視需要慢慢添加牛奶，從而品嘗到不同濃度的奶茶了，當然這也是我最喜歡的方式。,
208307,,*,難得願意說這麼多話呢，果然小艾很喜歡下午茶吧。,
208308,,鄧艾,與其說是喜歡下午茶……不如說是喜歡和學長待在一起的時光。,
208309,,鄧艾,噗嗤，同時加入和直接喝奶茶有什麼差別呢？學長可真是會節省時間啊。,
208310,,*,誒？不可以嗎？這種事情根本不需要糾結吧，讓自己開心才是最重要的。,
208311,,鄧艾,嗯……糾結這種事情根本沒有意義，好好享受這段悠閒的時間才是重要的事情。,
209101,鮮花店-1,*,小艾快看，鮮花店門口擺放的花束都很新鮮呢，想要挑選一下嗎？,
209102,,鮮花店老闆娘,今天剛採摘的鮮花哦，有些上面還帶著露珠呢。,
209103,,鄧艾,不……不必了，鮮花的話，很容易被我凍傷吧……,
209104,,鄧艾,誒？我說過不……不用了，讓我去挑選只是白費精力……,
209105,,*,怎麼就能說被白費了呢？況且只是看一眼不會凍傷的哦~,
209106,,鮮花店老闆娘,這位客人真是完全不懂女孩子的心思呢，剛剛這位小姐明明是在說願意吧，因為沒有一位小姐會拒絕鮮花啊。,
209107,,*,小艾那朵冰藍色的薔薇花看起來很適合你哦，真的不想去看看嘛？,
209108,,鮮花店老闆娘,冰藍色的薔薇非常罕見，這可是今年的第一朵藍薔薇呢，錯過了的話會很可惜。,
209109,,鄧艾,學長真的認為很適合我嗎？,
209110,,*,當然，況且冰藍薔薇本來就生長在冰雪之地吧，自然不會害怕你的冰魔法啦~,
209111,,鄧艾,既然如此，那就去看看吧……,
209201,鮮花店-2,,正當準備與鄧艾進入花店的時候，一名陌生的學妹懷抱著鮮花哭泣著從遠處跑來。,
209202,,陌生的學妹,對……對不起！眼睛被淚水……蒙住了，沒有看清前面的路。撞到了您真是對不起。,
209203,,*,沒有必要為這種事情道歉啦，怎麼了？為什麼會懷抱著鮮花哭泣？,
209204,,陌生的學妹,失敗……表白失敗了……唔……我真是太失敗了，果然我這麼失敗的人不該去表白的吧！,
209205,,陌生的學妹,現在連這麼美麗的花朵也無家可歸了……,
209206,,陌生的學妹,等……等一下，兩位是情侶吧，既然如此，請收下這花朵吧！,
209207,,陌生的學妹,誒？為什麼？,
209208,,鄧艾,學長這麼說實在是太不近人情了吧，收下花朵也沒有什麼關係吧。,
209209,,*,雖然是這樣，但是在陪伴著小艾的時候收下別人的花，這種行徑也有在冒犯小艾吧。,
209210,,陌生的學妹,所以是願意收下嗎？,
209211,,*,嗯，我願意從你手裡重新買回這束花，美麗的花朵值得尊重，可愛的你也一定會找到尊重你的那個人。,
209212,,鄧艾,學長總是溫柔地對待每個人呢~,
209213,,陌生的學妹,非常感謝，總覺得我深藏在花束上的情感被傳遞下去了呢。,
209214,,鄧艾,嗯……學長收下了花，是不是意味著接受了她的心意呢？,
209215,,*,那……現在小艾願意接受這份心意嗎？,
209216,,鄧艾,誒？我嗎？學長……很狡猾呢……,
209301,鮮花店-3,鄧艾,風鈴、玫瑰、芍藥、百合……這裡的花很豐富呢。,
209302,,*,小艾原來認識這麼多花，也稍微讓我感到有些震驚呢。,
209303,,鄧艾,學長這麼說的話，不如猜猜我最喜歡哪種花吧。,
209304,,鄧艾,雖然藍色薔薇很難得，但是很可惜，恰恰是因為它的難得讓我覺得稍微有點奢侈了呢。在冰雪中傲然生長，但是其實也在渴望著溫暖吧，就像埋藏起來的心，也在渴望著別人的溫度。,
209305,,鄧艾,赤紅色的玫瑰無論什麼時候都非常耀眼熱烈呢，是奔放傾瀉而出的愛意。但是很可惜我一直沒有辦法像她一樣這麼熱烈呢，就算是愛意也會一直深藏在心底。,
209306,,鄧艾,（微笑）被猜中了呢……,
209307,,*,誒？小艾原來喜歡仙人掌啊，實在是太出乎意料了。,
209308,,鄧艾,即使是在環境惡劣的沙漠中，仙人掌也可以一點點,
209309,,*,其實……因為小艾太過堅強，總會給人一種觸不可及的距離感。,
209310,,鄧艾,就像它的花朵，像個保護殼將自己的華瑞牢牢封鎖，看起來是時候打開自己的內心了。,
210101,歇腳處-1,*,是歇腳處，不如坐下來休息一會兒吧，走了這麼久，小艾也一定累了吧。,
210102,,鄧艾,其實我還沒有那麼累，但是還是很感謝……學長，學長一直對大家都很關心呢。,
210103,,*,誒？總感覺這樣的對話有種奇怪的熟悉感……,
210104,,鄧艾,因為學長一直很溫柔的緣故吧，一定也對大家說過相似的話。,
210105,,鄧艾,學長的回答可以作為滿分答案了呢，只是這份滿分答卷交到我手裡的時候，稍稍有些不甘心……但是，究竟又是什麼不甘心……,
210106,,鄧艾,學長覺得這個問題很難回答嗎？抱歉，不知不覺中讓學長為難了。,
210107,,鄧艾,獨特？雖然聽到這樣的話心裡湧起了奇怪的滿足感，但是這樣的想法終究是不對的吧。誒？為什麼？因為……這樣對大家是不公平的吧。,
210201,歇腳處-2,*,走了這麼久，小艾一定口渴了吧，想要喝水嗎？,
210202,,鄧艾,水？抱歉，我沒有隨身攜帶水呢……,
210203,,*,小艾好像搞錯重點了，我是在詢問你有沒有口渴。,
210204,,鄧艾,突然問起的話，好像是有一些口渴，但是現在看起來也沒有辦法解決了吧。,
210205,,鄧艾,是……學長喝過的水嗎？對不起，我不能接受。不不，不是擔憂衛生狀況，只是因為……這樣的話，我們就是……kiss（超小聲）,
210206,,鄧艾,便利店的話……距離不遠呢，果然還是算了吧，這樣炎熱的天氣學長也很難受吧……,
210207,,*,小艾不用擔心，去去就回~,
210208,,鄧艾,這樣的話，我就用我的魔法為學長稍稍降下溫吧。,
210209,,鄧艾,飲品店的話是那家對吧，販賣的是那些五顏六色的汽水嗎？,
210210,,*,是哦，小艾有興趣嗎？,
210211,,鄧艾,嗯……如果加上我的魔法的話，想必這些汽水會更好喝吧。,
210301,歇腳處-3,*,起初邀請小艾的時候，我還以為小艾一定不會答應呢，沒想到小艾竟然赴約了。,
210302,,鄧艾,因為對很多事物都不太瞭解，所以之前一直不敢離開幽夢，離開劍術練習場……,
210303,,鄧艾,但是這次……是學長的邀請，很期待……,
210304,,鄧艾,行程單……原來學長做了這麼多的準備嘛？其實……我也有稍微寫一下計畫呢，關於和學長的……約會……,
210305,,鄧艾,送給我的嗎？這種東西不能收下……學長願意邀請我，其實已經很感激了，況且我也沒有禮物還給學長。,
210306,,*,這是我自願送給小艾的，不用回禮哦~,
210307,,鄧艾,不行，互贈禮物才是親密情感的正確表達方式，學長現在贈送的禮物我是無論如何都不能收下的。,
210308,,鄧艾,學長這是做什麼？誒？牽手是為了更好地抒發情感……,
211101,蘋果糖攤-1,鄧艾,學長……,
211102,,*,嗯？小艾怎麼了？（順著目光看過去）是蘋果糖呀，小艾想要吃嗎？,
211103,,鄧艾,嗯……紅彤彤的非常可愛……,
211104,,*,願意直接把自己想法說出來的小艾也非常可愛啊，想要哪一個呢？,
211105,,鄧艾,可……可愛……,
211106,,鄧艾,學長不要再胡說了，我和可愛這種詞……永遠都沒有關係的吧……,
211107,,鄧艾,什麼嘛……又是可愛又是美麗的……這種詞說到底不應該浪費在我身上吧。,
211108,,*,小艾是從哪裡得到的認知啊，在我心裡小艾真的非常美麗啊。,
211109,,鄧艾,更應該說不習慣吧……如果學長堅持的話，當然……是可以繼續這樣說。,
211201,蘋果糖攤-2,鄧艾,那個……學長，蘋果糖原來的姓名是太妃蘋果糖，是為慶祝聖誕而誕生的特殊糖果。,
211202,,*,是這樣的嘛？一直認為就是普通的糖果呢，小艾果然非常博學啊。,
211203,,鄧艾,這並不值得稱道，只是一些微不足道可有可無的知識而已。學長還是趕快嘗嘗手中的蘋果糖吧。,
211204,,鄧艾,學長只吃到了外表的砂糖漿吧，蘋果糖的外層就像外表一樣甜美哦。,
211205,,*,只是稍微有些太甜了些……,
211206,,鄧艾,這樣啊，不如再咬一口吧，吃到蘋果的話會緩解一下甜味。就像是人與人，瞭解越深入，越能知曉情感的多樣性……抱歉，一不小心說的太多了呢。,
211207,,鄧艾,學長有吃到蘋果吧，蘋果的酸緩解了外層砂糖的甜，酸酸甜甜的正是最可口的滋味。,
211208,,*,酸酸甜甜……就像戀愛嗎？心動的時候其實也是酸甜交織著呢。,
211209,,鄧艾,怎麼會酸呢？砂糖漿應該很甜啊……,
211210,,*,不知道為什麼，這顆蘋果糖是出乎意料的酸呢。小艾不相信的話，不如試試看。,
211211,,鄧艾,奇怪……那我就咬一口吧……唔，明明很甜啊……,
211301,蘋果糖攤-3,*,小艾，嘴角……,
211302,,鄧艾,嗯？,
211303,,鄧艾,是我的誤解嗎？總感覺學長時不時地盯著我看，是我臉上有什麼東西嗎？,
211304,,*,只是覺得小艾在焰火映照下真的非常美麗。,
211305,,鄧艾,都說過了，這種詞……,
211306,,鄧艾,誒？嘴角粘上了糖漿，果然在吃完蘋果糖後總覺得嘴角有些不自在呢。,
211307,,鄧艾,謝謝學長告訴我，那麼請恕我失陪一會兒，去好好整理一番。,
211308,,鄧艾,學長真的很貼心，非常感謝，手帕用完後會洗乾淨還給你的。,
211309,,*,總覺得有些後悔呢，小艾嘴角粘上糖絲的時候其實非常誘人哦，就跟蘋果糖一樣誘人。,
211310,,鄧艾,噓！學長，說這種話是會被風紀委抓起來的……,
212101,花火大會-1,*,時間不早了，想要看到花火的話，就需要早點過去才有好的觀景位置哦~,
212102,,鄧艾,既然如此，我們趕緊動身吧。,
212103,,*,果然，小艾來之前有好好瞭解過花火大會吧。,
212104,,鄧艾,只是，稍微地做了一些功課……避免因為什麼都不瞭解被笑話……,
212105,,*,小艾總是時時刻刻都嚴肅地對待自己呢……,
212106,,鄧艾,學長……是不喜歡這樣的習慣嗎？,
212107,,鄧艾,學長原來是這麼想的嗎？其實，我也有想稍微放鬆的時刻呢……,
212108,,*,誒？原來小艾也會疲倦的嗎？,
212109,,鄧艾,比如說現在……其實很想放肆一些呢。,
212110,,鄧艾,嚴肅認真……嗯……其實聽起來不是非常動人呢，更想聽到……類似溫柔體貼這樣的詞語。,
212111,,鄧艾,害怕、敬畏，不，其實我……,
212112,,*,什麼？,
212113,,鄧艾,其實我……的內心很柔軟……我也想要學長更溫柔地……,
212201,花火大會-2,,和鄧艾談話的時候，人群卻突然擁擠了起來。,
212202,,路人,這邊這邊，花火大會馬上就要開始了，要趕緊去搶佔好位置。,
212203,,,擁擠的人群從四面八方湧來，原本緊密相連的兩人漸漸被人群衝擊地拉開了距離。,
212204,,鄧艾,學長！你在哪裡？人群在推著我走……沒法掌控方向。,
212205,,*,不用擔心，我在這裡，永遠會陪在小艾身邊。,
212206,,*,很抱歉，小艾，稍微忍耐一下吧。,
212207,,鄧艾,嗯……我明白，這一次就勉為其難地原諒你吧。,
212208,,鄧艾,學……學長……太緊了，快要喘不過氣了……,
212209,,*,抱歉……（放開手臂）,
212210,,鄧艾,那個……我不是這個意思……,
212301,花火大會-3,,艱難地穿過人群後，終於來到了比較空曠的地方。,
212302,,*,小艾，很抱歉，剛剛的經歷好像很糟糕……還想看花火嗎？,
212303,,鄧艾,不，其實……對我來說今天的回憶已經足夠美好了……不如來決定去哪裡看花火吧~,
212304,,鄧艾,這樣看花火的話，感覺距離很近呢，近的能聞到空氣中的硝石味，還有……學長的氣息。,
212305,,鄧艾,儘管空中在綻放花火，但是這裡依舊感覺很寧靜啊。,
212306,,鄧艾,花火倒映在正泛起漣漪的湖水中，一圈又一圈，就像我此刻的心情……,
212307,,鄧艾,其實……這樣的選擇也不賴呢。無論在哪裡，只要能和學長在一起就好……,
213101,章魚燒攤-1,章魚燒店主,新鮮出爐的章魚燒，大家來嘗一嘗吧。,
213102,,鄧艾,啊，章魚燒……,
213103,,*,誒，小艾知道章魚燒嗎？,
213104,,鄧艾,嗯……是用了章魚鬚做成的小丸子，那個就是章魚鬚吧。,
213105,,*,直接把原材料擺在檯面上啊，真是信心十足呢，小艾想要嘗一嘗嗎？,
213106,,鄧艾,學長做決定就好……,
213107,,鄧艾,最本質的口味嗎？嗯……章魚鬚很有彈性，學長也請試試看吧。,
213108,,*,上面鋪了一層厚厚的海苔碎呢。,
213109,,鄧艾,嗯，海苔不僅讓口感變得更豐富，細細品嘗的話……有海風在輕輕訴說呢……,
213110,,*,小艾覺得黑胡椒味怎麼樣？,
213111,,鄧艾,胡椒的辣味勾出了章魚的鮮味，竟然意外的還不錯。,
213112,,*,竟然這樣的話，那我也來嘗嘗看吧……什麼呀，這黑胡椒味也太辣了吧，比芥末味還要辣！小艾竟然覺得還不錯嗎？,
213113,,鄧艾,誒？辣嗎？好像嘗不太出來呢……,
213114,,*,咳……咳，水……太辣了……,
213201,章魚燒攤-2,章魚燒店主,本店的章魚燒還可以DIY口味哦，這裡是各類醬料，如果有需要的話還請盡情使用吧。,
213202,,*,醬料品種意外的很豐富呢，小艾想要自己試試看嘛？,
213203,,*,美味！小艾是使用了什麼魔法嗎？,
213204,,鄧艾,只是簡單地加了幾樣調料，學長實在是太誇張了。,
213205,,*,小艾，嘗起來怎麼樣？有更美味一點嗎？,
213206,,鄧艾,嗯……味道的層次好像有點太豐富了呢……,
213207,,*,豐富？不是好事嗎？我嘗嘗看……,
213208,,*,這……這根本沒有辦法入口吧……,
213209,,*,章魚燒的味道已經很可口了，沒有再調配口味的必要。,
213210,,鄧艾,真的嘛……其實心底還蠻期待……學長調配的口味……,
213301,章魚燒攤-3,*,不知不覺就要吃完了呢，最後一粒就留給小艾吧。,
213302,,鄧艾,沒關係，學長吃吧。,
213303,,*,果然食物的最後一口是最美味的。啊……抱歉，太得意忘形了一點。,
213304,,鄧艾,不，沒有關係，學長開心的話我就很滿足了呢。,
213305,,鄧艾,誒，最後的這一顆，要留給我嗎？,
213306,,*,嗯，小艾難得表露對一個東西的喜歡，當然是要留給你咯，快趁熱吃吧。,
213307,,鄧艾,嗯……謝謝你，學長。,
