id,title,name,dialog,select_text
112108,,甘夫人,啊，學長剛剛是在誇獎我嗎？這種話，在這麼多人面前說我難免會手足無措的呢。,
112109,,甘夫人,只是小事而已啦，學長不用這麼生氣，我們趕快到座位坐下吧。,
112110,,甘夫人,不過……剛剛有一點點吃驚，原來溫柔的學長為了奴家竟然這麼man啊，真令人害羞。,
112201,觀眾席-2,甘夫人,不知不覺就到中場休息了，果然全神貫注的時間過的最快了。,
112202,,*,看來小甘真的很享受表演啊，連觀看別人的演出也這麼專心致志。,
112203,,甘夫人,舞蹈已經成為了奴家的一種習慣，習慣於認真地做好每一個舞姿，認真地揮動每一次手臂，觀看別人表演的時候更是習慣去比較去學習。,
112204,,甘夫人,原來學長是喜歡俐落的舞蹈嗎？真是出乎意料……那麼，待會兒奴家去剪一個俐落的短髮學長覺得怎麼樣呢？,
112205,,甘夫人,柔媚？那學長覺得奴家的尾巴夠不夠柔媚，富有動感呢？,
112206,,*,誒？尾巴？不是讓我評價剛剛的演出嗎？,
112207,,甘夫人,哼，是讓學長評價演出，不是評價演員！,
112208,,甘夫人,奴家可從來沒有表演過這場劇碼哦~學長自作聰明過頭了吧！,
112301,觀眾席-3,甘夫人,等一會兒，魔鬼就會從左側登場，然後會派出自己變身為白天鵝的女兒去吸引王子。,
112302,,甘夫人,令人期待的32圈揮鞭轉，一圈又一圈永不停歇。,
112303,,甘夫人,誒？學長為什麼都不說話，是因為奴家……太聒噪了嗎？真是抱歉，一時得意……,
112304,,甘夫人,誒？這種說法是作弊吧……不過學長溫柔看著我的目光也很美麗哦。,
112305,,甘夫人,誒？那麼以後學長可以多請奴家跳舞哦，因為奴家還有很多東西要告訴學長呢。,
112306,,甘夫人,誒？話很多……果然以後還是要嫺靜一點嘛……,
113101,紀念品店-1,店長,熱門女演員的海報，人氣歌唱家的簽名照，想要的紀念品這裡都有，都來看一看瞧一瞧咯。,
113102,,*,是紀念品店呢，小甘有想要帶走的手信嗎？,
113103,,店長,客人快看一看，這是新上市的舞台徽章套裝，非常適合這位小姐！,
113104,,甘夫人,奴家倒是覺得那邊的摺扇很是討巧可愛，還能為炎熱的氣氛送來一絲涼意。,
113105,,甘夫人,嗯~奴家都聽學長的~,
113106,,甘夫人,啊呀，學長原來這麼在意奴家的想法嗎？那麼……想要和學長在一起的心情，有成功傳達到嗎？,
113107,,甘夫人,這樣，會不會有點浪費啊……其實，奴家最想要的紀念品是……,
113201,紀念品店-2,*,看起來這家紀念品店非常大啊，裡面還有不少商品呢，小甘想要再逛逛嗎？,
113202,,店長,請兩位盡興，小店不僅有人氣演員的紀念物，還有已經告別舞台的演員紀念品哦。,
113203,,甘夫人,啊呀，這樣的話，有可能會遇見……學長，我們還是不要去了吧~,
113204,,*,嗯？突然怎麼了？小甘快看，那邊的掛畫人物好像是你呢~,
113205,,甘夫人,哎呀，這是……這是當時為了宣傳新劇專門拍攝的宣傳照。,
113206,,甘夫人,現在的攝像技術真是可怕呀，連奴家臉上的毛孔都拍得清清楚楚……,
113207,,甘夫人,誒？！學長這是做什麼，被盯著看的話心跳會加速啦！,
113208,,甘夫人,學長這是……這是在戲弄奴家吧！（害羞）,
113209,,甘夫人,雖然美麗，但是現實裡的小甘比宣傳照上更好看吧，也請學長多看看奴家吧。,
113301,紀念品店-3,*,嘴上說著不在意，到最後還是把所有關於自己的紀念品都買了一份……,
113302,,甘夫人,誒……一不小心好像快要把紀念品店搬空了呢……給學長帶來困擾了嗎？,
113303,,*,怎麼會？為這位小姐的美麗心情買單，我心甘情願~,
113304,,甘夫人,那麼如果從這些紀念品裡挑選的話，學長最喜歡哪一件呢？,
113305,,甘夫人,是因為能夠近距離觀察才選的這件嗎？那樣的話，學長不如每天多來看看奴家吧~,
113306,,甘夫人,猜中了！這件塑像的造型和配色都非常精緻呢，奴家也最喜歡它了~,
113307,,*,擺在房間裡的話，就像小甘時時刻刻在陪伴著自己呢。,
113308,,甘夫人,誒？說這種話……學長剛剛是在想什麼奇怪的事情吧！,
113309,,甘夫人,竟然選了超大的應援立牌，學長的喜好真的好難琢磨啊……,
113310,,甘夫人,誒？立牌上形象的胸部竟然比奴家的……啊！學長大變態！,
114101,劇院後台-1,演員學妹甲,這不是前輩嗎？今天怎麼有空來劇場，是來看我們的表演嗎？,
114102,,演員學妹乙,前輩！今天是我的第一次上臺演出，之前就超級期待前輩能夠來觀看，沒有想到願望真的實現了，真的好幸福啊~,
114103,,*,小甘在學妹中也這麼受歡迎啊~,
114104,,演員學妹甲,阿嘞，前輩，這位是？難不成是前輩的……,
114105,,演員學妹們,誒誒！果然就是情侶關係呀！,
114106,,甘夫人,啊呀，學長不要說這種容易讓人浮想聯翩的話啦~我們還沒有在交往啦~,
114107,,演員學妹們,誒？一起來看演出的普通朋友？很可疑哦……,
114108,,甘夫人,學長真是的，我們曾經都那樣子了，還只是普通朋友嗎？,
114109,,甘夫人,不要！不是都說了是奴家專屬的嘛！奴家才不願意和別人一起分享。,
114201,劇院後台-2,演員學妹甲,前輩快坐下，我們有很多舞蹈上的問題想要請教前輩呢~,
114202,,演員學妹乙,怎麼這樣？前輩難得回來，當然是要好好休息啦。對了，前輩，讓我們給您化妝吧，您也可以趁機看看我們的技術有沒有進步~,
114203,,甘夫人,好啊，讓我來看看這些日子裡你們有沒有好好練習~出個什麼樣的考題呢？學長來決定吧。,
114204,,演員學妹甲,太美麗了，雖然前輩是第一次畫這款妝容，但是美麗得讓人移不開眼睛。,
114205,,甘夫人,真的嗎？但奴家現在只想吸引……一個人的目光。,
114206,,演員學妹乙,怎麼樣？現在的前輩是不是很像不食人間煙火的仙子，學長都看呆了吧~,
114207,,*,嗯……小甘現在非常的美麗……,
114208,,甘夫人,真的嗎？好開心，被在意的人誇讚了呢。,
114209,,演員學妹甲,啊呀，這位學長臉紅了，是看到化上舞姬妝的前輩害羞了吧。,
114210,,甘夫人,臉紅了？要是發燒的話可不好了，學長再靠近一些，讓奴家摸摸額頭吧。,
114301,劇院後台-3,演員學妹甲,前輩告別舞台後還有在練習舞蹈嗎？因為馬上也要告別這樣每天進行舞蹈演出的日子了，心裡總有些擔心呢……,
114302,,甘夫人,每日每日都有在努力練習呢，萬人矚目也好，無人知曉也好，只有舞蹈是不會停下的。,
114303,,甘夫人,學長呢？學長有想要追逐一生的事物嗎？,
114304,,甘夫人,本是很溫柔的答案，但是對於現在的奴家而言，聽起來顯得格外的不溫柔呢，難道學長的心中對於奴家沒有多一份的……偏愛嗎？,
114305,,甘夫人,誒？竟然沒有想要與奴家一起達成的追求嘛？學長這麼說實在是太讓人不甘心了吧。,
114306,,甘夫人,奴家也希望接下來的每一天都能像今天一樣充實又平和，最重要的是可以有學長陪伴在身側。,
115101,舞台-1,*,表演好像已經結束了呢，大家都已經離場了，小甘，我們也離開這裡吧？,
115102,,甘夫人,等……等一下……學長，演出結束後舞台就空閒下來了吧……,
115103,,甘夫人,如果可以的話，奴家想去舞台上……,
115104,,*,想再去舞台上盡情舞蹈嗎？,
115105,,甘夫人,嗯！如果可以的話，請學長做奴家這場舞蹈唯一的觀眾。,
115106,,甘夫人,這種心情果然是沒有辦法跟別人共用的呢……,
115107,,甘夫人,學長說這種話，實在是把奴家看得太高了點，那麼就請學長欣賞接下來的這曲舞蹈吧。,
115108,,甘夫人,奴家相信只要足夠優秀，就算缺失了燈光，心意也可以傳達至觀眾的心裡，特別是，觀眾是學長時。,
115201,舞台-2,*,在這精心裝點的舞台上，小甘的舞蹈看起來更優雅動人了~,
115202,,甘夫人,是嘛？這還是奴家第一次站在這個舞台上卻只為一個人起舞呢。,
115203,,*,小甘之前可是擁有超高人氣的舞蹈家，我還記得告別演出那天，一票難求呢。,
115204,,甘夫人,奴家也記得那天熱鬧的場景，可惜……這一切已經不再屬於奴家了。,
115205,,甘夫人,就算是回到這裡，也只能一次次地表演給空無一人的劇場看吧……,
115206,,甘夫人,沒有人可以讓時光倒流吧……現在有學長注視著奴家，已經很幸福了哦。,
115207,,甘夫人,學長……其實學長沒有必要這麼安慰奴家的……而且，如果連最後一名觀眾的掌聲都無法收穫的話，奴家以後都不敢再稱自己是舞蹈家了呢。,
115208,,*,小甘是在說我的掌聲無足輕重了咯？,
115209,,甘夫人,學長誣陷人，奴家剛剛哪有這麼說？,
115210,,*,噗嗤，小甘真的很容易認真呢。騙你的哦，只要小甘笑了，我的目的就達到了。,
115301,舞台-3,*,舞蹈結束了，快點從舞台上下來吧，要小心臺階哦。,
115302,,甘夫人,嗯，學長放心，這裡奴家已經走過上千……誒誒！啊！,
115303,,,仿佛應驗了學長的烏鴉嘴，甘夫人下臺階的時候被裙擺絆住了，趔趄著就要和地面來個親密接觸。,
115304,,,從小到大練習的舞蹈讓甘夫人擁有了非比尋常的平衡掌控力，儘管在一瞬間有滑倒的跡象，但是馬上就重新掌握了重心，穩穩地踩到了下一級臺階上。,
115305,,甘夫人,學長……不用為奴家做到這般地步，其實，奴家還是能夠掌握平衡的……,
115306,,*,哈……哈哈，是我太弱了。不過還好是我受傷，如果小甘受傷的話一定會很痛吧。,
115307,,甘夫人,學長……能否請您放開奴家，這樣緊緊環繞的話，奴家快……沒法呼吸了。,
115308,,*,對……對不起！是我一時心急，竟然忘了禮儀，請小甘原諒我。,
115309,,甘夫人,沒關係，學長有這份保護奴家的心已經讓奴家很感動了~,
201101,摩天輪-1,*,嘿~小艾，這邊這邊~,
201102,,鄧艾,這次又是什麼？事先說明，太過危險的專案我是不會參與的，勸學長也早點打消這種想法。,
201103,,*,這次是摩天輪哦~坐上去的話就可以流覽整片城市的風光了，而且很安全。,
201104,,鄧艾,安全？這是這座遊樂場裡最高的建築了吧。如果我沒有猜錯的話，坐上去之後會被運送到最高點吧，學長有沒有想過如果卡在最高處要怎麼辦呢？,
201105,,鄧艾,這就是學長想到的解決辦法嗎？單純地依靠陌生人的力量，恐怕我的劍術無法答應。,
201106,,鄧艾,幸運……發生這樣的事情竟然是被稱為幸運嗎？,
201107,,*,當然！如果身邊是小艾的話，可以被稱為雙倍幸運了呢。,
201108,,鄧艾,這算什麼？把責任推在我身上嗎？,
201109,,*,是啊，因為我相信鄧艾的力量是可以保護我的。,
201110,,鄧艾,真是奇怪的幻想，劍以外的事物我明明很不擅長……,
201201,摩天輪-2,,雖然百般不情願，但是鄧艾最終還是同意了去搭乘摩天輪。,
201202,,鄧艾,事先聲明，到了高處的話學長千萬不要興奮地大聲喊叫哦，我不想被奇怪的目光打量。,
201203,,*,誒？小艾把人看扁了啦，我又沒有恐高症，是不會做出這樣的行為的。,
201204,,鄧艾,只……只是提前聲明，快點決定座位吧。,
201205,,鄧艾,學長你的眼睛在看哪裡啊？,
201206,,*,當然是……看艙外的景色啦……,
201207,,鄧艾,對面不是還有很寬敞的位置嗎，為什麼要坐在這邊？,
201208,,*,因為想要和小艾更靠近一點啊~坐在對面的話，沒有辦法像現在這樣近距離地觀察小艾了吧。,
201209,,鄧艾,(害羞）學長在說什麼我根本聽不懂，明明……就和平常一樣吧，不需要什麼近距離觀察。,
201301,摩天輪-3,,摩天輪緩緩升高，最終來到了最高處，艙外的視野愈發開闊了。,
201302,,*,小艾快看，那邊就是幽夢哦~,
201303,,鄧艾,這麼遠地觀察幽夢還是第一次呢~奇怪，這種感覺既陌生又熟悉，明明是每天生活的地方，卻仿佛從未認識它一般。啊！！,
201304,,,本來還在饒有興致地評價景色的鄧艾卻突然捂住了臉，將身體蜷縮進了座位深處。,
201305,,*,小艾？？小艾怎麼了？,
201306,,鄧艾,太……高了，我一不小心瞥到了腳下……,
201307,,鄧艾,很可笑吧，真正有恐高症的人是我……,
201308,,*,小艾在說什麼呀，忘記剛剛看到的東西吧，你看太陽落山的景色很美哦。,
201309,,*,來，深呼吸，有覺得好一點嗎？,
201310,,鄧艾,嗯……學長，對不起，上摩天輪之前不該和你這樣說話，真正有恐高症的其實是我。,
201311,,*,小艾之前有說什麼嗎？我已經完全不記得了哦。,
201312,,*,小艾既然害怕的話，就由我來為你描繪景色吧。現在窗外正是落日的場景，金燦燦的……,
201313,,鄧艾,噗嗤，學長的講述還真是沒有絲毫魅力呢。,
202101,旋轉木馬-1,*,怎麼樣，小艾想要坐那個嗎？,
202102,,鄧艾,如果我沒有記錯的話，這個是叫旋轉木馬吧……果然還是算了吧，坐這種東西的話會被說幼稚吧。,
202103,,*,誒，真的嗎？可是我看小艾的眼神明明透露著渴望啊。,
202104,,鄧艾,學長不要胡說，而且……去坐的只有小孩子，我已經不是小孩子了。,
202105,,鄧艾,雖然……不，我果然還是很在意別人的目光，所謂紳士就應該這樣。,
202106,,*,什麼紳士啊，現在的小艾可是在和我約會啊，難道不該最在意我的目光嗎？,
202107,,鄧艾,誒？學長在說什麼？你的目光……最不該在意了吧！,
202108,,鄧艾,既然你已經這麼說了，那我也只好勉為其難地答應你了。,
202109,,鄧艾,嗯……除了劍術以外的事情我果然還是不太瞭解，那……嘗試一下也沒有什麼問題吧。,
202201,旋轉木馬-2,,雖然覺得非常不好意思，但是鄧艾還是站在了排隊隊伍中。,
202202,,鄧艾,學長你……不要把這件事告訴別人哦……,
202203,,*,嗯？小艾指的是什麼事情？難不成，是乘坐旋轉木馬？,
202204,,鄧艾,嗯……不，不是……,
202205,,*,到底是不是呢？小艾可真是有意思呢。,
202206,,隊伍中的小朋友,媽媽，他們就是所謂的情侶吧，剛剛的對話就是在打情罵俏吧。,
202207,,鄧艾,這麼說的話……學長是很有經驗嗎？,
202208,,鄧艾,怎麼這樣，學長你這麼說的話，不就是在承認我們是在……,
202209,,*,嗯？我根本沒有承認什麼啊，小艾你在生什麼氣？,
202210,,鄧艾,可是……你剛剛是在指我們正在往真正的情侶方向發展吧……,
202211,,鄧艾,學長你在說什麼啊？降低標準……難道我只配得上低標準嗎？還有情侶什麼的，怎麼可以自己承認呢？,
202301,旋轉木馬-3,*,所以小艾果然是因為剛剛我的回答生氣了嗎？,
202302,,鄧艾,沒有……學長多慮了，我接受的教育是不會允許我因為這種事情生氣的。,
202303,,*,我還以為，小艾是因為我不承認是情侶才生氣的呢……沒生氣的話，就來決定想要乘坐的木馬吧。,
202304,,鄧艾,這種事情還需要做決定嗎？隨便挑就好了吧……,
202305,,*,那就由我來替小艾選擇吧。,
202306,,鄧艾,總感覺前後位置的木馬有一種悲涼的氛圍……距離明明這麼近，卻永遠觸碰不到對方。,
202307,,鄧艾,空餘位置還有很多吧，學長一定要坐在這裡嗎？,
202308,,*,是因為傳說乘坐旋轉木馬時坐在相鄰位置的兩人會收穫幸福哦。,
202309,,鄧艾,真的嗎？好可疑的說法，學長該不會是現編的謊話吧……,
202310,,鄧艾,旋轉木馬的話難道不是要乘坐木馬嗎？乘馬車也太奇怪了一點吧。,
202311,,*,坐在一起的話，就可以離小艾更近一點了啊~這位公主，這次就由我來擔任你的馬車手吧，請好好享受~,
203101,冰淇淋車-1,*,太好了，是冰淇淋車呢，小艾一定口渴了吧，要去看看要什麼冰淇淋嗎？,
203102,,鄧艾,冰淇淋……是點心吧？,
203103,,*,可以算是一種甜點哦，冰冰涼涼又很可口，這種天氣吃的話最合適了。,
203104,,鄧艾,那這種甜點，不，冰淇淋一定很昂貴吧……還是不要了吧。,
203105,,鄧艾,學長在胡說些什麼……我明明是指甜點這種東西不吃也無所謂的吧……,
203106,,鄧艾,失職……學長總是在說一些我聽不懂的話，明明是節省金錢，怎麼會失職呢？,
203107,,*,畢竟我們可是在約會誒~沒有照顧好小艾的話不就是失職嗎？,
203108,,鄧艾,難道冰淇淋也是隨便送人的東西嗎？,
203109,,*,如果是送給小艾的話，那當然就是最特別的啦。,
203201,冰淇淋車-2,*,不要擔心啦，快來看看有沒有想要的冰淇淋呢？,
203202,,鄧艾,抹茶、芒果、草莓、香草……還有特別的造型冰淇淋……,
203203,,*,是啊，品種看起來很齊全呢，小艾按自己口味挑選就可以了哦~,
203204,,鄧艾,那……學長先挑吧，我想再思考一會兒……,
203205,,鄧艾,草莓味嗎？看起來有點像粉紅色的雲朵……那，我也要一個草莓味的冰淇淋好了。,
203206,,鄧艾,誒？可以選擇兩種口味嗎？,
203207,,*,是哦，如果小艾喜歡的話，這個就給你咯~薄荷和巧克力其實特別配哦~,
203208,,鄧艾,是嗎？那我就嘗嘗看吧。,
203209,,*,小艾猜猜看我挑選了什麼造型呢？,
203210,,鄧艾,為什麼要猜……待會兒做好了不就可以看見了嗎？,
203211,,*,小艾還真是嚴肅呢……當當，是特別挑選的寶劍造型哦，和你的愛劍很像吧。,
203301,冰淇淋車-3,*,怎麼樣？冰淇淋是不是很好吃~,
203302,,鄧艾,嗯……勉勉強強可以稱得上是美味吧。,
203303,,*,小艾的冰淇淋要化了哦，要像我這樣，張大嘴巴咬上一大口。,
203304,,鄧艾,為了身體著想，還是不要吃的太快比較好……哎呀……,
203305,,鄧艾,學長，對不起……如果我早點聽話，冰淇淋也就不會化了。,
203306,,*,明明是小艾遭殃，為什麼要跟我說對不起？,
203307,,鄧艾,因為……是學長為我購買的東西，當然是珍貴的禮物……,
203308,,鄧艾,學長的手帕上有一股特殊的香味，是哪位學妹送給你的嗎？,
203309,,*,香味？小艾是吃醋了嗎？這一直都是我的手帕，只不過在今天見小艾前認真清洗過了，請小艾放心哦~,
203310,,鄧艾,誒？學長你這是準備做什麼？,
203311,,*,啊……準備幫小艾擦去冰淇淋的……對，對不起！,
204101,過山車-1,*,來遊樂園的話果然還是要坐這個吧！過！山！車！小艾，我們去排隊吧~,
204102,,鄧艾,等等……學長難道沒有聽到剛剛那些乘客的尖叫嗎？這是要被運去……殺掉吧……,
204103,,*,小艾不要太緊張啦~這裡的過山車可是好評滿滿，不坐的話實在是太可惜了。,
204104,,鄧艾,是嗎？可是看著有點可怕的樣子……,
204105,,鄧艾,胡說，我才不是因為……害怕，是因為擔心學長的安全才想阻止你的。不過如果學長這麼堅持的話，那只能勉為其難由我陪同了。,
204106,,鄧艾,誒？學長不打算去坐了嗎？,
204107,,*,嗯，小艾這麼抵觸的話還是算了吧~,
204108,,鄧艾,但是……剛剛學長很興奮吧……其實我……現在已經完全不害怕了，我們一起去排隊吧。,
204201,過山車-2,,雖然嘴上說著不害怕，但是鄧艾每向前移動一步，身體便要顫抖一下。,
204202,,*,小艾你很害怕吧，果然還是不該來坐。,
204203,,鄧艾,沒有……學長你誤會了，我只是……,
204204,,鄧艾,嗯……其實學長不用為我找這麼拙劣的藉口……你忘記我會使用冰系法術了嗎？,
204205,,鄧艾,誒？剛剛不是還興致滿滿嗎？唔，學長真是的，害怕這種事情應該早早說出來吧。,
204206,,*,是呀，如果害怕的話應該早早說出來，我記住了呢~,
204207,,鄧艾,啊！學長你剛剛……是在調侃我吧！,
204208,,鄧艾,學長在說什麼啊，我根本……不想去洗手間……,
204209,,*,啊呀，小艾不去的話……我突然很想去呢，小艾去隊伍外等我吧。,
204210,,鄧艾,學長真是……無禮啊，這種事情怎麼可以隨隨便便掛在嘴上呢？,
204301,過山車-3,鄧艾,學長……其實很想坐過山車的吧……,
204302,,*,沒有哦，過山車其實什麼時候都可以坐吧，但是有小艾陪伴的時間卻是有限的。,
204303,,鄧艾,真是抱歉，因為我的緣故……學長並沒有得到該有的快樂。就由我來補償學長吧，除了過山車，學長想要我做什麼呢？,
204304,,*,樂園裡除了這裡以外還有一架小型過山車哦，規模要小很多~相信小艾不會害怕的~,
204305,,鄧艾,真……真的嗎？那好吧……,
204306,,*,當然~不過，平常只有小孩子會坐那架過山車，嘻嘻，小艾待會兒的臉色一定很好看。,
204307,,鄧艾,唔，海盜船這種東西……應該比過山車要輕鬆吧。,
204308,,*,話可不要說太早哦~坐完小艾再發表評論吧……,
204309,,,坐完海盜船後,
204310,,*,怎麼樣？小艾覺得還是很輕鬆嗎？,
204311,,鄧艾,哼……也不怎麼樣嘛……想來，過山車也沒有看起來那麼恐怖吧……,
204312,,*,那要再去嘗試過山車嗎？,
204313,,鄧艾,等……等，我只是說說……（因為海盜船而嘔吐）,
204314,,*,小艾要穿好雨衣哦，否則全身上下都會濕透的……,
204315,,鄧艾,啊……衣服濕掉的話會很麻煩吧，一定要坐這個嗎？,
204316,,*,誒，不是說一定會滿足的特別補償嗎？怎麼小艾要反悔了嗎？,
204317,,鄧艾,沒……沒有的事……只是擔心自己頭髮和衣服濕掉的樣子很難看……,
204318,,*,好好穿好雨衣的話衣服是不會濕掉的，況且小艾濕頭髮的樣子也一定很可愛。,
205101,鬼屋-1,鄧艾,學長，這裡……是鬼屋吧……來這裡做什麼呢？,
205102,,*,小艾真可愛，來鬼屋的話當然是為了去體驗啊~,
205103,,鄧艾,可以……不去嗎？,
205104,,*,可是馬上輪到我們了吧，不去的話會很浪費哦。,
205105,,陌生的學妹,學長，待會兒進場的話可以站在我們前面嗎？稍微有點害怕呢，如果有學長的保護，可以稍微放心一點了呢。,
205106,,鄧艾,可……可是這本來是我和學長的約會吧……和別人一起分享什麼的……做不到……,
205107,,鄧艾,保……保護……不要開玩笑啦！我才不需要學長的保護呢……,
205108,,*,真的嗎？那小艾是答應進鬼屋了嗎？好耶！,
205109,,鄧艾,哼……就一次，勉為其難地陪你進場吧。,
205110,,鄧艾,學長你在說什麼啊，我又不能妨礙你做決定……,
205111,,*,我們現在可是在約會呢，難道小艾想要讓我去陪伴別人嗎？,
205112,,鄧艾,不，才不要……屬於自己的東西不應該輕易贈送給他人，這是對別人的不尊重。,
205201,鬼屋-2,*,準備好了嗎？小艾。,
205202,,鄧艾,嗯……,
205203,,*,那麼，要出發了哦~充滿著神秘與恐怖色彩的鬼屋，我們來啦！,
205204,,鄧艾,學……學長……,
205205,,鄧艾,學長，這是……幹什麼啊……,
205206,,*,我是不怕疼的木頭人哦，小艾害怕的話可以緊緊抓住我的右手，這樣就不會那麼害怕了。,
205207,,鄧艾,謝……謝學長。,
205208,,鄧艾,誒？牽手！？（臉紅）學長怎麼可以不經過允許自行牽手呢？,
205209,,*,哦呀，我的手剛剛不聽使喚呢~不過小艾，現在握的更緊的可是你哦。,
205210,,鄧艾,誒？學長？！！你在做什麼啊？,
205211,,*,當然是摟住小艾啊，怎麼樣，是不是很生氣，氣到想要教訓我？,
205212,,鄧艾,學長又在胡說，只是被摟了一下而已……,
205213,,*,但是小艾現在的臉很紅哦，而且現在已經不害怕了吧~目的達到了呢~,
205301,鬼屋-3,*,所以說今天可以購買特別的鬼屋表演嗎？,
205302,,工作人員,是的，只要支付一定金額就可以獲得特別定制的表演哦，保證給您和您的伴侶私人訂制的驚喜。,
205303,,*,不，你們誤會了，其實我們還不是……但是……先來看看有什麼特別表演吧。,
205304,,,進入鬼屋後,
205305,,鄧艾,好像也沒有那麼恐怖呢，是我錯怪學長了……還把學長的手握的這麼緊，學長有沒有受傷？,
205306,,*,沒有，小艾的力氣還傷不到我，不過……這種奇怪的失落感是怎麼回事？,
205307,,,進入鬼屋後,
205308,,鄧艾,啊！！,
205309,,*,小艾怎麼了嗎？,
205310,,鄧艾,剛剛有黏糊糊的東西纏住了我的腳……怎麼甩都甩不掉，我就只好……凍住它了。,
205311,,*,誒？？那是工作人員吧！,
205312,,,進入鬼屋後,
205313,,*,小艾？小艾你還好嗎？怎麼一直都在發抖？,
