id,title,name,dialog,select_text
305304,,*,不行，小亮可是要和我度過完整一天的，如果一直下棋的話，就沒有時間做其他事情了吧。,
305305,,下棋的學妹,嗯……學長在說什麼啊？除了公園難道你們還要去哪裡嗎？。,
305306,,諸葛亮,學長說的話太容易讓人誤解了啦。,
305307,,*,一定要下棋的話，不如讓我來當小亮的對手吧。,
305308,,下棋的學妹,（上下打量）學長不要說大話了，要跟上諸葛亮學姐對你來說太困難了點吧。,
305309,,諸葛亮,如果可以一直在一起的話，學會一兩招也說不定呢。,
305310,,*,不行，我可是小亮的伴侶，怎麼可以讓你參與進我們的約會當中。,
305311,,下棋的學妹,真的嘛？剛剛是誰不承認情侶身份的，現在轉身就吃起醋來，這種轉變實在是太突兀了吧。,
305312,,諸葛亮,不……不要再說啦，真是的，學長你說話的時候也要考慮一下我的心情啊。,
306101,扇子店-1,老闆娘,歡迎光臨~啊呀，是亮小姐呀，最近正好有一批新扇子剛剛到店，亮小姐要不要看一下？,
306102,,*,是小亮常來的商店嗎？看起來和老闆娘很熟悉呢~,
306103,,老闆娘,亮小姐可是我們這裡的常客，而且我們是很好的朋友哦~,
306104,,老闆娘,這位客人，現在可是獲得關於亮小姐情報的好時候哦~,
306105,,老闆娘,哦呀，客人竟然問了一擊即中的問題~嗯……該怎麼回答呢，應該說客人你非常lu[C]ky呢，這還是第一次見到……,
306106,,諸葛亮,老闆娘，在當事人面前販賣情報的行為可是不講禮儀的哦。,
306107,,老闆娘,嗯？客人確定要問嗎？還以為客人會對亮小姐的情感生活更感興趣呢~,
306108,,老闆娘,嗯……亮小姐的日常啊~應該說是……,
306109,,諸葛亮,學長有想要知道的情報可以直接來詢問我哦，畢竟已經被詢問過很多次了，多這麼一次也沒什麼關係……,
306110,,老闆娘,好無聊的人啊，這麼珍貴的機會竟然就白白放走了，以後會後悔的哦。,
306201,扇子店-2,老闆娘,新到的扇子很適合亮小姐呢，無論是清雅的竹紋還是華麗的繁花紋，不如都收下吧。,
306202,,諸葛亮,這一招對我而言已經失效了哦，果然還是最普通的風紋吧。,
306203,,老闆娘,太可惜了，除了亮小姐沒有別人更適合了吧……既然爭執不下，不如讓這位客人幫忙做決定吧。,
306204,,諸葛亮,果然學長是很瞭解我的呢~,
306205,,老闆娘,果然這位客人很有眼光呢，這可是名家的作品哦，這一次小店也只拿到了一把~亮小姐是最合適的使用者了。,
306206,,諸葛亮,這把扇子實在是太貴重了，抱歉學長，我不能接受你的建議。但是……如果學長喜歡竹紋的話，不如下次一起去畫翠竹圖吧~,
306207,,諸葛亮,這裡、那裡、這把扇子的每一個角落都被各式花朵覆蓋了，這把扇子實在是太浮誇了吧。,
306208,,*,扇子上的花瓣襯得小亮更美麗了，拿著這把扇子就像是攜帶著春天~,
306209,,諸葛亮,這樣的誇獎是認真的嗎？,
306210,,*,如果我說謊的話，小亮不是馬上就會發覺嗎？,
306211,,諸葛亮,暫時沒有發現撒謊的痕跡……,
306301,扇子店-3,老闆娘,兩位元選完扇子了需不需要再看看配件呢？購買了新扇子也需要好好裝扮一下吧~,
306302,,諸葛亮,這次就不用了~,
306303,,老闆娘,嗯……亮小姐是在說下次一定？不如趁現在讓這位客人幫忙挑選一下吧。,
306304,,*,既然小亮已經說過不用了，那我們就走吧~,
306305,,老闆娘,笨拙的伴侶真可怕，竟然讀不懂亮小姐話裡的意思！,
306306,,諸葛亮,幫了大忙了，這樣的扇盒一定可以很好地保護這把扇子~,
306307,,諸葛亮,流蘇太長了，好像會對日常行動造成影響呢……,
306308,,*,誒？抱歉，我根本沒有考慮使用是否便宜，只是覺得只有這扇墜才和小亮相配。,
306309,,老闆娘,真的真的，用上了扇墜之後亮小姐愈發動人了呢~,
307101,歇腳處-1,*,是歇腳處，不如坐下來休息一會兒吧，走了這麼久，小亮也一定累了吧。,
307102,,*,誒？小亮為什麼盯著我？,
307103,,諸葛亮,沒什麼，只是在想學長是對每一個學妹都這麼溫柔嗎？,
307104,,諸葛亮,滴水不漏的回答呢~只是對現在的我而言聽起來有些刺耳了……,
307105,,諸葛亮,不，在為難學長的是學長自己哦，有時候直面自己內心才是最好的選擇。,
307106,,諸葛亮,為什麼學長可以面不改色地說出這樣的話啊？難道是對不同的學妹說過了很多次？,
307201,歇腳處-2,諸葛亮,不知不覺在商店街逛了很久呢，稍微有些口渴了……,
307202,,*,小亮想要喝水嗎？,
307203,,諸葛亮,嗯……學長可以幫我解決這個難題嗎？,
307204,,諸葛亮,要把這唯一的一瓶水給我嗎？之後可就沒有辦法收回了哦~,
307205,,諸葛亮,因為如果兩人共飲的話不僅不夠衛生，而且會變成間接kiss哦，這樣是會給學長造成很大困擾吧~,
307206,,諸葛亮,是個好主意呢~不過要辛苦學長了，請放心，回來後我會為你擦掉汗珠的~,
307207,,諸葛亮,請恕我拒絕，口渴的時候喝糖分含量較高的飲品是無法解決問題的，只會感到更口渴。,
307301,歇腳處-3,*,起初邀請小亮的時候，我還以為小亮一定不會答應呢，畢竟小亮工作這麼繁忙，沒想到……。,
307302,,諸葛亮,沒想到我竟然會赴約？畢竟這是學長的邀請~我可是列了非常詳細的行程安排呢~,
307303,,諸葛亮,學長呢？有為這次約會做準備嗎？,
307304,,諸葛亮,好厲害，有種不謀而合的默契感呢。這種雙方一起努力的感覺，稍稍地被感動到了。,
307305,,諸葛亮,誒？特意準備的禮物？可以現在拆開看看嗎？,
307306,,*,可以……但是只是個小禮物，小亮可能會失望了。,
307307,,諸葛亮,不會哦，只要是學長準備的禮物，再小我都能感受到心意~,
307308,,諸葛亮,嗯？沒有回答嗎？,
307309,,諸葛亮,阿呀，學長的臉已經紅透了吧……沒關係，這就是最好的回答~,
308101,貓咪咖啡館-1,店員,歡迎光臨~啊呀，這位客人很眼熟啊，之前有來過我們店嗎？,
308102,,諸葛亮,誒？學長難道對這家店很熟悉？,
308103,,店員,不僅來過，還購買了套餐吧，看，會員名單中就有您的名字哦~,
308104,,店員,那麼這次要使用已購買的會員套餐嗎？,
308105,,店員,怎麼會呢？難道是我記錯了嗎？可是會員名單又不會說謊……,
308106,,諸葛亮,可能是因為……另一個學長來過這家店了吧~,
308107,,店員,好的，那麼這邊先幫你扣除使用次數，那麼請跟我來，貓咪們都在這邊~,
308108,,*,小亮，你聽我解釋……,
308109,,諸葛亮,沒關係，學長這麼溫柔的人經常來這麼溫暖的場所也是理所應當~,
308110,,諸葛亮,所以說，是因為這邊的貓咪非常可愛黏人，學長才辦理了會員套餐嗎？,
308111,,諸葛亮,嗯……難道沒有其他的理由了嗎？稍稍有點不信任呢……,
308201,貓咪咖啡館-2,店員,既然這位小姐是第一次來本店，那麼一定要體驗一下我們獨特的貓咪陪伴服務~,
308202,,店員,可以從下列貓咪中指定哦~,
308203,,*,灰灰是非常可愛的圓臉呢~但是今天好像有點……懶洋洋的？,
308204,,諸葛亮,灰灰稍微犯困了呢~嗯……也許是因為見到了不想見的人？,
308205,,諸葛亮,小斯真的是很漂亮啊，潔白的毛髮就像蒲公英一樣蓬鬆~還有一雙湛藍色的眼睛~,
308206,,諸葛亮,小斯，這邊……,
308207,,*,其實這邊的咖啡很好喝哦，小亮可以品嘗一下。等……咖啡裡怎麼好像有……,
308208,,諸葛亮,是小斯的貓毛哦~呼啦呼啦地飄進了學長的咖啡杯裡了呢~,
308209,,諸葛亮,誒？怎麼了？突然就上來蹭我嗎？這麼黏人的小貓咪可不多見~,
308210,,*,這邊這邊，小咪，這邊有零食哦~,
308211,,諸葛亮,噗嗤，看起來學長的零食攻擊好像失效了。,
308212,,*,哼……一定是因為小亮太好看了所以小咪才會這麼喜歡你的吧~,
308301,貓咪咖啡館-3,店員,非常抱歉現在打擾到二位，但是我們的貓咪陪伴時間已經到了哦，如果接下來還需要貓咪陪伴的話，要額外付費哦~,
308302,,諸葛亮,能夠像這樣一直撫摸著貓咪的話，真的非常愜意呢~,
308303,,*,那麼就讓貓咪再陪我們一會兒吧。,
308304,,諸葛亮,真的嗎？實在是太感謝學長了，呼……撫摸貓咪真的很治癒呢。,
308305,,諸葛亮,沒關係嗎？如果再延長的話花費要大量增加了吧？,
308306,,*,沒關係的，小亮不是感到很開心嗎，只是這樣我就很滿足了呢~,
308307,,店員,那麼請二位元放開貓咪，它需要回去休息了哦~,
308308,,諸葛亮,唔……總感覺沒有了貓咪，懷抱裡稍微有點空呢……,
309101,書店-1,*,呼，書店裡的顧客出乎意料的多呢~店裡的座位貌似都已經被坐滿了……,
309102,,諸葛亮,我還要去找幾本書，能拜託學長幫忙尋找座位嗎？拿到書之後我會來與學長會合。,
309103,,*,好的，請小亮一定要從人群裡發現我哦~,
309104,,*,好了，現在讓我看看哪裡還有座位呢……,
309105,,,經過一番尋找，在角落裡發現了還空餘著的兩張卡座，正當為完成任務感到開心時，卻有女孩子的聲音在背後響起。,
309106,,陌生的學妹,學長？請問我可以坐在這裡嗎？,
309107,,*,不可以哦，這裡是特意為在意的人保留的座位。如果讓給你的話，她一定會很生氣吧~,
309108,,諸葛亮,難道我在學長心中的形象就是動不動生氣嗎？,
309109,,*,誒？小亮，你已經找到書了嗎？剛剛我不是這個意思……,
309110,,諸葛亮,哦？那學長的「在意」是認真的嗎？,
309111,,*,你看那邊已經有空位了哦，可以去坐那邊吧？,
309112,,陌生的學妹,誒？這邊難道是為特別的人準備的位置嗎？,
309113,,*,要說特別的話……其實……,
309114,,陌生的學妹,學長的回答太模棱兩可了吧，果然這個人也不夠“特別”吧~,
309115,,*,可以哦，請坐~,
309116,,陌生的學妹,非常感謝！誒？但是學長為什麼要離開座位？,
309117,,*,因為已經答應了為在意的人保留座位，現在任務失敗了，還得繼續尋找才行啊~,
309118,,諸葛亮,發現你了！學長，我已經找到書了哦，還有座位，我們一起過去吧~,
309201,書店-2,*,無論是什麼時候小亮都在努力學習呢~,
309202,,諸葛亮,學長與其在這裡誇獎我，不如也去找找有沒有想要閱讀的書目吧，或許會有驚喜發現哦。,
309203,,*,唔……被小亮催促著學習了呢……,
309204,,諸葛亮,竟然選擇了懸疑類的小說，嗯……讓我看看……,
309205,,諸葛亮,學長，我有個秘密要告訴你哦~,
309206,,*,什麼樣的秘密？,
309207,,諸葛亮,秘密就是……最後的兇手其實是……,
309208,,*,啊！小亮實在……怎麼可以提前透露給我呢？,
309209,,諸葛亮,噗，因為學長吃驚的樣子真的非常可愛啊~忍不住想要看一遍又一遍呢~,
309210,,諸葛亮,誒，出乎意料得選擇了歷史書籍，學長是認真的嗎？,
309211,,*,難道我在小亮心中是這麼不愛學習嗎？哼……今天就讓我證明給小亮看~,
309212,,*,呼……呼……,
309213,,諸葛亮,噗嗤，說著要證明自己，最後還是睡著了呢，學長真的是一個笨~蛋~啊。,
309214,,諸葛亮,誒？！教科書？,
309215,,*,嗯！難得來一次書店，不如好好利用起來吧~,
309216,,諸葛亮,但是……如果想要補習功課的話，請教我要比閱讀教科書更有效吧……,
309301,書店-3,*,小亮~你看這一段描述，真的很有意思呢~,
309302,,*,誒？小亮？啊，已經睡著了嘛……果然，平常的工作太辛苦了啊……,
309303,,諸葛亮,嗯？唔……抱歉，因為一時放鬆竟然睡著了……學長等了很久吧？,
309304,,*,小亮只睡了半個小時哦……而且，這麼美麗的臉龐，就算盯著看一天都不會感到無聊呢。,
309305,,諸葛亮,什麼嘛？在別人睡醒後突然說這種讓人害羞的話……,
309306,,,正當學長靠近諸葛亮的耳朵準備輕聲喚醒她時，卻發現她的耳根意外地發紅。,
309307,,*,啊呀，小亮的耳朵怎麼變紅了，難道是因為太熱了嘛？,
309308,,*,既然小亮睡著了，不如我也稍微，嗯……只是稍微休息一下吧~,
309309,,,迷迷糊糊陷入昏睡時，耳旁似乎響起了諸葛亮的聲音。,
309310,,諸葛亮,學長真的是太容易鬆懈了吧，竟然毫無防備地睡著了……唉，真是讓人沒有辦法……,
310101,電玩店-1,*,小亮……這裡是電玩店吧……,
310102,,諸葛亮,是哦~學長有什麼問題嗎？,
310103,,*,不，沒什麼，只是之前以為小亮是絕對不會來這種地方的。,
310104,,諸葛亮,學長會這麼認為是因為根本不瞭解我吧~其實這個地方，我要比學長還要熟悉呢。,
310105,,*,等等……小亮，你看這邊，這是宣傳海報上說的新品吧。,
310106,,諸葛亮,好可愛，學長可以幫我拿到吧？,
310107,,*,沒問題，我一定可以幫你拿到~誒，讓我看看，左移一點，然後……抓取！,
310108,,諸葛亮,好像失敗了哦……,
310109,,*,沒關係，再試一次，一定可以為小亮抓到的~啊……又失敗了……,
310110,,諸葛亮,雖然沒有抓到娃娃，但是……學長的心意我已經成功收到了哦~,
310111,,諸葛亮,學長真的不想要嘗試一下嗎？,
310112,,*,抱歉，對抓娃娃這種事情我完全不擅長呢~,
310113,,諸葛亮,嗯……我一個人，也完全沒有問題……,
310114,,,仿佛為了證明自己，諸葛亮以100%的成功率抓取了娃娃機裡的所有娃娃。,
310115,,*,小亮好厲害啊~但是……總感覺好像有點不開心呢。,
310116,,*,方向感這種事情我真的很不擅長呢，所以要拜託小亮來掌握方向遙感，我會在合適的時機按下抓取按鈕的~,
310117,,諸葛亮,那麼……就是現在！學長快按下抓取鍵！,
310118,,*,抓到啦！拜託了，抓取爪一定不要鬆開啊！,
310119,,諸葛亮,還差一點，3、2、1，拿到了！學長好棒，果然我們的配合是無敵的！,
310201,電玩店-2,路人學妹甲,好厲害，又成功到達終點了！,
310202,,路人學妹乙,只是到達終點，根本不值得誇耀吧……看到最後的記錄排行榜了嗎？總有一天我會超越這個排名第一的傢伙！,
310203,,路人學妹甲,說起來，好像從來沒有在這家電玩店看見過這個叫「KM」的傢伙啊，根本不知道她是怎麼拿到這麼驚人的成績，3分19秒，這根本不是人可以做到的吧。,
310204,,*,誒……是賽車遊戲啊……3分19秒，真的非常厲害了吧~,
310205,,諸葛亮,學長很感興趣嗎？不如一起去試試看吧。,
310206,,*,呼……差點又被撞到了，看我在這裡彎道超車……啊，失敗了，完蛋了，這下要到不了終點了。,
310207,,諸葛亮,前輩……如果不介意的話，不如這裡由我來操控吧……,
310208,,*,可以嗎？那麼拜託小亮啦~,
310209,,*,一、二……所有的車都超過了，小亮好酷，完全把我之前造成的劣勢補平了！第一名！！,
310210,,諸葛亮,嗯……學長為什麼會想看我來操作啊？,
310211,,*,一定要有理由的話，可能是因為單純的相信小亮吧。,
310212,,諸葛亮,既然如此，不努力的話好像就要辜負學長的信任了呢……,
310213,,*,等等，新記錄……KM，原來小亮就是KM嗎？,
310214,,諸葛亮,噓，這是個不能說出去的秘密哦。,
310215,,諸葛亮,嗯……真的嗎？學長不敢看我的眼睛了吧，剛剛果然是在說謊！,
310301,電玩店-3,店員,今天店內有抽獎活動，兩位想要試一試嗎？,
310302,,*,獎品會有哪些呢？,
310303,,店員,獎品都在展示區哦，可以去那邊看看有沒有兩位想要的獎品。,
310304,,諸葛亮,啊呀！竟然是絕版的拉芙麗雕像！,
310305,,*,小亮很想要嗎？那我們就去抽抽看吧~,
310306,,*,嗯……選哪一張比較好呢？決定了，就是你！,
310307,,店員,請讓我看看，恭喜這位客人，獲得的是三等獎哦~,
310308,,*,三等獎的話，就不能挑選那個拉芙麗雕像了吧……抱歉，小亮，沒有幫你拿到想要的獎品。,
310309,,諸葛亮,沒關係，就算是三等獎，因為是學長幫忙抽取的我也很開心呢。,
310310,,諸葛亮,誒？讓我去嗎？,
310311,,*,嗯！畢竟我的手氣是出乎尋常的差呢，如果是小亮來的話一定會比我好很多吧。,
310312,,諸葛亮,既然如此的話……選擇這張吧。,
310313,,店員,請讓我看看，恭喜您，獲得的是二等獎哦~,
310314,,*,好棒！不愧是小亮！,
310315,,諸葛亮,但是……二等獎沒有辦法拿到拉芙麗雕像吧。,
310316,,*,約定好了哦，第一次我來抽取，下一次換小亮。這樣一定可以拿到絕版雕像吧。,
310317,,店員,請讓我看看，恭喜二位，分別抽到了三等獎和特等獎！客人的運氣真的很棒呢！抽到了唯一的特等獎哦。,
310318,,諸葛亮,誒……特等獎的話是不是可以換取拉芙麗雕像？,
310319,,店員,是的，請稍等一下，我來拿給您。,
310320,,*,果然！小亮真的是擁有絕佳的手氣啊！太棒了，達成心願了呢。,
310321,,諸葛亮,如果沒有學長的幫忙一定是拿不到的吧……現在實在是太感激學長了！,
311101,水上漂流-1,*,lucky！今天的漂流區開門了哦，小亮想要去玩嗎？,
311102,,諸葛亮,但是……漂流的話會把全身淋濕吧……對女孩子而言會很不方便啊……要是能提早準備泳衣的話……,
311103,,諸葛亮,誒……那邊的商店是……泳衣商店……竟然連這種東西都準備好了嗎？學長，現在要怎麼辦呢？,
311104,,*,我覺得這件很適合小亮哦~,
311105,,諸葛亮,那麼我去試穿一下吧……,
311106,,*,如何……,
311107,,諸葛亮,出乎意料的合身，果然……學長有在偷偷關注我的身材吧！,
311108,,*,小亮請大膽地挑選吧，就算是天價的帳單，我也會不眨眼地付掉的~,
311109,,諸葛亮,真的嘛？果然學長很體貼呢，難題解決了待會兒可以順利去漂流了~,
311110,,*,今天的天氣很好呢，陽光這麼強烈的話就算被淋濕了也會馬上被曬乾吧~小亮不用擔心哦，直接穿著衣服去漂流吧。,
311111,,諸葛亮,誒？學長的回答真的是糟糕透頂了，完完全全不懂女孩子啊！,
311201,水上漂流-2,*,嗚呼~現在在緩慢加速哦，馬上就要到最期待的時刻了~,
311202,,諸葛亮,啊！水流突然變得湍急了呢……學長……竹筏搖晃的很厲害，真的沒關係嗎？,
311203,,*,沒關係哦，就算竹筏被水流打翻，我也會陪在小亮身邊的。,
311204,,諸葛亮,真的嗎？那會像現在一樣牢牢握住我的手嗎？,
311205,,*,嗯！一直緊緊地握住，絕對不會放開~,
311206,,*,和小亮一起玩漂流真是太棒啦！,
311207,,諸葛亮,誒？學長為什麼突然大聲地……,
311208,,*,小亮也一起加入吧~用最大的聲音把心底的感受喊出來~,
311209,,諸葛亮,誒？我也要……和……學長一起玩漂流真是……太棒了！！,
311210,,*,小亮？怎麼了嗎？,
311211,,諸葛亮,沒關係……只是有一點點……害怕……,
311301,水上漂流-3,工作人員,現在已經漂流到緩水區了哦，緩水區非常安全，各位客人如果有需要可以下水玩耍哦~,
311302,,諸葛亮,下……水嗎？,
311303,,,諸葛亮小心翼翼地試探了一下水溫，又立馬縮回了手。,
311304,,諸葛亮,怎麼辦呢……,
311305,,*,怎麼樣？其實水流沒有想像中的那麼可怕哦~,
311306,,諸葛亮,嗯……非常涼爽，剛剛是我太過分擔心了……,
311307,,*,那麼……既然小亮已經適應了，就嘗嘗這招吧！,
311308,,諸葛亮,誒？學長！怎麼可以趁人不注意潑水呢？這太不紳士了吧！不紳士的人要接受懲罰！,
311309,,諸葛亮,雖然有點好奇，但是水流看起來還是很湍急……,
311310,,*,水流其實非常溫和哦~而且如果下水的話，我就可以用相機記錄下小亮最明媚的笑顏了吧~,
311311,,諸葛亮,全身濕透的樣子也值得記錄嗎？等等……學長這個舉動……很變態啊！,
311312,,*,其實我也害怕水流呢，既然如此的話不如待在竹筏上吧，曬曬太陽其實也很舒服哦~,
311313,,諸葛亮,抱歉……,
311314,,*,為什麼要道歉？明明是因為我拖累了小亮。來吧，小亮也躺下來感受陽光的溫度吧。,
312101,過山車-1,*,小亮是認真的嗎？,
312102,,諸葛亮,誒？學長是指什麼？難道是問……,
312103,,*,當然是指過山車啊，竟然主動提出要坐過山車，真的很讓人吃驚呢~,
312104,,*,不過既然是小亮的要求，當然要盡可能地滿足啦，走吧~,
312105,,諸葛亮,等……等一下……學長，那邊廣場的鴿子好像很可愛呢，我們先去看看它們吧。,
312106,,*,好哦，只要是小亮的請求，無論是什麼我都會答應的。,
312107,,諸葛亮,突然說這些……我明明沒有特別要求過什麼吧，學長真會讓人為難……,
312108,,*,好哦，但是，突然有些羡慕起這些鴿子了……,
312109,,諸葛亮,怎麼突然這麼說，難道學長也像變得像鴿子一樣胖？,
312110,,*,才不是，我是在羡慕這些鴿子可以吃到小亮親手遞出的食物~真好呢，不知道我有沒有機會呢？,
312111,,諸葛亮,什麼嘛，這種願望現在就可以實現啊！啊~張嘴~,
312112,,*,誒？怎麼突然要去喂鴿子？難道小亮是因為要坐過山車感到害怕了？,
312113,,諸葛亮,學長在胡說些什麼？我才不會害怕！我只是因為這些鴿子真的很可愛，所以才……啊！學長果然是笨蛋！,
312201,過山車-2,員工,兩位是一起的嗎？,
312202,,*,嗯，請幫我們安排在同一排。,
312203,,員工,非常抱歉，前方車廂好像只剩下唯一的位置了，不知道二位能否接受分開落座呢？,
312204,,*,既然是約會的話，當然是要坐在一起了，我們可以等待下一班，小亮覺得呢？,
312205,,諸葛亮,當然，只要能和學長在一起，多等待一會兒又算的了什麼~,
312206,,諸葛亮,不要……雖然坐過山車的時候會被困在座位上，但是……我還是希望坐在身邊的是學長……,
312207,,*,沒關係，那麼小亮先上去吧，我會坐下一輛的。,
312208,,諸葛亮,不要……學長根本不知道體諒人！實在是太過分了！,
312209,,*,誒？突然這是怎麼了？,
312301,過山車-3,*,聽說會有工作人員幫忙拍攝坐完過山車時候的照片……應該是在這裡吧？,
312302,,工作人員,當然，我們為每一位客人都拍攝到了最精彩的照片哦~,
312303,,諸葛亮,誒？那照片可以送給我們做紀念嗎？,
312304,,工作人員,當然可以留下來，不過，是需要花費的哦~,
312305,,*,小亮就算是害怕的樣子也非常可愛！這張照片果然應該送給小亮。,
312306,,諸葛亮,沒關係嗎？難道學長沒有想要留作紀念的想法？,
312307,,*,小亮就算是害怕的樣子也非常可愛！這張照片，我就不客氣地留下來了！,
312308,,諸葛亮,什麼嘛？起碼也要讓我看看吧！,
312309,,*,實在是太可愛了，根本不捨得分享呢~,
312310,,*,啊，和小亮一對比，我的樣子也實在是……這種尷尬的照片，還是不要留下來了。,
312311,,*,小亮，我們走吧。,
312312,,諸葛亮,誒？不打算買下照片嗎？怎麼這麼突然，學長是怎麼了？,
313101,碰碰車-1,工作人員,歡迎光臨，二位是想要體驗碰碰車吧~那麼就請讓我為二位元講解一下規則……,
313102,,*,繁瑣的規則講述就不用了，我對碰碰車可是非常熟悉了~,
313103,,工作人員,那麼請問二位是想要駕駛雙人車嗎？,
313104,,*,駕駛雙人車的話，小亮就可以欣賞到我帥氣的駕駛技術了哦~,
313105,,諸葛亮,真的嗎？那麼待會兒我一定會好好觀察的哦~,
313106,,諸葛亮,哦？學長是認真的嗎？,
313107,,*,當然，我可是對自己的駕駛技術非常有自信，小亮輸掉的話可不要哭鼻子哦。,
313108,,諸葛亮,那我們就……拭目以待~,
313109,,諸葛亮,誒？為什麼？這種時候不是應該選擇雙人車嘛？,
313110,,*,啊呀，非常抱歉，因為……我的駕駛技術非常糟糕，如果坐在一起的話小亮可能會收穫不好的體驗……,
313111,,諸葛亮,和學長在一起已經足夠美好了，完全不會被其他的東西影響哦。,
313201,碰碰車-2,*,嗯……好像只有這一輛雙人車了呢……,
313202,,諸葛亮,兩個人可以坐在一起已經很棒了哦，那麼學長我們待會兒要採用什麼樣的戰術呢？,
313203,,*,誒？戰術？碰碰車不是隨便開就可以了嗎？,
313204,,諸葛亮,大錯特錯哦，如果隨隨便便駕駛的話馬上就會被其他的人列為目標打敗，那樣可享受不到樂趣了。,
313205,,*,誒？怎麼感覺小亮比我更熟悉碰碰車的樣子。,
