id,title,name,dialog,select_text
353,,*,えっと……\nシンバルを叩いてる、サルのぬいぐるみ……,
354,,魏延,新しいメモもありますね……\n「ねぇ、驚いた？驚いた？ねぇ？」,
355,,魏延,あ、あはは……\nほ、ほら、アウラさん、やっぱり加減をね……,
356,,*,アウラァアア！！！！出てきやがれ！！！！,
357,,,その後、本探しは概ね順調に進んだ……,
358,,*,目当ての本が見つからないこと以外は……,
359,,*,ねぇ、魏延……,逆に壊された場所を探そう|別の場所を探してみよう
360,流れ星に願いを,*,壊された場所。さすがにそこには無いと思って、\nまだ探してないよね？,
361,,魏延,はい。,
362,,*,じゃあ、行ってみよう。,
363,,通りがかりの戦姫A,ん、あれ？ここに封筒が落ちてるよ？\nなんだろ、これ。開けてみよっと。,
364,,魏延,！？,
365,,*,ん？魏延、どうした……,
366,,通りがかりの戦姫A,「先輩へ、実は前からずっと……」\nアハハ、今時まだこんな漫画みたいなラブレターを\n書く人がいるんだね！,
367,,*,ねぇ、魏延！ラブレターだって！\n僕、今までもらったことないんだよね。\nいいなぁ……,
368,,魏延（青羽）,だ、だめーーーー！（ド―――ン）,
369,,*,えっ、ちょ、ぎ、魏延……さん！？,
370,,通りがかりの戦姫A,たまたま拾っただけなのにーーー！,
371,,,あぁ……空はなんて青さ……,
372,,,ちょっと……飛びすぎじゃない……？,
373,,通りがかりの戦姫B,巻き込まれたぁあああ～～～！,
374,,バニラ,あれ？何かが空を飛んで行ったような……,
375,,バニラ,ハッ！？もしかしてアウラかもです！\nこらああ！待ちなさ~い！！！,
376,,,こうして訳も分からないまま、\n怒涛の一日が終わりを迎えた……\nいったい、なんだったんだ……,
377,,*,もしかしたら、風で飛ばされてるかもしれない。\n中だけじゃなくて、もっと他も探してみよう。,
378,,魏延,そうですね。,
379,,,学園の中心,
380,,*,今日の学園、いつもより賑わっているね。,
381,,魏延,ええ、そうですね……,
382,,*,ねえ魏延、ずっと気になってたんだけど、\n手紙ってどんな内容なんだ？,
383,,魏延,えっ、そ、それは……,
384,,*,ん？どうしたんだ、魏延？\nあれ、顔が赤いけど、大丈夫？,
385,,魏延,だだだ、大丈夫です！,
386,,魏延,そ、その、ちょ、チョコレートのレシピです！,
387,,*,へぇ、レシピかぁ～。,
388,,*,魏延がそこまで大事にしているレシピなら、\nきっとすごいものなんだろうね。,
389,,魏延,そ、それほどでも……,
390,,*,（ありゃ、魏延かなり落ち込んでるな……\nなんとかしないと！）,
391,,魏延,えっ、せ、先輩！？どうして急に手を……！？,
392,,*,魏延、あそこで何かやっているみたいだよ！\n息抜きにちょっと見に行ってみようよ！\n……って、すごく顔赤いけど、本当に大丈夫？,
393,,魏延,ら、らいじょうぶれふ……,
394,,魏延,そ、それより、先輩、これは……,
395,,*,「30分クッキング！チョコ作り大会」だって。\n飛び込み参加もできるみたいだよ？参加してみる？,
396,,魏延,えっ、その、でも……！？,
397,,*,大丈夫、レシピがなくても、\n魏延ならきっとすごい物が作れるよ！,
398,,*,ほら、よく言うじゃない？\n料理には愛情が何よりも大切だって！,
399,,魏延,あ、愛情なんて……,
400,,*,まぁ、僕は役に立たなそうだけどね～。,
401,,魏延,そ、そんなことありません！,
402,,*,あはは、そう言ってくれると嬉しいね。,
403,,,会場は既に人で溢れかえっていた。,
404,,魏延,あぁ……緊張しますね、先輩……ん？,
405,,魏延,先輩？なんか私より緊張していませんか？,
406,,*,あれ？これ塩だったのか！砂糖はどこだ？,
407,,*,えっ、ナッツってこんなに種類あるんだ！？,
408,,*,あっ、ヤベッ！？\n牛乳こぼしちゃった……,
409,,魏延,……,
410,,魏延,う、うん！私、頑張らないと……！,
411,,魏延,先輩、ここは私に任せてください。,
412,,魏延,たまには私が頼りになるところ、\n見ていてくださいね。,
413,,魏延,先輩は……そうですね……\n力仕事があったら、頼んでもいいでしょうか？,魏延って料理上手なんだな！|ご、ごめんね……
414,,*,頑張ってる魏延は、\nいつも以上に輝いて見えるな～。,
415,,魏延,せ、先輩、からかわないでください……,
416,,魏延,（でも、ちょっと嬉しい……）,
417,,魏延,あっ、出来上がったみたいです！,
418,,魏延,先輩、オーブンから取り出して貰えませんか？,
419,,*,あはは……僕ってダメだな……,
420,,魏延,そ、そんなことありませんよ、先輩！,
421,,魏延,先輩が傍にいるだけで、\n私、頑張れる気がします！,
422,,魏延,先輩が料理下手でも……,
423,,魏延,わ、私が……作って……あげますから……（ボソ）,
424,,*,ん？最後あまり聞き取れなかったけど……,
425,,*,フォローありがとうね。,
426,,魏延,できました！,
427,,*,おお、魏延かっこいい！,
428,,魏延,先ほどはすみません……\n先輩を顎で使うような真似を……,
429,,*,いやいやいや！的確な指示で動きやすかったよ。\n輝いていたよ、魏延！,
430,,魏延,そ、そんなこと……（カァァァ）,
431,,*,魏延はもっと自信を持って良いと思うよ！,
432,,魏延,あ、あまり褒めないでください……,
433,,*,いや、言うぞ！今日の魏延は本当に凄かったよ！,
434,,*,このチョコだって、たった世界に一つしかない、\n魏延が頑張って作ったチョコだよ？,
435,,*,どんなブランド品よりも価値があるよ！,
436,,魏延,先輩……,
437,,魏延,あの、先輩……よろしければこのチョコ、\n貰っていただけませんか？,
438,,魏延,あっ……先輩と一緒に作っておいて、\nこんなこと言うのもおかしいですよね。\nごめんなさい……,
439,,*,そんなことないよ！嬉しいよ！,
440,,*,あはは、今年最初のバレンタインチョコだよ。\n大事に食べるね！,
441,,魏延,先輩の……最初のチョコ……,
442,,魏延,良かった……（ボソ）,
443,,,満面の笑みの魏延を見て、思わずドキドキした。,
444,,,チョココンテストには行けなかったけど、,
445,,,笑顔の魏延が見れただけでも、\n最高のバレンタインだと思えた。,
446,君に花冠を,*,龐統がネックレスに執着するなんて珍しいね。\nよっぽど大事な物なのかな？,
447,,龐統,えっと、その、実は手作りの物でして……,
448,,*,手作り？すごいね！,
449,,龐統,いえ、そんなに立派な物では……,
450,,*,立派だよ！\nそっか、それじゃあ見つけないとね！,
451,,*,とりあえず今の状況を教えてくれないかな？,
452,,龐統,そうですね……\n私の推測では、昨晩学園に侵入した二人組に\n盗まれたんだと思います。,
453,,*,えっ？侵入者とかいたの？,
454,,龐統,けっこう大騒ぎになってましたけど……\nよく眠れましたね？,
455,,*,あ、あはは……\n一度寝たらなかなか起きない方なんだ……,
456,,龐統,あっ、いえ、\n決してバカにしてる訳ではありませんよ！,
457,,龐統,コホン。学園に侵入した二人は\n「大事な物を盗んだ！」と犯行声明を出していて、,
458,,龐統,恐らく私のネックレスも、\nその騒動で持っていかれたのではないかと……,
459,,龐統,最近噂になっている怪盗で、\nどうやらかなり腕が立つそうです。,
460,,*,それは大変だね……,
461,,龐統,多くの生徒がいる中、まさか誰にも捕まらず、\n犯行を成功させるとは……,
462,,*,それは敵ながら感心しちゃうね。,
463,,*,それで？龐統のネックレスはどんな物？\n宝石がついてるとか、どんな形だとか……,
464,,龐統,その、バラです……,
465,,*,バラ？バラの形の装飾がついてるの？,
466,,龐統,いえ、バラで作ったんです。,
467,,*,えっ？生花で作ったってこと！？,
468,,龐統,はい。\n少々不格好ですが、頑張って作りました。,
469,,*,凄いじゃないか！今度僕にも作ってくれよ！,
470,,龐統,その、実は……（カァアア）,
471,,*,あっ、あちちちち！,
472,,,突然、龐統の炎が暴走した――,
473,,龐統,ご、ごめんなさい！大丈夫ですか！？,
474,,*,あ、あはは、このくらいへっちゃらさ……,
475,,龐統,えっと……とにかく、思い入れのある品なので、\nどうしても取り返したいのです。,
476,,*,（こんな龐統、初めて見たな……）,
477,,龐統,先輩、難しい顔してますが、大丈夫ですか？,
478,,*,……,
479,,*,とりあえず、思い当たる場所を探してみよう。,犯人は侵入者じゃない可能性もあるし|どこかに落ちてるかもしれないし
480,真実の代価,*,うーん、名のある怪盗なら、\n目的以外の物は取らないと思うんだよね。,
481,,*,まぁ、龐統の作品がすごすぎて、\n思わず手を出してしまった可能性も勿論あるけど。,
482,,龐統,もう、先輩ったら！（グーパンチ）,
483,,*,グヘッ！？（顎にクリティカルヒット）,
484,,龐統,あっ、えっ！？\nか、軽くたたいたつもりだったのに！？\nすみません、先輩！,
485,,龐統,えっ、ちょっと、先輩！先輩！\nしっかりしてください！,
486,,,慌てる龐統の顔を横目に、僕は気を失った……,
487,,,ふっ、ナイスなパンチだったぜ……,
488,,*,昨日作ったんだよね？\nその後に持って行った場所を探してみよう。,
489,,龐統,そう、ですね……\n私の早とちりかもしれませんし。,
490,,*,そもそもどこで作ったんだい？,
491,,龐統,えっと、温室でお花を貰った後、\n教室で作りました。,
492,,*,じゃあ、まずは教室からだね。,
493,,龐統,はい！行きましょう！,
494,,*,（よかった、少し元気が出たようだな。）,
495,,*,やっぱり、元気な龐統が一番だね。,
496,,龐統,ん？何か言いましたか？,
497,,*,いや、早く行こうか。,
498,,*,それにしても、そこまで大事にするということは、\nもしかして誰かにあげるつもりだったのかな？\nいいな～。,
499,,龐統,えっ、はい……あっ、いえいえ……,
500,,龐統,その……初めてにしては良い出来だったので、\n記念にと思いまして……,
501,,*,ほう？,
502,,龐統,あとは、その、良い出来だったので……あっ……,
503,,*,あはは、ループしてるよ。,
504,,龐統,あまりからかわないでくださいよ……,
505,,*,ごめんごめん。\nあっ、そんなこと言ってる間に教室だ。,
506,,龐統,さ、探してきます！,
507,,,その後、自習室、グラウンドも探したが、,
508,,,どこにもネックレスはなかった。,
509,,,女子トイレは……さすがにないか？,
510,,*,うーん、どこもなかったね……,
511,,龐統,やはり盗まれちゃったのでしょうか……,
512,,*,龐統にこんな顔にさせるなんて、\n本当に許せないな！,
513,,*,ごめんね……見つけてあげられなくて……,
514,,*,でもまぁ、こんなこと言うのもあれなんだけど……,
515,,龐統,なんですか？,
516,,*,侵入者のおかげで、\nバレンタインに龐統を一人占めできたなって。,
517,,龐統,先輩……,
518,,*,いや、侵入者は許せないけどね！,
519,,*,ごめんね、変な話して……\nん？ねえ龐統、あそこにあるのって……！,
520,,龐統,えっ！？ああああ！,
521,,龐統,ご、ゴミ箱に……！マーガレットが！,
522,,*,……マーガレット？,
523,,龐統,あっ、いえ、その……\n初めての作品で、思わず名前を付けちゃいました。,
524,,*,あはは、何かかわいらしいね……,
525,,龐統,その、先輩、どうでしょうか？\n少し汚れちゃいましたけど……,
526,,*,大丈夫、凄く綺麗だよ。,
527,,,（でも、ちょっとサイズが小さいかな……？）,
528,,龐統,あ、でも今更だけど、\nこの大きさだと頭通りませんね……,
529,,*,そうだね……\nでも花冠だと思えば、凄く良い出来だと思うよ。,
530,,,龐統は少し考えた後、,
531,,,マーガレットについた汚れを取り、\n僕の方へ差し出した。,
532,,*,えっと、龐統……さん？,
533,,龐統,花冠、ですか……ちょっと格好がつかないけど、\nこれを先輩に差し上げます。\n受け取って、くれますか……？,
534,,,（えっ、それってまさか……）,
535,,,夕日のせいか、龐統の顔が少し赤く見えた。,
536,,*,あ、ありがとう……,
537,,,（この流れは……間違いない！）,
538,,龐統,あと、これを……！,
539,,*,これは！,
540,,龐統,マーガレット作りで忘れてましたが、\nバレンタインはチョコを送るのが主流だと\n聞いたので、急遽買ってきました。,
541,,*,買ったって……えっ、いつ！？,
542,,龐統,えっと、女子トイレ内を探しに行った時です……,
543,,龐統,出て来た時、先輩が何やら夢中で\nアリの行列を見てたので、邪魔するのもあれだし、\nその隙にお礼も兼ねてチョコを買ってきました。,
544,,*,いや、呼べよ！,
545,,,（あっ、うん、こりゃ本命ちゃうわ……）,
546,,龐統,えっ！？ご、ごめんなさい……\nとっても真剣な顔をしていたので……,
547,,*,（朝から頭がちょっとグラグラするし、\n女子トイレで何か悶々と……）,
548,,龐統,やっぱり、色々と恰好がつきませんね……,
549,,龐統,でも、そのですね……,
550,,龐統,私も、先輩を今日一日一人占めできて、,
551,,龐統,本当に嬉しかったです！\nありがとうございます、先輩！,
552,,,龐統の笑顔が眩しい。,
553,,,（僕じゃなきゃ、\n勘違いでコロッと行っちゃうね、絶対。）,
554,,,チョココンテストは残念だったけど、\nこの笑顔を見られただけで、,
555,,,最高のバレンタインだと思えた。,
556,最強コンビ？,*,絶対に犯人を見つけ出すぞ！,
557,,坂本龍馬,ほぅ、やる気が出たみたいやか。,
558,,*,重罪だよ、重罪！\nバレンタインのチョコを奪うなんて万死に値する！,
559,,坂本龍馬,（まぁ、ワシは懸賞金狙いだけんど！）,
560,,坂本龍馬,ほんなら行こう。\n口先だけやないっちゅうこと、証明しいや。,
561,,*,やったるわい！,
562,,坂本龍馬,まずは手がかり探しぜよ。,
563,,,30分後――,
564,,*,（龍馬、体力あるな……）,
565,,*,（いや、元傭兵なんだし当たり前か……）,
566,,坂本龍馬,おいおい、もう終いかえ？\nなっさけないのう。,
567,,*,いやいやいや、30分間学園中を走り回って、\nそれはないでしょ！？,
568,,*,こっちはごく普通の一般生徒なんだよ！\n傭兵上がりの龍馬と比べないでよ！,
569,,坂本龍馬,よぉ言うで。,
570,,*,そういう龍馬は何か掴めたのか？,
571,,,何というか……\nあまりちゃんと調べていない感じがした。,
572,,,ただただ色んな場所を走り回ってはいるが、\n一つ一つの場所をしっかり調査しようとは\nしていない様子だった。,
573,,坂本龍馬,ワシを見くびるなよ？\nどうせあちこち見て回りゆうだけやと\n思ってるんやか？,
574,,坂本龍馬,ワシの勘がこの方向に何かあるって\n訴えちゅうき！,
575,,*,結局勘かよ！？,
576,,,しかも、コイツ、\nあまり勘は良くなかった気がする……\n博打で毎回負けてるし……,
577,,坂本龍馬,さぁ、見えたぜよ！\nここが重要な手がかりがある場所き！,
578,,*,……お化け屋敷？,
579,,,生徒会、\nよくバレンタインにこんな企画を通したな……,
580,,,てかコイツ、遊びたいんだけじゃ……？,
581,,坂本龍馬,あぁ？なんや、お主？\nまさか、怖いがか？,
582,,*,ほほう？,行ってやるよ！|どう考えてもおかしいだろう？
583,ダンジョンじゃん！,*,アンデッド系モンスターの討伐で慣れてるし！\nこ、こんな作り物なんか……,
584,,坂本龍馬,いやいや、無理せんとえいぜよ～？,
585,,*,（こ、こいつ……）,
586,,坂本龍馬,えいえい。お主が怖がって入れんかったこと、\n秘密にするき、安心しいや。ま、格安でな？,
587,,坂本龍馬,ほんならワシは行ってくるき、\nお主はここいらで震えて待ちや！,
588,,*,言わせておけば……,
589,,*,僕が先に入ってやるよ！ほら――\n（勢いよく扉を開く）,
590,,,ドカーン,
591,,*,何じゃこりゃぁあああああ～～～！,
592,,坂本龍馬,おお、高う飛んだにゃあ……,
593,,坂本龍馬,ハッハッハッ。こ～んな簡単なトラップに\n引っかかりゆうとは、まだまだじゃき。,
594,,坂本龍馬,てか出店側、何やお化け屋敷のこと、\n勘違いしちゅうやないが……？,
595,,坂本龍馬,これじゃあ、どっちかっちゅーと\nまるでダンジョンじゃか。,
596,,,そう言うと、龍馬は迷わず中へと入っていた。,
597,,,だから！\n何でバレンタインにお化け屋敷作るんだよ！？,
598,,,そう心の中でツッコみをいれつつ、\n僕の意識はそこで途絶えた。,
599,,*,何でお化け屋敷なんだよ！？,
600,,坂本龍馬,一番危ない場所が一番安全とは、\nよぉ言いゆうもんじゃか～。,
601,,坂本龍馬,盗んだモンを隠すには、うってつけの場所ぜよ。,
602,,*,（コイツ、絶対遊びたいだけだろ！？）,
603,,*,ん？\n「正面から入るな」？何だこりゃ？,
604,,坂本龍馬,文字通りぜよ。\nそこを開けると、トラップが発動するき。,
605,,,ちょっとちょっと！\n出店側、お化け屋敷のこと何か勘違いしてない？,
606,,,これじゃあ、ダンジョンだよ！,
607,,坂本龍馬,ほら、行くぜよ！何をグズグズしゆうが？,
608,,*,……ちょっと準備してくる。,
609,,,5分後、龍馬と合流した。,
610,,坂本龍馬,な、なんじゃこりゃあ？,
611,,*,いや、その……\n準備は万端の方がいいだろう？,
612,,坂本龍馬,……小心者にゃあ。\nダンジョンに潜る訳でもあるまいに。,いや、どう見ても怪しいだろ？|それより、どこから入る？
613,,*,トラップがある時点でお化け屋敷じゃないか！,
614,,坂本龍馬,やれやれ、しょうがない先輩さんじゃき……,
615,,坂本龍馬,ほれ、気合入れて行くぜよ！,
616,,*,痛っ！？ちょっと力加減考えてくれよ……,
617,,坂本龍馬,まっこと頼りないのう……\nもっとシャキッとしいや！,
618,,*,ん？ちょっと待って、あれは……何だ！？,
619,,*,正面からはダメか……どうする？,
620,,坂本龍馬,昨日の騒動で色々忙しいんやろ？知らんけんど。,
621,,*,てか、店の責任者どこだよ！？,
622,,坂本龍馬,昨日の騒動で色々忙しいんじゃろ？知らんけど。,
623,,？？？,ガァアアアア！,
624,,*,なっ！？\nどっからこんなデカい怪物つれて来たんだよ？\nやっぱダンジョンじゃん！？,
625,,坂本龍馬,まぁ、魔力で出来てるモンやき、\nこんなのただのマヤカシぜよ。,
626,,*,す、すげぇリアルだな……,
627,,坂本龍馬,それはほら、出店した人の趣味やないが？\n知らんけんど。,
628,,*,その語尾、気に入ってるのか？,
629,,*,（魔力の反応が多いのは、そのせいなのか……）,
630,,*,やっぱダンジョンじゃん！！！,
631,,坂本龍馬,お主こそ、そのツッコみを流行らせたいんか？,
632,,*,流行る気がしないな。,
633,,坂本龍馬,流行らんやろうな。,
634,,？？,ガァアアアア！,
635,,*,おお！？,反撃する|龍馬に飛びつく
636,前と後ろ、どっち？,*,どりゃあああ！,
637,,坂本龍馬,あっ、お主待つぜよ……！,
638,,,ドン！,
639,,坂本龍馬,……あくまでも「お化け屋敷」やき、\n攻撃は全部跳ね返されるように作っちゅうぜよ……,
640,,,それにしたって、出力間違っているだろう！？,
641,,,吹っ飛ばされ、壁に頭を打った僕は、\n心の中でそうツッコみ、意識を手放した。,
642,,坂本龍馬,これ、普通なら逆じゃないか？,
643,,*,ご、ごめん……,
644,,*,不意打ちだったんだ、しょうがないだろう？,
645,,*,それにしても、龍馬は落ち着いてるね。\nで、どこから探す？,
646,,坂本龍馬,いや、まずはクリアするぜよ！,
647,,*,へ？どうした？,
648,,坂本龍馬,見ろ！\n「お化け屋敷をクリアした人に限定プレゼント！」\nって書いてあるき！,
649,,*,やっぱダンジョン……ってもう疲れたよ……,
650,,坂本龍馬,行くで！限定プレゼントのために！,
651,,*,だから手がかり探しはどうした！？,
652,,*,（はぁ、こうなったらしょうがない……）,
653,,*,（止めても聞かないだろうし……）,
654,,*,（さっさと終わらせよう！）,
655,,*,行くぞ！！！,入口の方へ走る|出口の方へ走る
656,絶望の牢獄,*,僕はもうここからさっさと出るぞ！！！,
657,,坂本龍馬,あっ、バカモン！,
658,,坂本龍馬,戻ったら……！,
659,,*,ふぇ！？,
660,,*,（急に地面が消えた！？）,
661,,*,ああああああああ～～～！,
662,,坂本龍馬,説明に書いちょったろう？\nルールを破ったら罰があるぜよ。,
663,,*（地底）,（地下から）痛たたた……って、牢屋！？\nここから出してくれ！,
664,,坂本龍馬,製作者がこじゃんと気合を入れた結界を\n貼っちゅうき、無理ぜよ。\nまぁ、せいぜい半日程度で解けるで。じゃあな。,
665,,*,えっ！？りょ、龍馬？\nおーい！？龍馬さーーーーーん！！！,
666,,,こうして僕のバレンタインは\n牢屋の中で終わった……,
667,,,やっぱダンジョンじゃねぇかぁあああ！,
668,,,シュッ！,
669,,*,あで！？\nいってぇ……トラップ多すぎやしないか？,
670,,坂本龍馬,これぐらい察知して避けてくれ……\nって、お主そこは……！\nちぃと遅かったか……気を失っちゅうし……,
671,,,その後……,
672,,*,ん？ここは……？,
673,,坂本龍馬,外ぜよ。,
674,,*,えっ？,
675,,坂本龍馬,お主を抱えてあのダン……お化け屋敷から出るのは\nげに大変だったき。まぁ、限定品はいただいたで。,
676,,*,お、おめでとう？,
677,,,（てか、手がかりは！？）,
678,,坂本龍馬,さーって、犯人探しに戻るぜよ！,
679,,*,（やっぱり遊びたかっただけか！！！）,
680,,*,はぁ……てか、珍しくやる気があるね。\n龍馬はあまり、こういう犯人探しとか\n興味ないと思っていたよ。,
681,,坂本龍馬,ん？そりゃあ、ちびっ子会長が怒って、\n侵入者に懸賞金を賭けよったき。,
682,,*,えっ？初耳だけど……,
683,,坂本龍馬,情報は鮮度が大事ぜよ。\nおまけにチョココンテストで余ったチョコも\n優先で貰ってえい言うき……,
684,,*,よし、龍馬！さっさと行くぞ！\n侵入者を見つけ出すぞ！,
685,,坂本龍馬,お主の気合スイッチはどこにあるのか、\nイマイチわからんな……\nまっ、別にえいけんど。,
686,,諸葛亮,おーい、龍馬！,
687,,坂本龍馬,おや、ちびっ子会長や。,
688,,諸葛亮,ちょうどよかった、人手が足りなくてな。\n君にチョコの護送を頼みたい。,
689,,坂本龍馬,ん？,
690,,諸葛亮,ああ、会場の大きさの都合上、\nコンテストを前半と後半に分けたんだ。,
691,,諸葛亮,前半の作品は知っての通り……くっ……,
692,,諸葛亮,なので、残りの作品の輸送護衛を頼みたい。\n無論、報酬は出すぞ！,
693,,坂本龍馬,よっしゃ、任せとき！,
